index	starts	ends	content
592	00:38:25.280	00:38:27.200	and the World Bank is working with many of our
593	00:38:27.210	00:38:29.790	client countries, and we want to be there before the
594	00:38:29.800	00:38:32.470	event, rather than after the event. And at this point,
595	00:38:32.480	00:38:35.700	very quickly, the ability to predict? As I say, hurricanes
596	00:38:35.710	00:38:38.130	we can predict very well now. We have to use
597	00:38:38.140	00:38:41.680	that same technology for other countries, such as Bangladesh, India,
598	00:38:41.690	00:38:44.450	China, and we can predict the El Niño event, which
599	00:38:44.460	00:38:48.160	is precipitation, mainly changes, drier or wetter, probably six to
600	00:38:48.170	00:38:49.950	nine months in advance. Well, that's all the time we
601	00:38:49.960	00:38:52.780	have. I thank you all very much. Still to come
602	00:38:52.790	00:38:56.320	on the NewsHour tonight, the layoffs at Boeing and a
603	00:38:56.330	00:39:11.310	conversation about Cambodia. Rod Minott of KCTS-Seattle reports the Boeing
604	00:39:11.320	00:39:15.620	story. In early December, Boeing made the stunning announcement that
605	00:39:15.630	00:39:19.810	it would eliminate 48,000 jobs over the next two years.
606	00:39:19.820	00:39:22.230	That's twenty thousand more than what the company had said
607	00:39:22.240	00:39:25.010	it would cut last summer. The loss of jobs will
608	00:39:25.020	00:39:29.120	reduce Boeing's work force by twenty percent. Workers coming off
609	00:39:29.130	00:39:32.660	the day shift at the 737 plant near Seattle blamed
610	00:39:32.670	00:39:36.120	senior management for causing the layoffs. They're supposed to be
611	00:39:36.130	00:39:40.050	getting six figures a year. They're supposed to be planning
612	00:39:40.060	00:39:43.570	ahead fifteen years. What the hell did they do? So
613	00:39:43.580	00:39:45.300	who gets to keep their job? The guys at the
614	00:39:45.310	00:39:47.220	top get to keep their jobs, the guys at the
615	00:39:47.230	00:39:50.980	bottom, we go out. Machinist Anthony Carson said the news
616	00:39:50.990	00:39:55.330	hit workers hard. Morale is like--it's kind of--it's
617	00:39:55.340	00:39:57.930	very low at this point--it's very low, because you
618	00:39:57.940	00:39:59.130	don't know if you're going to have your job the
619	00:39:59.140	00:40:03.800	next day so your clarity is gone, so it's kind
620	00:40:03.810	00:40:06.070	of tricky at this point because people are trying to
621	00:40:06.080	00:40:08.800	base things off a day-to-day life and that's kind of
622	00:40:08.810	00:40:11.340	hard to do when you have a house payment and
623	00:40:11.350	00:40:14.540	have a car payment. Boeing management blames the layoffs on
624	00:40:14.550	00:40:18.440	the economic crisis in Asia. Alan Mulally heads the commercial
625	00:40:18.450	00:40:24.280	airplane division. Approximately 25, 28 percent of our total airplane
626	00:40:24.290	00:40:28.140	production output goes to Asia, and so the concern that
627	00:40:28.150	00:40:32.720	we have, of course, is that our production looks very
628	00:40:32.730	00:40:37.440	solid for 1999, but this worsening situation of the economies
629	00:40:37.450	00:40:42.790	in Asia will decrease the need for new airplanes, especially
630	00:40:42.800	00:40:46.480	in the year 2000 and 2001. The economic turmoil has
631	00:40:46.490	00:40:50.080	caused many Asian airlines to cancel or delay plane orders
632	00:40:50.090	00:40:53.980	from Boeing. Jin Cho is with Asiana, a South Korean
633	00:40:53.990	00:40:57.900	airline that recently cut back its Boeing 747 flights from
634	00:40:57.910	00:41:00.870	Seattle to Seoul. Yes, we have been cutting back on
635	00:41:00.880	00:41:05.000	flight schedules because we sold off a couple of planes
636	00:41:05.010	00:41:10.960	to reduce the, I think, short-term debt to make our
637	00:41:10.970	00:41:15.640	accounting book a little better. Most of the production cuts
638	00:41:15.650	00:41:20.730	will hit the 747 jumbo jet, Boeing's most profitable plane.
639	00:41:20.740	00:41:24.370	The company plans to reduce production from about three 747
640	00:41:24.380	00:41:26.650	planes a month to two at the end of next
641	00:41:26.660	00:41:31.450	year. Manufacturing could drop as low as one 747 every
642	00:41:31.460	00:41:37.390	month in the year 2000 if market conditions worsen. Airline
643	00:41:37.400	00:41:41.140	industry analysts say both Boeing managers and the Asian crisis
644	00:41:41.150	00:41:44.170	are to blame for the company's woes. Some also cite
645	00:41:44.180	00:41:49.030	fierce competition with AirBus, the European consortium that also manufacturers
646	00:41:49.040	00:41:54.050	commercial jets. According to University of Washington economist Charles Hill,
647	00:41:54.060	00:41:57.970	aggressive rivalry with AirBus led Boeing to seek record sales
648	00:41:57.980	00:42:01.410	at unprofitable prices. They have this notion that they have
649	00:42:01.420	00:42:03.890	a God-given sixty percent of the market and they were
650	00:42:03.900	00:42:05.850	going to get that sixty percent of the market, whatever
651	00:42:05.860	00:42:07.940	it took, and if that took deep discounts on the
652	00:42:07.950	00:42:09.600	prices of planes, they were going to do it, if
653	00:42:09.610	00:42:12.110	that took accelerated deliveries, they were going to do it.
654	00:42:12.120	00:42:16.070	The aggressive marketing paid off. Boeing doubled its production within
655	00:42:16.080	00:42:19.370	the last two years. But Hill says the company wasn't
656	00:42:19.380	00:42:22.750	equipped to handle it all. Some customers complained of delayed
657	00:42:22.760	00:42:27.420	deliveries and even poor workmanship on jets. So they basically
658	00:42:27.430	00:42:30.320	met their delivery schedule by hiring far more people than
659	00:42:30.330	00:42:32.830	they historically would have done, but as a result of
660	00:42:32.840	00:42:35.420	aggressively going after market share, they suddenly found they had
661	00:42:35.430	00:42:37.390	to produce far more planes than they thought they would
662	00:42:37.400	00:42:40.040	have to do in a very short space of time,
663	00:42:40.050	00:42:44.660	before they'd fully implemented their manufacturing process improvements. Tim Goree
664	00:42:44.670	00:42:46.970	was one of those workers brought on to help Boeing
665	00:42:46.980	00:42:50.850	get through its production crunch. Last September, he'd been hired
666	00:42:50.860	00:42:54.770	to help assemble wings on the new 777 wide-body jet.
667	00:42:54.780	00:42:57.320	With no seniority, he was laid off after working at
668	00:42:57.330	00:43:05.480	Boeing for only three months. I was shocked. The main
669	00:43:05.490	00:43:07.380	thing going through my mind was what are we going
670	00:43:07.390	00:43:10.260	to do for the bills. Well, I heard rumors before
671	00:43:10.270	00:43:12.280	we actually got our warn notices, but I really didn't
672	00:43:12.290	00:43:13.690	think that I was going to be affected in the
673	00:43:13.700	00:43:16.750	first round. Goree claims Boeing told him that he would
674	00:43:16.760	00:43:19.650	have a job for at least two years. Now he
675	00:43:19.660	00:43:23.930	worries how $360 in weekly jobless pay will cover his
676	00:43:23.940	00:43:29.040	family's expenses. We're not financially set. You know, we don't
677	00:43:29.050	00:43:32.710	have a savings account. We've been living week to week,
678	00:43:32.720	00:43:37.240	you know, paycheck to paycheck, and four kids and a
679	00:43:37.250	00:43:40.100	house payment, and everything, it's pretty tough, you know, especially
680	00:43:40.110	00:43:42.740	now that I don't know where the money's going to
681	00:43:42.750	00:43:46.790	be coming from. Boeing says it's facing tough economic times
682	00:43:46.800	00:43:50.460	too. Its share of new orders for commercial aircraft has
683	00:43:50.470	00:43:53.320	shrunk to fifty percent in the face of competition with
684	00:43:53.330	00:43:56.780	AirBus. In addition, the aerospace giant had to deal with
685	00:43:56.790	00:44:01.130	the economics of a huge merger with McDonnell-Douglas last year.
686	00:44:01.140	00:44:04.120	The company also posted its first annual loss in fifty
687	00:44:04.130	00:44:08.760	years in 1997. Economist Hill says Boeing has to become
688	00:44:08.770	00:44:12.110	more efficient in order to become more profitable. If you
689	00:44:12.120	00:44:16.560	look at productivity at AirBus, it takes 143 employees to
690	00:44:16.570	00:44:19.280	build an aircraft at AirBus; it takes 216 employees to
691	00:44:19.290	00:44:22.200	build an aircraft at Boeing. That's a very telling statistic
692	00:44:22.210	00:44:24.120	that tells you something about the belt of efficiency of
693	00:44:24.130	00:44:26.800	these two operations at this point in time. Boeing's Alan
694	00:44:26.810	00:44:30.260	Mulally, who heads the commercial plane division, points out that
695	00:44:30.270	00:44:33.430	the company has, in fact, started implementing changes to beat
696	00:44:33.440	00:44:37.030	the profit problem. He says Boeing is becoming more efficient
697	00:44:37.040	00:44:40.700	in its manufacturing and remains on schedule to deliver a
698	00:44:40.710	00:44:44.050	record number of jets next year. We have a commitment
699	00:44:44.060	00:44:47.280	to deliver the 620 airplanes next year. That looks really
700	00:44:47.290	00:44:51.840	good. The airlines want them. We're getting the airplane's production
701	00:44:51.850	00:44:55.210	system back in sequence where it's getting healthy again. We're
702	00:44:55.220	00:44:59.420	delivering airplanes, we're producing the airplanes. When we said we
703	00:44:59.430	00:45:01.850	were going to make them, the quality of the airplanes
704	00:45:01.860	00:45:06.120	gets better every day with every airplane, so the whole
705	00:45:06.130	00:45:10.310	team has rallied around getting our production health back from
706	00:45:10.320	00:45:13.600	this tough situation we've been. I think that through '99
707	00:45:13.610	00:45:15.420	and going forward, I think it'll give us a good
708	00:45:15.430	00:45:18.910	base to get back to a--you know--a profitable
709	00:45:18.920	00:45:22.940	and a healthy Boeing. Meantime, economist Dick Conway thinks the
710	00:45:22.950	00:45:26.010	Seattle area will weather the blow of the Boeing layoffs
711	00:45:26.020	00:45:29.680	because its economy is more diversified than in the past.
712	00:45:29.690	00:45:34.870	Back in 1970, when Boeing also had about 100,000 workers
713	00:45:34.880	00:45:39.420	in the area, the company accounted for about one in
714	00:45:39.430	00:45:45.040	three jobs in the entire economy here. Today, it's closer
715	00:45:45.050	00:45:50.260	to one in six jobs. That's why we figure that
716	00:45:50.270	00:45:55.370	we're better able to withstand a Boeing downturn--quite apart
717	00:45:55.380	00:45:59.950	from the fact that the anticipated cutbacks at Boeing are
718	00:45:59.960	00:46:02.310	quite a bit less than they were back in 1970.
719	00:46:02.320	00:46:04.630	But airline analysts say it could take up to five
720	00:46:04.640	00:46:08.050	years for Boeing to rebound. They say for Boeing to
721	00:46:08.060	00:46:12.170	survive, it must become more efficient and in the future,
722	00:46:12.180	00:46:25.680	that will mean building jets with far fewer workers. Finally
723	00:46:25.690	00:46:29.770	tonight a conversation about Cambodia. More than a million citizens
724	00:46:29.780	00:46:32.710	of that Southeast Asian nation died during the reign of
725	00:46:32.720	00:46:36.960	the Khmer Rouge government in the late 1970s. Today Cambodian
726	00:46:36.970	00:46:41.050	Prime Minister Hun Sen welcomed home two former Khmer Rouge
727	00:46:41.060	00:46:44.090	leaders and said it was time to bury the past.
728	00:46:44.100	00:46:49.720	Terence Smith recently recorded this conversation about Cambodia. After nearly
729	00:46:49.730	00:46:53.190	thirty years of war and turmoil, Cambodia today is a
730	00:46:53.200	00:46:57.350	crippled nation. An American journalist who has charted that country's
731	00:46:57.360	00:47:02.000	decline has written a powerful new book, "Cambodia, Report from
732	00:47:02.010	00:47:05.390	a Stricken Land." He is Henry Kamm, a Pulitzer Prize
733	00:47:05.400	00:47:09.110	winning former foreign correspondent for the New York Times. And
734	00:47:09.120	00:47:12.010	he joins us this evening. Henry, welcome. Hello, Terry. A
735	00:47:12.020	00:47:14.780	A little full disclosure I think is necessary here. You
736	00:47:14.790	00:47:16.960	and I have worked together. A good deal. Have been
737	00:47:16.970	00:47:20.360	friends for years and worked together, including in Southeast Asia.
738	00:47:20.370	00:47:23.030	Including in Southeast Asia and the Middle Eastern war at
739	00:47:23.040	00:47:28.670	one point. Tell me. Describe for me what Cambodia was
740	00:47:28.680	00:47:31.850	like--when you first went there nearly thirty years ago.
741	00:47:31.860	00:47:34.800	When I first went there, Cambodia was an--I suppose
742	00:47:34.810	00:47:37.970	it's a cliche to say--an island of peace in
743	00:47:37.980	00:47:42.660	wartorn Indochina. It was an--and its capital was a
744	00:47:42.670	00:47:47.130	very well tended city of broad avenues, lovely parks, and
745	00:47:47.140	00:47:50.670	above all, smiling faces and nowhere a threat of a
746	00:47:50.680	00:47:53.620	grenade to being thrown to break up dinner. Right. It
747	00:47:53.630	00:47:58.760	was pleasant. It was an exquisite place. Yes. And today?
748	00:47:58.770	00:48:05.190	Today, Cambodia is a country that remains devastated by the
749	00:48:05.200	00:48:08.610	various wars that have been waged in this territory. Its
750	00:48:08.620	00:48:14.500	roads are in horrid condition. Its cities have become--and
751	00:48:14.510	00:48:18.540	there are many, as you know--cities have become overcrowded,
752	00:48:18.550	00:48:22.940	overrun by rural populations in search of something better than
753	00:48:22.950	00:48:27.040	the totally impoverished life. Instead, they find in the cities
754	00:48:27.050	00:48:30.620	an equally impoverished life--no employment--and, above all,
755	00:48:30.630	00:48:34.220	they find--wherever they are--city or countryside--they find
756	00:48:34.230	00:48:39.020	a government that shows not a smidgen of interest in
757	00:48:39.030	00:48:44.570	their wellbeing. You write, in fact, of rural people, ordinary
758	00:48:44.580	00:48:47.330	Cambodians, who have flocked to the cities, living--what you
759	00:48:47.340	00:48:50.260	describe as an essentially rural life in the streets of
760	00:48:50.270	00:48:53.030	Phnom-Penh. Yes. Right. What do you mean? Rural life would
761	00:48:53.040	00:48:56.500	mean that you do not find your place in the
762	00:48:56.510	00:49:02.600	city. Your place begins with employment. It goes through steady,
763	00:49:02.610	00:49:06.360	permanent housing of some kind; it goes with schools that
764	00:49:06.370	00:49:09.090	are ready to receive your children and it goes with
765	00:49:09.100	00:49:13.670	the minimal services that, above all, medical services, that simply
766	00:49:13.680	00:49:17.580	are not available. And you talk about them tending livestock,
767	00:49:17.590	00:49:20.800	chickens, and what not, on the streets. They bring with
768	00:49:20.810	00:49:23.350	them what they can because the city offers them almost
769	00:49:23.360	00:49:26.970	nothing. And so, yes, there are chickens; there are pigs;
770	00:49:26.980	00:49:30.650	and occasionally even a buffalo walking down the main street.
771	00:49:30.660	00:49:34.900	You know, the most recent reports from Cambodia might suggest
772	00:49:34.910	00:49:38.180	a reason for hope. The last known group of Khmer
773	00:49:38.190	00:49:44.030	Rouge guerrillas recently surrendered. And now for better or for
774	00:49:44.040	00:49:48.830	worse there is an ostensibly united government under Hun Sen
775	00:49:48.840	00:49:52.240	that seems to have the blessing of King Sihanouk. Are
776	00:49:52.250	00:49:57.900	these hopeful signs? They are signs that are significant to
777	00:49:57.910	00:50:04.150	the .1% of the Cambodians who share in power. They
778	00:50:04.160	00:50:08.110	are of no significance to the 99.9% who have power
779	00:50:08.120	00:50:14.100	exercised upon them. The surrender of the Khmer Rouge was
780	00:50:14.110	00:50:20.150	a dead body that has now--one supposes been finally
781	00:50:20.160	00:50:23.790	buried. But they have been of no importance in Cambodia,
782	00:50:23.800	00:50:31.240	thank goodness, for the last two years. The election merely
783	00:50:31.250	00:50:35.830	ratified a totally irregular state of affairs that existed before,
784	00:50:35.840	00:50:39.330	namely that Hun Sen, who was put in power by
785	00:50:39.340	00:50:44.240	the Vietnamese invasion that took place in 1979, and who
786	00:50:44.250	00:50:48.030	never throughout the various exercises of politics that have occurred
787	00:50:48.040	00:50:52.130	in Cambodia since then, particularly the large United Nations' two
788	00:50:52.140	00:50:56.470	billion dollar enterprise that was supposed to bring peace, happiness
789	00:50:56.480	00:51:00.360	to the Cambodians--he maintained power throughout this--he lost
790	00:51:00.370	00:51:06.420	the UN-sponsored elections in 1993, but bludgeoned his way into
791	00:51:06.430	00:51:11.410	power, into a share of power. He gave to Sihanouk's
792	00:51:11.420	00:51:16.360	son, Prince Ranariddh the title of First Prime Minister but
793	00:51:16.370	00:51:19.470	the title of First Prime Minister is about as meaningful
794	00:51:19.480	00:51:22.670	as the notion of democracy in Cambodia. It was Hun
795	00:51:22.680	00:51:27.180	Sen and his machine, which has run Cambodia since then.
796	00:51:27.190	00:51:29.360	In the middle of last year he got tired of
797	00:51:29.370	00:51:35.060	having even this advertising sign of democracy, Ranariddh, with him
798	00:51:35.070	00:51:37.870	in sharing power, and threw him out in the coup
799	00:51:37.880	00:51:40.290	d'état, drove him out of the country. This was not
800	00:51:40.300	00:51:43.440	accepted by the international community. It's very difficult to accept
801	00:51:43.450	00:51:47.640	the overthrow of a regime that the entire world sponsored
802	00:51:47.650	00:51:52.050	into office. And so a compromise had to be arranged,
803	00:51:52.060	00:51:55.360	and since Prince Ranariddh likes power and money as much
804	00:51:55.370	00:51:58.770	as Hun Sen does, he accepted once more a place
805	00:51:58.780	00:52:01.510	in this new regime. But this is of no meaning
806	00:52:01.520	00:52:03.930	to the people of Cambodia. Hun Sen will continue to
807	00:52:03.940	00:52:08.290	rule with an iron fist. And King Sihanouk, formerly Prince
808	00:52:08.300	00:52:12.000	Sihanouk, the man who kept the balancing act going for
809	00:52:12.010	00:52:14.420	so many years? The man who did a splendid job
810	00:52:14.430	00:52:18.750	until he was--there were many flaws--but the essence
811	00:52:18.760	00:52:24.170	was that Sihanouk until 1970--until his overthrow--kept Cambodia
812	00:52:24.180	00:52:28.380	out of war. But since then he has grown aged,
813	00:52:28.390	00:52:35.370	he is very ill with cancer, and his power is
814	00:52:35.380	00:52:39.300	like the Pope's; he has no armies. And so he
815	00:52:39.310	00:52:43.090	has to consent to whatever is offered to him in
816	00:52:43.100	00:52:47.920	order at least to remain king and possibly try with
817	00:52:47.930	00:52:50.470	the very little power that he has to prevent the
818	00:52:50.480	00:52:52.950	worst. I think that he knows that he is doomed
819	00:52:52.960	00:52:55.880	not to succeed in that. You know, you mentioned earlier
820	00:52:55.890	00:53:00.440	the $2 billion effort--Yes.--by the United Nations in the
821	00:53:00.450	00:53:03.260	early 90s to come in to impose a ceasefire and
822	00:53:03.270	00:53:05.780	to hold elections. Right. For a while it seemed to
823	00:53:05.790	00:53:08.930	be a great success story and was pointed to that
824	00:53:08.940	00:53:11.180	way. But, in fact, that is not the case, is
825	00:53:11.190	00:53:13.690	it? It was painted as a great success because the
826	00:53:13.700	00:53:18.180	United Nations did a rather clever trick. The Paris agreement
827	00:53:18.190	00:53:21.520	under which they came into Cambodia to pacify it and
828	00:53:21.530	00:53:25.970	to hold elections was meant to pacify it, and all
829	00:53:25.980	00:53:29.510	of the parties in the Cambodian conflict signed on to
830	00:53:29.520	00:53:33.200	a surrender of their military. The Khmer Rouge were the
831	00:53:33.210	00:53:37.940	first ones to resent--to refuse to give up the
832	00:53:37.950	00:53:42.640	power; therefore, all the others followed suit, and so an
833	00:53:42.650	00:53:46.470	agreement that was supposed to bring peace and to demilitarize
834	00:53:46.480	00:53:52.220	Cambodia was never respected, and then the United Nations sort
835	00:53:52.230	00:53:55.490	of hid this away and said the purpose was to
836	00:53:55.500	00:53:59.640	hold free elections. These elections were held, but, again, their
837	00:53:59.650	00:54:05.580	result was vitiated. What does it say to you, who've
838	00:54:05.590	00:54:09.080	traveled the world widely and seen UN efforts elsewhere, what
839	00:54:09.090	00:54:12.740	does it say about the limits of this kind of
840	00:54:12.750	00:54:16.920	UN intervention? It's not entirely the United Nations' fault. It's
841	00:54:16.930	00:54:21.070	the fault of the major powers who bring about UN
842	00:54:21.080	00:54:26.560	resolutions and make UN decisions. The major powers raised no
843	00:54:26.570	00:54:33.020	objection when this United Nations-sponsored agreement was totally ignored really
844	00:54:33.030	00:54:36.460	and not really applied. You speak in your book of
845	00:54:36.470	00:54:42.640	a country beyond helping itself and have a suggestion at
846	00:54:42.650	00:54:47.860	the end about what might be the answer. It is
847	00:54:47.870	00:54:52.800	less than a suggestion, Terry. I feel that the Cambodian
848	00:54:52.810	00:54:57.510	elite, the Cambodian political elite, which is greatly diminished by
849	00:54:57.520	00:55:01.980	both the murders by the Khmer Rouge, the savageness of
850	00:55:01.990	00:55:05.380	the war that preceded, and the great flow of emigration
851	00:55:05.390	00:55:08.690	from Cambodia of some of its best people--that the
852	00:55:08.700	00:55:12.800	present elite, the present holders of power, who are really
853	00:55:12.810	00:55:17.300	interested only in the holding of power--in the profits
854	00:55:17.310	00:55:20.080	that this puts into their pockets--that these people are
855	00:55:20.090	00:55:24.940	quite incapable and totally uninterested in advancing the state of
856	00:55:24.950	00:55:28.960	the Cambodian people. And since I see no change possible
857	00:55:28.970	00:55:32.430	within this elite now, it seemed to me--and it
858	00:55:32.440	00:55:35.300	is not a suggestion because it's too fanciful to be
859	00:55:35.310	00:55:38.070	taken seriously--but it seems to me that if there
860	00:55:38.080	00:55:40.660	is to be hope for Cambodia, it would be to
861	00:55:40.670	00:55:46.520	put this brutally misruled country in the hands of some
862	00:55:46.530	00:55:54.780	benevolent, uninterested, impartial force--use this power to allow a
863	00:55:54.790	00:55:59.510	new generation of Cambodians to develop normally in a country
864	00:55:59.520	00:56:02.550	in which they're not being brutalized by their government, and
865	00:56:02.560	00:56:07.840	when this new generation which recognizes the responsibilities of an
866	00:56:07.850	00:56:11.620	elite for the fate of a nation is ready to
867	00:56:11.630	00:56:14.790	take over the country, then by all means the country
868	00:56:14.800	00:56:17.690	should be taken over by the Cambodians. A trusteeship, it
869	00:56:17.700	00:56:19.940	sounds like. A form of trusteeship, but an honest form
870	00:56:19.950	00:56:25.740	of trusteeship, totally untainted by any thought of neocolonialism. I
871	00:56:25.750	00:56:29.290	think Cambodia should live under its own leadership by its
872	00:56:29.300	00:56:31.970	own devices. I regret to say that I do not
873	00:56:31.980	00:56:36.450	think it is capable of doing so today. As you
874	00:56:36.460	00:56:39.880	suggest at the end of the book, it may be
875	00:56:39.890	00:56:46.660	unrealistic, but it is not unreasonable. It is realizable theoretically.
876	00:56:46.670	00:56:49.420	I doubt that the will exists to realize it, but
877	00:56:49.430	00:56:52.180	I will be delighted to see it realized. Henry Kamm,
878	00:56:52.190	00:57:02.290	thank you very much. Thank you. Again, the major stories
879	00:57:02.300	00:57:05.920	of this Tuesday, a formal bribery investigation began of Salt
880	00:57:05.930	00:57:09.850	Lake City's selection as the site for the 2002 Winter
881	00:57:09.860	00:57:14.830	Olympics; the House managers or prosecutors of President Clinton's impeachment
882	00:57:14.840	00:57:17.890	began preparing for a Senate trial; and heavy rains and
883	00:57:17.900	00:57:21.790	melting snow triggered floods and mudslides in Oregon and Washington
884	00:57:21.800	00:57:25.040	State. We'll see you online and again here tomorrow evening.
885	00:57:25.050	01:01:59.905	I'm Jim Lehrer. Thank you and good night.
