index	starts	ends	content
297	00:20:29.210	00:20:33.010	would also mean that the incredible dollar amounts--the estimated
298	00:20:33.020	00:20:35.320	thirty million dollars by the five or six cities going
299	00:20:35.330	00:20:38.060	for the 2000 Olympics. Thirty million dollars? Just to try
300	00:20:38.070	00:20:41.410	to win the bid that city, Sydney, Australia, eventually won--
301	00:20:41.420	00:20:44.160	$30 million--think where that money could go if they
302	00:20:44.170	00:20:47.010	weren't busy wining and dining the IOC members and of
303	00:20:47.020	00:20:50.300	course also building stadiums and beginning the process, but I
304	00:20:50.310	00:20:53.120	think that's a great idea. The fact is that do
305	00:20:53.130	00:20:55.520	all of these IOC members all have to go to
306	00:20:55.530	00:20:58.420	all these cities and get the expensive hotel suites and
307	00:20:58.430	00:21:00.930	go and play golf or do whatever they do, do
308	00:21:00.940	00:21:02.980	they all have to do this? It seems again like
309	00:21:02.990	00:21:05.400	it was Christmas morning every day of the year for
310	00:21:05.410	00:21:08.480	the International Olympic Committee and from the standpoint of this
311	00:21:08.490	00:21:10.580	opens the door and has us all look at it
312	00:21:10.590	00:21:13.320	a little bit closer, journalists, as well as obviously some
313	00:21:13.330	00:21:15.750	of the investigating bodies, that's probably a good thing. And
314	00:21:15.760	00:21:17.550	as they say about this time of the year, Christmas
315	00:21:17.560	00:21:20.200	may now be over. I think it is officially over
316	00:21:20.210	00:21:22.930	for the International Olympic Committee. Christine, Howard, thank you both
317	00:21:22.940	00:21:34.660	very much. Thank you, Jim. This bad year in weather
318	00:21:34.670	00:21:39.320	and to Phil Ponce. Mother Nature wreaked havoc across the
319	00:21:39.330	00:21:42.640	globe in 1998. Many experts call it one of the
320	00:21:42.650	00:21:47.280	worst years ever for weather disasters. Early this spring in
321	00:21:47.290	00:21:52.470	Indonesia and Malaysia, severe drought and dry, thinning rainforests caused
322	00:21:52.480	00:21:56.390	wildfires to spread. Hundreds of thousands of acres of forests
323	00:21:56.400	00:22:00.120	were blackened by the blaze and smoke covered the countryside,
324	00:22:00.130	00:22:05.680	prompting thousands of people to seek treatment for respiratory infections.
325	00:22:05.690	00:22:08.830	In Western India last June a cyclone swept a half
326	00:22:08.840	00:22:12.180	dozen villages in the western state of Gujarat into the
327	00:22:12.190	00:22:15.850	sea. More than a thousand people were killed. Winds up
328	00:22:15.860	00:22:19.730	to 65 miles per hour destroyed homes and cut communication
329	00:22:19.740	00:22:23.780	lines. A month later, a massive tidal wave in Papua
330	00:22:23.790	00:22:27.780	New Guinea killed at least two thousand people. A 23-foot
331	00:22:27.790	00:22:30.500	wall of water crashed into what used to be a
332	00:22:30.510	00:22:34.950	string of fishing villages in this Pacific nation. In August,
333	00:22:34.960	00:22:39.290	flooding on China's Yangtze River killed over three thousand people,
334	00:22:39.300	00:22:43.540	left fourteen million homeless, and devastated at least twelve million
335	00:22:43.550	00:22:48.210	acres of farmland. The price tag for China's worst flooding
336	00:22:48.220	00:22:51.920	in more than forty years is estimated at thirty billion
337	00:22:51.930	00:22:55.750	dollars. According to the World Watch Institute, that made it
338	00:22:55.760	00:22:59.720	the costliest disaster of 1998. But there was more flood
339	00:22:59.730	00:23:04.090	damage to come. Within weeks in Bangladesh, the rising Jamuna
340	00:23:04.100	00:23:07.360	River caused the worst flood in that area's history. For
341	00:23:07.370	00:23:11.780	two months two-thirds of Bangladesh was underwater; thirty million people
342	00:23:11.790	00:23:15.960	were forced to leave their homes. And this year, hurricanes
343	00:23:15.970	00:23:20.700	devastated countries in the Caribbean and Central America. Hurricane Georges'
344	00:23:20.710	00:23:24.560	high winds and torrential rains left a path of destruction
345	00:23:24.570	00:23:26.910	as it moved through both rich and poor areas of
346	00:23:26.920	00:23:32.280	the Caribbean, including St. Kitts & Nevis, Anguilla, Puerto Rico,
347	00:23:32.290	00:23:36.640	Dominican Republic, Haiti, and Cuba's eastern coast. It moved north
348	00:23:36.650	00:23:41.890	through the Florida Keys. But Hurricane Mitch was even bigger,
349	00:23:41.900	00:23:46.560	the most destructive natural disaster in Central America's modern history.
350	00:23:46.570	00:23:52.040	For five days torrential rains, flooding, and mudslides caused extensive
351	00:23:52.050	00:23:58.190	damage in Honduras, Nicaragua, El Salvador, Guatemala, and Mexico. Nearly
352	00:23:58.200	00:24:02.020	two million people were left homeless. In Honduras, officials said
353	00:24:02.030	00:24:06.400	the economy had been set back 25 years. Closer to
354	00:24:06.410	00:24:09.830	home, Canada and New England suffered from the worst ice
355	00:24:09.840	00:24:15.840	storm on record. The freezing rain and severe cold caused
356	00:24:15.850	00:24:18.940	at least thirty deaths and left close to one million
357	00:24:18.950	00:24:22.370	people without electricity. The cost for the damage reached more
358	00:24:22.380	00:24:26.930	than three billion dollars. Florida suffered when it was hit
359	00:24:26.940	00:24:30.500	with the deadliest round of tornadoes in history. Winds up
360	00:24:30.510	00:24:33.970	to 260 miles per hour battered the central part of
361	00:24:33.980	00:24:37.600	the state. At least 39 people were killed and hundreds
362	00:24:37.610	00:24:43.640	injured. Neighborhoods and shopping centers were turned to rubble. Then
363	00:24:43.650	00:24:47.800	last summer, with temperatures of more than 100 degrees, three
364	00:24:47.810	00:24:50.890	separate forest fires burned out of control in Florida for
365	00:24:50.900	00:24:54.960	weeks. Three hundred and fifty homes and businesses were destroyed,
366	00:24:54.970	00:24:59.750	an estimated 500,000 acres burned. Thirty thousand people were forced
367	00:24:59.760	00:25:06.440	to evacuate their homes. In September, Hurricane Bonnie, the first
368	00:25:06.450	00:25:09.540	hurricane of the season, damaged the Florida Keys before it
369	00:25:09.550	00:25:14.450	hit North Carolina, with 115 mile per hour winds. And
370	00:25:14.460	00:25:17.460	Mother Nature made her presence known through the holiday as
371	00:25:17.470	00:25:22.030	a pre-Christmas Eve ice storm froze the Southeast United States.
372	00:25:22.040	00:25:26.290	Virginia was especially hard hit. Today more than 50,000 Virginia
373	00:25:26.300	00:25:30.400	residents are still without heat or electricity. And in the
374	00:25:30.410	00:25:35.190	Northwest driving rain and melting snow resulted in massive flooding
375	00:25:35.200	00:25:38.600	and mudslides in Oregon and Washington State. It's the worst
376	00:25:38.610	00:25:43.020	flooding in the region since 1996. Joining me now are
377	00:25:43.030	00:25:47.270	Janet Abramovitz, senior researcher at the Worldwatch Institute, an environmental
378	00:25:47.280	00:25:51.380	research organization; Bob Watson, director of the Environment Department at
379	00:25:51.390	00:25:55.370	the World Bank; and John Clizbe, vice president of disaster
380	00:25:55.380	00:25:58.970	services at the American Red Cross. Welcome all. Ms. Abramovitz,
381	00:25:58.980	00:26:01.180	give us the big picture, in historical context, just how
382	00:26:01.190	00:26:06.160	bad a year was it? 1998 was a record-setting year
383	00:26:06.170	00:26:12.590	for economic losses from weather-related disasters. Storms, floods, fires, and
384	00:26:12.600	00:26:17.410	droughts caused at least $89 billion in damage worldwide this
385	00:26:17.420	00:26:21.670	year. And to put that into some perspective, that exceeds
386	00:26:21.680	00:26:26.850	the total for the entire decade of the 1980s. And
387	00:26:26.860	00:26:30.330	it's far higher than the last record-setting year, which was
388	00:26:30.340	00:26:33.660	only two years ago in 1996. And as far as
389	00:26:33.670	00:26:37.530	the--some of the disasters worldwide that come to mind,
390	00:26:37.540	00:26:41.120	which ones, in your opinion, were particularly significant? Well, I
391	00:26:41.130	00:26:46.950	think the lead-in story covered quite a lot of them.
392	00:26:46.960	00:26:51.140	Hurricane Mitch, the Yangtze River floods, flooding in Bangladesh, the
393	00:26:51.150	00:26:57.470	cyclones and floods in India, but it--this year, no
394	00:26:57.480	00:27:02.620	region was untouched. We also saw earlier in the year
395	00:27:02.630	00:27:06.480	massive forest fires in the wet tropical forests which had
396	00:27:06.490	00:27:11.610	never burned before--the fires in Indonesia, the fires in
397	00:27:11.620	00:27:16.210	Brazil, and Mexico. There have been so many of these
398	00:27:16.220	00:27:20.060	natural events this year that each one--we almost forget
399	00:27:20.070	00:27:23.620	about the last one because we're now--we're moving on
400	00:27:23.630	00:27:25.880	to deal with each and every one. So it's been
401	00:27:25.890	00:27:29.540	a record-setting year for economic losses and, of course, the
402	00:27:29.550	00:27:35.500	human devastation can't be underestimated either. Mr. Clizbe, in the
403	00:27:35.510	00:27:37.970	United States, what kind of a year was it in
404	00:27:37.980	00:27:40.810	historical terms? Well, unfortunately, it's a record-setting year in the
405	00:27:40.820	00:27:43.730	United States too. For the American Red Cross it was
406	00:27:43.740	00:27:47.400	easily our most demanding and literally our most expensive year
407	00:27:47.410	00:27:52.490	in our 117-year history, including a period of time, a
408	00:27:52.500	00:27:55.410	six-week stretch or so, in September or October or whatever
409	00:27:55.420	00:27:59.230	we're dealing with, more large scale disasters simultaneously than we
410	00:27:59.240	00:28:02.050	had ever faced in our history at the same time.
411	00:28:02.060	00:28:04.640	And when you say most expensive, was there one disaster
412	00:28:04.650	00:28:08.500	that was particularly costly? Certainly. Hurricane Georges in Puerto Rico--
413	00:28:08.510	00:28:13.210	particular the Puerto Rico portion of Hurricane Georges was the
414	00:28:13.220	00:28:16.330	most expensive disaster in American Red Cross history. And why
415	00:28:16.340	00:28:20.060	was it so expensive? Well, it was a very devastating
416	00:28:20.070	00:28:25.320	storm; it really hit Puerto Rico hard, and most of
417	00:28:25.330	00:28:28.630	the island was hit, and much of the inner part
418	00:28:28.640	00:28:31.350	of the island, up in the mountains and the communities
419	00:28:31.360	00:28:33.920	that sort of slid down the side of the mountains,
420	00:28:33.930	00:28:36.710	much like what we saw with Hurricane Mitch in Honduras
421	00:28:36.720	00:28:39.310	and Nicaragua, very similar kinds of things happened in Puerto
422	00:28:39.320	00:28:42.640	Rico. Mr. Watson, why was all this happening? Well, this
423	00:28:42.650	00:28:46.170	year was clearly the hottest year on record, and the
424	00:28:46.180	00:28:48.900	question is: Are these just natural events that occur every
425	00:28:48.910	00:28:52.430	so often, or is it possible that we humans are
426	00:28:52.440	00:28:55.950	slowly but surely changing the Earth's climate, and by changing
427	00:28:55.960	00:28:58.290	the Earth's climate, we are seeing more of these very
428	00:28:58.300	00:29:01.840	extreme events? And there was a lot of talk this
429	00:29:01.850	00:29:04.170	year, obviously, about El Niño. I mean, at some point
430	00:29:04.180	00:29:08.320	people seemed El Niño'd out. But a way to connect the
431	00:29:08.330	00:29:11.900	dots, using that? Well, the El Niño that we saw
432	00:29:11.910	00:29:13.290	at the end of last year and the beginning of
433	00:29:13.300	00:29:16.270	this year, it was clearly the most major El Niño
434	00:29:16.280	00:29:19.460	of the last 150 years. It caused the massive floods
435	00:29:19.470	00:29:23.050	in Peru, the droughts in Indonesia, but when--by the
436	00:29:23.060	00:29:25.510	time we got to the very large floods in China
437	00:29:25.520	00:29:27.810	and Bangladesh, they were not due to the El Niño
438	00:29:27.820	00:29:31.320	event. What happened was we got some very, very unusual
439	00:29:31.330	00:29:33.270	events where in parts of the Yangtze River we had
440	00:29:33.280	00:29:36.090	seventy inches of rain in June and July, where you
441	00:29:36.100	00:29:39.550	normally only get about ten or twelve. Bangladesh, two-thirds of
442	00:29:39.560	00:29:42.200	Bangladesh was swamped. In a typical day one was getting
443	00:29:42.210	00:29:45.230	five to ten inches of rain. And so we know
444	00:29:45.240	00:29:47.010	that if you get a warmer world, there will be
445	00:29:47.020	00:29:50.450	more very, very heavy precipitation events around the world, therefore,
446	00:29:50.460	00:29:52.670	more floods and more droughts. And so one of the
447	00:29:52.680	00:29:56.720	challenges is to find out if, indeed, we are changing
448	00:29:56.730	00:29:59.830	the atmospheric composition, greenhouse gas, will it lead to more
449	00:29:59.840	00:30:02.380	El Niño events, and, if so, we'll see more of
450	00:30:02.390	00:30:07.350	these drastic floods, drastic droughts, forest fires, et cetera, throughout
451	00:30:07.360	00:30:09.720	the world, unfortunately. And just a very quick reminder of
452	00:30:09.730	00:30:11.930	what El Niño was--it's the warming that happens occasionally
453	00:30:11.940	00:30:14.240	in the Pacific that warms the air and can cause
454	00:30:14.250	00:30:16.650	extremes in weather. That's right. It's the ocean off of
455	00:30:16.660	00:30:19.890	Peru and Ecuador warms up--last year, it was as
456	00:30:19.900	00:30:23.200	much as five degrees warmer than normal. And when that
457	00:30:23.210	00:30:27.160	happens, you change all the precipitation patterns around the world,
458	00:30:27.170	00:30:29.680	and especially in the tropics and subtropics. So, areas that
459	00:30:29.690	00:30:33.460	have gotten normally fairly dry become very, very dry. Peru
460	00:30:33.470	00:30:36.270	became extremely wet. And so what you see is very,
461	00:30:36.280	00:30:40.320	very drastic changes in precipitation events, as well as temperature.
462	00:30:40.330	00:30:42.430	And without making this a debate about global warming, what
463	00:30:42.440	00:30:46.500	is the latest evidence on that? Well, there's no question--
464	00:30:46.510	00:30:49.370	we are changing the atmospheric composition of greenhouse gases--there's
465	00:30:49.380	00:30:52.800	no doubt that the Earth's surface temperature is warming. This
466	00:30:52.810	00:30:55.370	year is probably the warmest year on record. Last year
467	00:30:55.380	00:30:57.730	was the previous warmest, and so the question is, the
468	00:30:57.740	00:31:01.410	bulk of scientists do believe that we humans are slowly
469	00:31:01.420	00:31:04.520	but surely changing the Earth's climate, and this could have
470	00:31:04.530	00:31:08.700	profound effects on agricultural productivity, sea level rise, and on
471	00:31:08.710	00:31:13.680	natural ecological systems. Ms. Abramovitz, going back to the events
472	00:31:13.690	00:31:16.970	of this year, the weather was the natural event, but
473	00:31:16.980	00:31:20.170	were there things that humans did that sort of exacerbated
474	00:31:20.180	00:31:23.220	things? Yes, absolutely. I think we can see the hands
475	00:31:23.230	00:31:26.200	of man in many of these disasters. Hurricane Mitch, for
476	00:31:26.210	00:31:31.330	example, hit a region that was ecologically and socially very
477	00:31:31.340	00:31:36.270	vulnerable. Honduras, for example, has lost two-thirds of its forest
478	00:31:36.280	00:31:40.620	cover, including much of the forest cover in the Tegucigalpa
479	00:31:40.630	00:31:44.320	watershed, and Central America has some of the highest rates
480	00:31:44.330	00:31:48.200	of deforestation in the world, likewise in the Yangtze River
481	00:31:48.210	00:31:52.420	Basin; 85 percent of the forests have been lost, the
482	00:31:52.430	00:31:55.590	lakes, the wetlands have been lost, and the rivers heavily
483	00:31:55.600	00:32:01.290	dammed, and what happens is that without tree cover to
484	00:32:01.300	00:32:06.690	hold the soil in place, when the rains come, they
485	00:32:06.700	00:32:10.190	can't be absorbed into the land, and they go racing
486	00:32:10.200	00:32:14.620	across the land, carrying mud and debris with it, filling
487	00:32:14.630	00:32:18.740	up the rivers, gaining force as they go downstream, particularly
488	00:32:18.750	00:32:21.960	when rivers are constricted, as many of the rivers in
489	00:32:21.970	00:32:25.760	the world now are, and you have these sorts of
490	00:32:25.770	00:32:31.340	events. On top of that, people are also settling in
491	00:32:31.350	00:32:36.330	vulnerable areas, in coastal areas, in river flood plains, on
492	00:32:36.340	00:32:41.830	steep hillsides, and so more people are in harm's way,
493	00:32:41.840	00:32:46.940	and there's more harm to be done because of land
494	00:32:46.950	00:32:52.020	use changes that have made the planet less resilient to
495	00:32:52.030	00:32:56.550	withstanding these kinds of natural disasters. So, we've turned what
496	00:32:56.560	00:33:00.210	would otherwise be a natural disaster into something--I mean,
497	00:33:00.220	00:33:02.600	Mitch would have been horrible notwithstanding any of those things
498	00:33:02.610	00:33:03.650	that you described. Absolutely. Absolutely. But when you have a
499	00:33:03.660	00:33:06.980	foot or two of rain every day, it's going to
500	00:33:06.990	00:33:10.770	be a bad situation. But if you have bare hillsides
501	00:33:10.780	00:33:13.410	and people living on bare hillsides, it's going to be
502	00:33:13.420	00:33:18.770	a decidedly unnatural disaster. And I think we're in for
503	00:33:18.780	00:33:21.130	more of these sorts of things in the future if
504	00:33:21.140	00:33:25.290	we continue down the same path. Now, luckily, some governments
505	00:33:25.300	00:33:29.340	have begun to recognize this. The Chinese government early in
506	00:33:29.350	00:33:33.780	the Yangtze River flood said, no, this is a completely
507	00:33:33.790	00:33:39.440	natural disaster. Later, they changed their story, and--and admitted,
508	00:33:39.450	00:33:42.920	in fact, that it did have a large measure to
509	00:33:42.930	00:33:47.180	do with deforestation, and then enacted a logging ban and
510	00:33:47.190	00:33:50.380	have begun reforestation efforts. Mr. Clizby, in this country have
511	00:33:50.390	00:33:54.520	people learned some lessons from what happened? Some. But probably
512	00:33:54.530	00:33:57.590	not enough. The American people have, bless their hearts, have
513	00:33:57.600	00:34:01.980	a propensity for living in disaster-prone areas. For example--Well,
514	00:34:01.990	00:34:05.750	about forty million people in the United States live in
515	00:34:05.760	00:34:10.780	high-risk disaster areas, in earthquake-prone areas along the Southeastern coasts
516	00:34:10.790	00:34:15.670	that are hurricane prone, so we're very vulnerable, and that
517	00:34:15.680	00:34:19.760	certainly showed itself this year. Many, not all, but many
518	00:34:19.770	00:34:23.290	of the significant disasters that happened this year were, in
519	00:34:23.300	00:34:27.150	fact, in areas that are disaster-prone, and we know it.
520	00:34:27.160	00:34:29.800	Would you put the flooding that took place in Texas--
521	00:34:29.810	00:34:33.150	Del Rio area in that category? Well, I think that
522	00:34:33.160	00:34:36.560	was a surprise, I think, to many of the people
523	00:34:36.570	00:34:40.990	in Texas. But Texas experienced severe floods this year, and
524	00:34:41.000	00:34:43.160	I think in Del Rio felt that they were living
525	00:34:43.170	00:34:46.830	in a safe area. It was a torrential rain and
526	00:34:46.840	00:34:51.890	a flash flood that just caused unspeakable devastation very, very
527	00:34:51.900	00:34:56.530	suddenly, but I think certainly--I think something like 80%
528	00:34:56.540	00:34:59.390	of the population of Florida lives within twenty miles of
529	00:34:59.400	00:35:03.720	a coast, so certainly Floridians are in vulnerable locations; all
530	00:35:03.730	00:35:07.890	along the southeastern part of the United States, there's vulnerability.
531	00:35:07.900	00:35:10.460	On the other hand, I think people are learning--in
532	00:35:10.470	00:35:15.600	the United States there are decreasing numbers of deaths with
533	00:35:15.610	00:35:18.020	disasters, and I think it's because we are getting better
534	00:35:18.030	00:35:22.220	at mitigating to some degree; people are learning some lessons;
535	00:35:22.230	00:35:24.730	and the Red Cross has found one of the things
536	00:35:24.740	00:35:27.490	we've learned is we need to start working with communities
537	00:35:27.500	00:35:30.510	and families to help them prepare so that they can
538	00:35:30.520	00:35:34.390	head off some disasters better. Now, you actually make visits
539	00:35:34.400	00:35:38.060	to places where disasters happen. What are the images that
540	00:35:38.070	00:35:40.030	will stay with you from this year? What things come
541	00:35:40.040	00:35:42.750	to mind? I think for all the statistics, I think
542	00:35:42.760	00:35:46.220	what really strikes me increasingly is that every disaster is
543	00:35:46.230	00:35:49.530	a personal disaster for a family or individual. If it's
544	00:35:49.540	00:35:52.080	a single family in the middle of Kansas with a
545	00:35:52.090	00:35:55.360	tornado or homes sliding off a side of a hill
546	00:35:55.370	00:35:58.410	in Puerto Rico or whatever, it really boils down to
547	00:35:58.420	00:36:03.650	people being hurt. And I think the emotional devastation, the
548	00:36:03.660	00:36:06.900	emotional toll is often as great as the physical toll,
549	00:36:06.910	00:36:12.200	and I can vividly picture--in Spencer, South Dakota, two
550	00:36:12.210	00:36:16.020	things strike me: one, a community totally wiped out as
551	00:36:16.030	00:36:18.980	if the tornado decided to come down to hit that
552	00:36:18.990	00:36:21.150	six- or seven-square block area and then lift off the
553	00:36:21.160	00:36:24.660	ground again. And at the same time, I remember seeing
554	00:36:24.670	00:36:27.450	two men sitting on a pile of rubble with their
555	00:36:27.460	00:36:32.490	arms around each other, obviously suffering with what they've gone
556	00:36:32.500	00:36:37.300	through. Del Rio, that you mentioned, I can remember seeing
557	00:36:37.310	00:36:42.370	the families that were impacted by what had been--what
558	00:36:42.380	00:36:46.560	had just suddenly come upon them in a very unpredictable
559	00:36:46.570	00:36:51.210	kind of way, or the families in Florida, and Alabama
560	00:36:51.220	00:36:54.320	and Georgia, that went through the tornadoes that were there.
561	00:36:54.330	00:36:59.100	I think it's--sometimes I think we can get preoccupied--
562	00:36:59.110	00:37:02.000	I can get preoccupied with sort of the numbers and
563	00:37:02.010	00:37:05.410	the scales and the scope and--it's been a major
564	00:37:05.420	00:37:08.280	challenge for us and the Red Cross, but I think
565	00:37:08.290	00:37:10.540	what strikes us we have to keep getting better and
566	00:37:10.550	00:37:15.690	better at working and serving individual families and people. Mr.
567	00:37:15.700	00:37:18.270	Watson, how about in parts of the world where the
568	00:37:18.280	00:37:20.350	resources might not exist that exist in the United States,
569	00:37:20.360	00:37:22.480	is there--if there is a will, are there the
570	00:37:22.490	00:37:26.370	means to sort of make better--build better buildings, build
571	00:37:26.380	00:37:29.120	communities out of harm's way? Our challenge now is to
572	00:37:29.130	00:37:33.630	help prepare developing countries for these natural disasters. Too often
573	00:37:33.640	00:37:37.010	we respond to a natural disaster. But we're making major
574	00:37:37.020	00:37:39.920	progress in how to predict hurricanes. That's why we don't
575	00:37:39.930	00:37:41.660	see the loss of life in the U.S. We have
576	00:37:41.670	00:37:44.360	to use that same technology in developing countries. But even
577	00:37:44.370	00:37:47.070	more with El Niño, we can now forecast six to
578	00:37:47.080	00:37:49.100	nine months in advance when we're going to see an
579	00:37:49.110	00:37:52.060	El Niño. So we can help to reduce the human
580	00:37:52.070	00:37:54.670	devastation. If it's going to be drier in some areas,
581	00:37:54.680	00:37:57.690	we can help the farmers decide what plants to crop.
582	00:37:57.700	00:37:59.030	If it's going to be drier, we can work with
583	00:37:59.040	00:38:01.740	the water resource managers, so we don't see these massive
584	00:38:01.750	00:38:04.560	hunger and famine events that we're seeing. If it's going
585	00:38:04.570	00:38:06.680	to become very wet, we are going to work with
586	00:38:06.690	00:38:09.580	the farmers, work with the water managers. In addition, we
587	00:38:09.590	00:38:13.250	can also work with the infrastructure, better roads, better bridges,
588	00:38:13.260	00:38:16.380	to reduce this threat, so I believe science is moving
589	00:38:16.390	00:38:19.660	us in a direction where while we cannot avoid the
590	00:38:19.670	00:38:22.710	disaster, we can be better prepared, we can reduce some
591	00:38:22.720	00:38:25.270	of the human misery, and some of the economic costs,
