index	starts	ends	content
1	00:02:05.570	00:02:08.570	Good evening. I'm Jim Lehrer. On the NewsHour tonight coverage
2	00:02:08.580	00:02:12.390	of the Salt Lake City Olympics investigation, some perspective on
3	00:02:12.400	00:02:16.540	this year of devastating storms and other natural disasters, a
4	00:02:16.550	00:02:19.830	report on the big layoffs at Boeing in Seattle, and
5	00:02:19.840	00:02:24.510	a conversation about Cambodia with veteran foreign correspondent Henry Kamm.
6	00:02:24.520	00:03:05.250	It all follows our summary of the news this Tuesday.
7	00:03:05.260	00:03:09.290	A special panel began its investigation today of charges bribes
8	00:03:09.300	00:03:13.930	helped Salt Lake City win the 2002 Winter Olympic Games.
9	00:03:13.940	00:03:17.660	The five-member commission was appointed by the U.S. Olympic Committee.
10	00:03:17.670	00:03:21.300	Past and present officials of Salt Lake City's effort acknowledged
11	00:03:21.310	00:03:25.890	they gave International Olympic Committee members gifts. College tuitions were
12	00:03:25.900	00:03:30.030	also paid for some relatives of IOC officials prior to
13	00:03:30.040	00:03:33.780	the site selection. Former Senate Majority Leader George Mitchell heads
14	00:03:33.790	00:03:36.460	the panel, which met today in Washington. He spoke to
15	00:03:36.470	00:03:41.000	reporters after the session. I don't know what the investigation
16	00:03:41.010	00:03:43.410	is going to turn up. I do know what the
17	00:03:43.420	00:03:46.330	allegations are. I do know what all of the press
18	00:03:46.340	00:03:51.070	reports have been, but I don't think that it would
19	00:03:51.080	00:03:54.770	be fair or wise for me or other members of
20	00:03:54.780	00:03:59.290	this commission to at this point assume what the facts
21	00:03:59.300	00:04:01.260	are going to be. We're going to look at it
22	00:04:01.270	00:04:03.810	with an open mind; we're going to be as thorough
23	00:04:03.820	00:04:06.760	as possible; we're going to try to be as fair
24	00:04:06.770	00:04:10.450	as possible; but we're not going to pre-judge it. We’ll
25	00:04:10.460	00:04:13.090	have more on this story right after the News Summary.
26	00:04:13.100	00:04:16.090	There was more bad weather in the Northwest today. Heavy
27	00:04:16.100	00:04:19.660	rains and melting snow triggered floods and mudslides in Oregon
28	00:04:19.670	00:04:23.850	and Washington. Coast Guard boats ferried stranded residents to safety
29	00:04:23.860	00:04:27.020	in Oregon. Flood warnings are up for parts of Washington
30	00:04:27.030	00:04:30.790	State. Forecasters are calling for more rain in the area.
31	00:04:30.800	00:04:34.410	In the Southeast thousands of homes and businesses remained without
32	00:04:34.420	00:04:38.400	power. Virginia's power company said it expects to restore electricity
33	00:04:38.410	00:04:41.380	to all of its customers by tomorrow. We'll review the
34	00:04:41.390	00:04:46.620	year's weather-related disasters later in the program tonight. Overseas today
35	00:04:46.630	00:04:50.070	four foreign tourists were killed in Yemen on the southern
36	00:04:50.080	00:04:53.800	tip of the Arabian peninsula. Government officials said the victims
37	00:04:53.810	00:04:57.220	and twelve other tourists had been taken captive by Islamic
38	00:04:57.230	00:05:01.780	extremists. Security troops stormed the kidnappers' hideout only after they
39	00:05:01.790	00:05:06.040	reportedly began shooting hostages. There were conflicting reports about the
40	00:05:06.050	00:05:10.070	nationalities of those killed. U.S. officials said one American was
41	00:05:10.080	00:05:14.280	seriously wounded. Two Chinese exiles living in the United States
42	00:05:14.290	00:05:17.130	were captured in China and have been sentenced to three
43	00:05:17.140	00:05:20.940	years at forced labor. The Chinese foreign ministry said today
44	00:05:20.950	00:05:24.010	the three slipped into China seven weeks ago, hiding in
45	00:05:24.020	00:05:26.940	a truck coming from Hong Kong. They were sentenced to
46	00:05:26.950	00:05:30.720	the maximum term the police can order without a trial.
47	00:05:30.730	00:05:33.580	Four other government critics received long prison terms in recent
48	00:05:33.590	00:05:38.180	weeks in a crackdown on dissent. In Cambodia today two
49	00:05:38.190	00:05:42.060	senior members of the Communist Khmer Rouge apologized for the
50	00:05:42.070	00:05:45.780	regime of their leader, Pol Pot, in the 1970s. They
51	00:05:45.790	00:05:49.690	asked their countrymen to let bygones be bygones. Both elders
52	00:05:49.700	00:05:52.550	of the Khmer Rouge rebel movement defected to the government
53	00:05:52.560	00:05:55.960	recently. Prime Minister Hun Sen said it might not be
54	00:05:55.970	00:05:58.690	in the national interest to now try them for the
55	00:05:58.700	00:06:02.830	death of some 1.7 million Cambodians in the 70s. One
56	00:06:02.840	00:06:14.320	of the defectors said this: Most of our compatriots understand
57	00:06:14.330	00:06:26.150	that we have much more problem to resolve at present
58	00:06:26.160	00:06:37.310	and in the future, and we have to forget the
59	00:06:37.320	00:06:41.900	past. Author and New York Times Correspondent Henry Kamm covered
60	00:06:41.910	00:06:45.700	the Khmer Rouge and Cambodia for many years. Terence Smith
61	00:06:45.710	00:06:48.970	has a conversation with him later in the program. The
62	00:06:48.980	00:06:52.830	House managers or prosecutors of President Clinton's impeachment trial met
63	00:06:52.840	00:06:56.850	today. The thirteen are Republican members of the House Judiciary
64	00:06:56.860	00:07:00.510	Committee chaired by Congressman Henry Hyde of Illinois. One of
65	00:07:00.520	00:07:03.720	their jobs is to decide how to present impeachment evidence
66	00:07:03.730	00:07:06.920	to the Senate. They're expected to make that formal presentation
67	00:07:06.930	00:07:09.990	next week. At the White House today the President offered
68	00:07:10.000	00:07:14.070	a new initiative to increase penalties against child abusers. The
69	00:07:14.080	00:07:16.990	plan would redefine murder to include the death of a
70	00:07:17.000	00:07:21.300	child caused by a pattern of abuse and increase sentences
71	00:07:21.310	00:07:24.660	for those who commit crimes in the presence of children.
72	00:07:24.670	00:07:26.620	And that's it for the News Summary tonight. Now it's
73	00:07:26.630	00:07:29.530	on to the Salt Lake City Olympics story, the year
74	00:07:29.540	00:07:34.180	of devastating weather, the layoffs at Boeing, and a conversation
75	00:07:34.190	00:07:47.020	about Cambodia. Tom Bearden begins our coverage of the Olympics
76	00:07:47.030	00:07:51.450	story. Salt Lake City realized the fruits of years of
77	00:07:51.460	00:07:55.670	lobbying in June of 1995, when the International Olympic Committee
78	00:07:55.680	00:08:00.020	announced the host city for the 2002 Winter Games. The
79	00:08:00.030	00:08:06.460	International Olympic Committee has decided to award the organization of
80	00:08:06.470	00:08:12.460	the 19th Olympic Winter Games in 2002 to the city
81	00:08:12.470	00:08:17.400	of Salt Lake City. Salt Lake had been a first
82	00:08:17.410	00:08:20.810	ballot winner--beating out Quebec and cities in Sweden and
83	00:08:20.820	00:08:25.130	Switzerland. Jubilant officials and residents celebrated at a huge outdoor
84	00:08:25.140	00:08:31.220	rally. But in the last several weeks charges have been
85	00:08:31.230	00:08:34.700	leveled that Salt Lake City officials bribed Olympic officials to
86	00:08:34.710	00:08:38.390	get the games. Those officials have admitted giving four hundred
87	00:08:38.400	00:08:43.100	thousand dollars in college scholarships to thirteen beneficiaries, including six
88	00:08:43.110	00:08:47.250	relatives of IOC members. Other members received gifts and free
89	00:08:47.260	00:08:52.940	medical services. Four separate investigations are now underway. The IOC
90	00:08:52.950	00:08:55.790	has ordered an inquiry, so has the Ethics Committee of
91	00:08:55.800	00:08:59.510	the Salt Lake Organizing Group. Last week the U.S. Justice
92	00:08:59.520	00:09:02.500	Department began its own review on whether federal tax and
93	00:09:02.510	00:09:06.770	corruption laws were violated. And today, former US Senate Majority
94	00:09:06.780	00:09:09.760	Leader George Mitchell launched an investigation on behalf of the
95	00:09:09.770	00:09:13.420	United States Olympic Committee, He promised a "thorough and prompt"
96	00:09:13.430	00:09:19.940	investigation. I entered this process with a completely open mind
97	00:09:19.950	00:09:25.230	both as to the practices and standards which have been
98	00:09:25.240	00:09:28.740	utilized in the past and those which ought to be
99	00:09:28.750	00:09:34.380	utilized and part of our analysis and basis upon which
100	00:09:34.390	00:09:38.680	our recommendations will be made will necessarily involve looking at
101	00:09:38.690	00:09:42.090	what has happened in the past--what have been--if
102	00:09:42.100	00:09:45.860	any--the standards, written or otherwise--what have been the
103	00:09:45.870	00:09:53.030	actual practices; how have they either complied with or been
104	00:09:53.040	00:09:56.520	in violation of those guidelines. The very purpose of the
105	00:09:56.530	00:10:00.710	commission is to try to get the facts and to
106	00:10:00.720	00:10:03.770	put them in some context for the U.S. Olympic Committee
107	00:10:03.780	00:10:07.620	to try to help make certain that if, in fact,
108	00:10:07.630	00:10:12.290	there were practices in the past which were inappropriate, we
109	00:10:12.300	00:10:14.730	do everything we can to prevent them from occurring in
110	00:10:14.740	00:10:21.120	the future. The various Olympic committees looking into the matter
111	00:10:21.130	00:10:24.080	are scheduled to complete their investigations within the next couple
112	00:10:24.090	00:10:27.380	of months--well before the start of the 2002 winter
113	00:10:27.390	00:10:30.900	games. Now to two journalists who have been covering the
114	00:10:30.910	00:10:34.810	Olympic story: Howard Berkes of National Public Radio, and Christine
115	00:10:34.820	00:10:37.680	Brennan, who's also written two books on the Olympics and
116	00:10:37.690	00:10:41.820	figure skating. Okay, Christine, first of all, let's try to
117	00:10:41.830	00:10:47.780	understand some of the specific charges. College scholarships, these were
118	00:10:47.790	00:10:50.200	given to people who were on the International Olympic Committee.
119	00:10:50.210	00:10:52.360	Now how many people are on the committee, who actually
120	00:10:52.370	00:10:56.020	make these decisions? There are 115 members, and they're from
121	00:10:56.030	00:10:58.740	around the world, some of them are kings and queens
122	00:10:58.750	00:11:02.860	and princes, literally Princess Anne, Prince Albert of Monaco. There
123	00:11:02.870	00:11:06.720	are--I would call it actually the sports world's royal
124	00:11:06.730	00:11:09.730	family. This is about as upper crust as it gets.
125	00:11:09.740	00:11:11.930	And they make these decisions every few years to award
126	00:11:11.940	00:11:16.490	the Olympic Games to a city, winter or summer games.
127	00:11:16.500	00:11:18.510	And these are the people who make these decisions. And
128	00:11:18.520	00:11:20.720	these decisions are made way in advance, are they not?
129	00:11:20.730	00:11:24.550	That's correct. Seven/eight years in advance. For example, in 1988,
130	00:11:24.560	00:11:27.600	Atlanta received the nod from the US Olympic Committee, beating
131	00:11:27.610	00:11:30.390	out Minneapolis. Obviously, Atlanta then had to go at it
132	00:11:30.400	00:11:33.230	for a couple of more years against international competitors and
133	00:11:33.240	00:11:37.400	then in 1990, I believe it was 1990/1991, they received
134	00:11:37.410	00:11:41.160	the nod from the IOC in a secret ballot to
135	00:11:41.170	00:11:44.730	get the Olympics for 1996. Yes. Now, Howard, to you
136	00:11:44.740	00:11:48.760	on the specifics here in Salt Lake City. They are
137	00:11:48.770	00:11:52.780	accused of--the people in Salt Lake City are accused
138	00:11:52.790	00:11:56.260	of, for instance, providing college scholarships to some of these--
139	00:11:56.270	00:11:59.380	to relatives of members of the IOC. What's the nature
140	00:11:59.390	00:12:02.610	of those scholarships? Well, we don't have very many details
141	00:12:02.620	00:12:05.300	about that because the Salt Lake Olympic organizing committee still
142	00:12:05.310	00:12:09.040	has withheld much of the information about this program, but
143	00:12:09.050	00:12:12.420	what we do know is that over a period of
144	00:12:12.430	00:12:16.290	seven years Salt Lake Olympic organizers paid out thousands of
145	00:12:16.300	00:12:22.360	dollars in college scholarships to six relatives of IOC members;
146	00:12:22.370	00:12:24.850	they put them through school--through American University in the
147	00:12:24.860	00:12:29.240	case of the daughter of one IOC member, through several
148	00:12:29.250	00:12:35.230	colleges in Utah. The payments also included living expenses and
149	00:12:35.240	00:12:39.560	books, and other things that were necessary for them to
150	00:12:39.570	00:12:41.990	be in school. Now, there was also a very interesting
151	00:12:42.000	00:12:46.480	story about medical expenses that were provided for members of
152	00:12:46.490	00:12:50.250	the committee. Tell us that story. Well, at least three
153	00:12:50.260	00:12:53.970	people associated with the International Olympic Committee, either IOC members
154	00:12:53.980	00:12:59.760	or their relatives, received as much as $30,000 in free
155	00:12:59.770	00:13:04.080	medical care that was arranged by organizers of the Salt
156	00:13:04.090	00:13:10.760	Lake Olympics. There were--we know specifically of three instances--
157	00:13:10.770	00:13:14.050	again, we don't have the details on that--but in
158	00:13:14.060	00:13:18.300	one case somebody received some cosmetic surgery; in another case
159	00:13:18.310	00:13:22.540	some kind of operation on the knee or the thigh.
160	00:13:22.550	00:13:26.620	And Olympic organizers went to local hospitals and doctors and
161	00:13:26.630	00:13:29.460	said, for the sake of the Olympic bid we want
162	00:13:29.470	00:13:31.950	you to do this for free. And you're talking about
163	00:13:31.960	00:13:33.940	local, you mean in Salt Lake City? Here in Salt
164	00:13:33.950	00:13:36.020	Lake City. And they, in fact, did it? And they
165	00:13:36.030	00:13:39.050	did it. Yes. And they did it. Now, Christine, you've
166	00:13:39.060	00:13:42.010	been covering these Olympic stories for years. Is what Salt
167	00:13:42.020	00:13:44.810	Lake City did unique? I don't think so, and I
168	00:13:44.820	00:13:46.400	think that's one of the key issues here as we
169	00:13:46.410	00:13:48.440	look at this whole thing. I've covered the games since
170	00:13:48.450	00:13:52.260	1984, and really 1984 is the--is the watershed year,
171	00:13:52.270	00:13:55.820	when the Los Angeles Olympics succeeded as they did, and
172	00:13:55.830	00:13:59.370	you had this incredible big birthday party, celebration in the
173	00:13:59.380	00:14:02.150	United States. All of a sudden, after the disasters with
174	00:14:02.160	00:14:05.160	Munich, with the eleven Israeli athletes killed, and then with
175	00:14:05.170	00:14:07.700	Montreal and a deficit I think they're still paying for
176	00:14:07.710	00:14:10.080	now in Montreal, all of a sudden you have cities
177	00:14:10.090	00:14:13.510	falling over themselves wanting the Olympic games. And what happened
178	00:14:13.520	00:14:15.880	and what I've found over the years covering this is
179	00:14:15.890	00:14:18.890	that these kinds of things, perhaps not to this degree,
180	00:14:18.900	00:14:20.390	these kinds of things have been going on for quite
181	00:14:20.400	00:14:23.140	a while. For example, a man in Manchester who ran
182	00:14:23.150	00:14:25.640	the bid for Manchester, England, a bid that did not
183	00:14:25.650	00:14:29.270	succeed in the year 2000, told me and told others,
184	00:14:29.280	00:14:31.560	he said, he even knew the shoe size of the
185	00:14:31.570	00:14:35.540	second daughter of one particular IOC member. What does that
186	00:14:35.550	00:14:38.630	mean? That means they were giving out gifts constantly. You
187	00:14:38.640	00:14:42.950	had situations where IOC members were able to pilot yachts--
188	00:14:42.960	00:14:47.250	38-foot yachts in Sydney Harbour. Obviously, this was well within
189	00:14:47.260	00:14:50.320	the rules, so to speak, of the IOC--$200 gift
190	00:14:50.330	00:14:54.000	limit--but how do you rank priceless in the $200
191	00:14:54.010	00:14:56.650	gift limit area? And I think the reality is that
192	00:14:56.660	00:14:58.570	this has been going on for a long time, Jim.
193	00:14:58.580	00:15:01.300	I think--I don't think that Salt Lake City--while
194	00:15:01.310	00:15:03.600	it is important that we look at Salt Lake City--
195	00:15:03.610	00:15:06.440	they're going to say to a lot of people is
196	00:15:06.450	00:15:08.830	hey, we had to do this, and the IOC members
197	00:15:08.840	00:15:11.510	who were taking the gifts obviously didn't blow the whistle;
198	00:15:11.520	00:15:14.580	they took them. Yes. Howard, the attitude in Salt Lake
199	00:15:14.590	00:15:17.040	City--I was reading about this today and some people
200	00:15:17.050	00:15:19.660	were saying that Salt Lake City is actually a victim,
201	00:15:19.670	00:15:22.210	rather than a perpetrator of this system, is that--how
202	00:15:22.220	00:15:24.100	do you--is that how the people of Salt Lake
203	00:15:24.110	00:15:27.070	City see it? Well, actually, people in Salt Lake City
204	00:15:27.080	00:15:30.820	don't quite see it that way. Some people, of course,
205	00:15:30.830	00:15:34.560	here see that, as Christine described, that Salt Lake Olympic
206	00:15:34.570	00:15:38.300	organizers had to do what other bid cities have done
207	00:15:38.310	00:15:42.460	to win the games. Others, though, see it as Salt
208	00:15:42.470	00:15:48.340	Lake City taking the low road, and violating not only
209	00:15:48.350	00:15:51.580	the regulations of the International Olympic Committee that were in
210	00:15:51.590	00:15:55.250	effect at the time but possibly the law in order
211	00:15:55.260	00:15:59.040	to secure the games. What's important, though, at this moment
212	00:15:59.050	00:16:01.790	is that the International Olympic Committee and the US Olympic
213	00:16:01.800	00:16:05.510	Committee both have essentially said this is not Salt Lake
214	00:16:05.520	00:16:08.360	City's fault; the fault does lie within the members of
215	00:16:08.370	00:16:12.490	the International Olympic Committee who took it upon themselves to
216	00:16:12.500	00:16:15.360	extract these kinds of gifts, to encourage them over the
217	00:16:15.370	00:16:19.270	years, to seek them out. And it's quite clear that
218	00:16:19.280	00:16:21.940	the International Olympic Committee and the US Olympic Committee puts
219	00:16:21.950	00:16:24.140	the blame there and that the action that they will
220	00:16:24.150	00:16:27.920	take will be focused on the members of the International
221	00:16:27.930	00:16:32.200	Olympic Committee and establishing rules that will prevent this kind
222	00:16:32.210	00:16:34.440	of thing in the future from that standpoint. There doesn't
223	00:16:34.450	00:16:36.940	seem to be anyone interested in punishing Salt Lake City.
224	00:16:36.950	00:16:38.920	Yes. Christine, it would seem then that it would be
225	00:16:38.930	00:16:41.320	very easy to solve this problem if the people who
226	00:16:41.330	00:16:45.680	are taking the--whether they're bribes or favors--whatever they
227	00:16:45.690	00:16:49.010	are--just refuse to take them and discourage them, the
228	00:16:49.020	00:16:52.110	thing is over. Absolutely. And obviously the IOC has to
229	00:16:52.120	00:16:54.440	police itself, or at least that's what you would hope,
230	00:16:54.450	00:16:56.470	but they haven't. And, in fact, they've been having their
231	00:16:56.480	00:16:58.810	hands out saying give me more, give me more--golf
232	00:16:58.820	00:17:02.260	at Augusta National from the Atlanta people--again a legal
233	00:17:02.270	00:17:04.860	gift in that sense. I think what's going to have
234	00:17:04.870	00:17:08.150	to happen--What were you talking about there, the Augusta--
235	00:17:08.160	00:17:10.720	the people who on the IOC who were allowed to
236	00:17:10.730	00:17:13.760	play golf at the--At Augusta National--five members of
237	00:17:13.770	00:17:16.060	the IOC went and played golf at Augusta National, the
238	00:17:16.070	00:17:18.290	site of the masters, one of the hallowed grounds of
239	00:17:18.300	00:17:22.490	golf, as part of Atlanta's bid. At the time, Atlanta
240	00:17:22.500	00:17:24.900	was hoping that golf would be part of the Olympics,
241	00:17:24.910	00:17:27.200	and one of the reasons they allowed this to happen
242	00:17:27.210	00:17:28.760	is while they had to see the site, after all,
243	00:17:28.770	00:17:31.760	make sure all eighteen greens were up to Olympic standards.
244	00:17:31.770	00:17:33.950	Of course, golf was not in the Olympics. What kind
245	00:17:33.960	00:17:36.380	of perk is that? This again was legal. Atlanta was
246	00:17:36.390	00:17:38.550	doing nothing wrong, but I think the point that needs
247	00:17:38.560	00:17:41.050	to be made here is that Salt Lake City obviously,
248	00:17:41.060	00:17:43.720	if alleged--what is alleged is true--Salt Lake City
249	00:17:43.730	00:17:46.410	may have gone farther, but when you look at some
250	00:17:46.420	00:17:49.900	of the things the IOC was expecting, was wanting, I
251	00:17:49.910	00:17:52.340	would point my finger right at the IOC members, as
252	00:17:52.350	00:17:54.350	a journalist looking at this, and ask them the question,
253	00:17:54.360	00:17:57.750	why didn't you say, hey, we're getting this, we shouldn't
254	00:17:57.760	00:18:00.330	be getting this, and my sense of it is that
255	00:18:00.340	00:18:03.210	they cannot police themselves, but what we will see down
256	00:18:03.220	00:18:06.910	the road is a commission, perhaps ten, fifteen members, international--
257	00:18:06.920	00:18:09.740	an international body of people outside of the Olympic world
258	00:18:09.750	00:18:14.050	watching this very closely. What have the IOC members said,
259	00:18:14.060	00:18:16.380	themselves, about all of this, other than to appoint the
260	00:18:16.390	00:18:19.410	Mitchell Commission and other than that--and other things like
261	00:18:19.420	00:18:23.350	that--what have they said and done? Well, the individual
262	00:18:23.360	00:18:28.720	members of the IOC, some of whom have been accused,
263	00:18:28.730	00:18:32.270	deny the accusations. They're not saying much at all. The
264	00:18:32.280	00:18:35.460	International Olympic Committee, the executive board of the International Olympic
265	00:18:35.470	00:18:38.600	Committee, particularly Mark Hodler, who's the second most senior member
266	00:18:38.610	00:18:42.840	of the IOC, Juan Antonio Samaranch, the president of the
267	00:18:42.850	00:18:45.540	IOC, and Dick Pound, a vice president who's considered the
268	00:18:45.550	00:18:49.200	heir apparent to Juan Antonio Samaranch, they all have spoken
269	00:18:49.210	00:18:55.480	out. They generally have certainly condemned this kind of activity.
270	00:18:55.490	00:18:58.680	They have launched their own investigation. What they're interested in
271	00:18:58.690	00:19:01.950	doing it appears is taking away from the general membership
272	00:19:01.960	00:19:05.250	of the IOC those 115 members, the ability to choose
273	00:19:05.260	00:19:08.880	Olympic cities. They have talked about a process by which
274	00:19:08.890	00:19:12.270	that would be--the Olympic cities would be chosen by
275	00:19:12.280	00:19:16.660	the 11-member executive board. Juan Antonio Samaranch has tried this
276	00:19:16.670	00:19:21.060	before and the IOC has voted it down. This may
277	00:19:21.070	00:19:25.080	be the opportunity, though, with all the attention that is
278	00:19:25.090	00:19:28.210	now focused on this scandal for the IOC to finally
279	00:19:28.220	00:19:32.400	do this. And it may be a way certainly of
280	00:19:32.410	00:19:35.700	controlling corruption; it may also be a way of consolidating
281	00:19:35.710	00:19:40.120	power within the International Olympic Committee. It's a wieldy body
282	00:19:40.130	00:19:42.730	with 115 people from all over the world who come
283	00:19:42.740	00:19:45.420	from all kinds of cultures and who have different kinds
284	00:19:45.430	00:19:50.010	of expectations, and in some cultures, the kind of favors
285	00:19:50.020	00:19:53.500	that--exchange of favors that took place here is probably
286	00:19:53.510	00:19:56.530	not inappropriate at all. And not considered bribes. They're not
287	00:19:56.540	00:19:59.870	considered bribery. Part of the way that business is done
288	00:19:59.880	00:20:03.080	on an international level. I should point out that the
289	00:20:03.090	00:20:08.010	Justice Department is investigating. Sure. And there are federal laws
290	00:20:08.020	00:20:12.680	that do forbid this kind of activity; whether this particular
291	00:20:12.690	00:20:15.030	activity fits under those laws, that's what the Justice Department
292	00:20:15.040	00:20:18.210	is figuring out. But there are federal laws that prohibit
293	00:20:18.220	00:20:20.990	this kind of thing. Christine, what about the idea of
294	00:20:21.000	00:20:25.040	removing the decision making on where these games are from
295	00:20:25.050	00:20:27.390	that big--the big committee--and that might solve the
296	00:20:27.400	00:20:29.200	problem? I think that's a great idea, and obviously it
