index	starts	ends	content
589	00:37:21.330	00:37:24.240	of covering a Jason Bowman is spread over the entire
590	00:37:24.250	00:37:29.480	community of 230,000, not just the veterinary clinic group. It's
591	00:37:29.490	00:37:32.730	a system that like everything else in Rochester, it seems,
592	00:37:32.740	00:37:39.280	has its origins in the giant Eastman Kodak Corporation. Kodak
593	00:37:39.290	00:37:43.370	employs 40,000 people in Rochester. It's been a huge business
594	00:37:43.380	00:37:47.530	here and a philanthropic, even paternalistic presence since its founding
595	00:37:47.540	00:37:52.510	in the late 1800s by George Eastman. Early on as
596	00:37:52.520	00:37:57.340	healthcare began to become more and more expensive, he began
597	00:37:57.350	00:38:02.190	to look for ways of helping Kodak people prepare for
598	00:38:02.200	00:38:08.760	that, and that led to work in this community to
599	00:38:08.770	00:38:13.670	institute one of the very early insurance arrangements around hospital
600	00:38:13.680	00:38:18.010	care. Early medical insurance policies were priced according to community-wide
601	00:38:18.020	00:38:21.120	risk, but starting in the '30s as the health insurance
602	00:38:21.130	00:38:26.300	industry grew, the market became fragmented. Insurers offered big employers
603	00:38:26.310	00:38:30.580	discounts in exchange for their volume business, forming groups separate
604	00:38:30.590	00:38:35.570	from the community. What's left in the risk pool are
605	00:38:35.580	00:38:40.940	self-employed individuals or small businesses, like car dealerships. With indeterminate
606	00:38:40.950	00:38:44.400	risks, they are forced to pay higher premiums. They're also
607	00:38:44.410	00:38:48.770	subject to exclusion based on medical history, an insurance tactic
608	00:38:48.780	00:38:53.350	known as "cherry picking." In Rochester, however, spokesman David Edwards
609	00:38:53.360	00:38:56.520	says Kodak asked its insurer to stick with the community
610	00:38:56.530	00:39:00.700	rating system. We are, in effect, pooling with the large
611	00:39:00.710	00:39:05.880	numbers of small businesses and individuals. In fact, in this
612	00:39:05.890	00:39:09.190	community an individual can walk in off the street and,
613	00:39:09.200	00:39:12.880	in effect, pay the same price that Kodak pays for
614	00:39:12.890	00:39:17.490	healthcare. And it's more expensive to do that, so what
615	00:39:17.500	00:39:21.580	we wind up doing, in effect, is subsidizing to some
616	00:39:21.590	00:39:26.660	extent the administration and management of the care for those
617	00:39:26.670	00:39:30.250	groups. One reason Rochester is able to have a community
618	00:39:30.260	00:39:34.320	rating system is the city virtually has one insurance company,
619	00:39:34.330	00:39:37.370	Blue Cross Blue Shield of Rochester. You do have a
620	00:39:37.380	00:39:40.380	copy of the claim that you submitted? Kodak has long
621	00:39:40.390	00:39:44.620	given its insurance business exclusively to the Blues. Other employers
622	00:39:44.630	00:39:49.230	have followed suit, essentially sharing in Kodak's volume discount, giving
623	00:39:49.240	00:39:52.490	Blue Cross Blue Shield a near monopoly in Rochester and
624	00:39:52.500	00:39:56.860	keeping out the so-called "cherry picker" competitors. Howard Berman is
625	00:39:56.870	00:40:01.750	Blue Cross Blue Shield's chief executive officer. Large employers play
626	00:40:01.760	00:40:08.210	a--historically have played a remarkably important role, and particularly
627	00:40:08.220	00:40:11.770	the Eastman Kodak Company. We, however, at Blue Cross Blue
628	00:40:11.780	00:40:17.930	Shield have over 6,000 accounts, 6,000 businesses that buy health
629	00:40:17.940	00:40:22.160	insurance through us. Those businesses and Blue Cross Blue Shield
630	00:40:22.170	00:40:25.960	form a powerful coalition with a long history of negotiating
631	00:40:25.970	00:40:29.450	with doctors and hospitals to establish fees and keep costs
632	00:40:29.460	00:40:33.990	down. The results are readily evident. There's been no addition
633	00:40:34.000	00:40:38.680	to Rochester's hospital capacity since the 1960s in sharp contrast
634	00:40:38.690	00:40:45.250	to national trends. Today while hospitals nationwide are closing or
635	00:40:45.260	00:40:50.140	merging, Rochester's eight facilities are typically ninety, sometimes one hundred
636	00:40:50.150	00:40:55.090	percent occupied. Because they're all nearly full, hospitals cooperate more
637	00:40:55.100	00:40:58.340	than compete with each other. There is little duplication of
638	00:40:58.350	00:41:03.000	services. Radiologist Derace Schaffer says the big emphasis on cost
639	00:41:03.010	00:41:07.110	control means innovation and new technology come to Rochester much
640	00:41:07.120	00:41:10.720	later than other cities. There are other drawbacks, Dr. Schaffer
641	00:41:10.730	00:41:14.710	adds. We periodically close our emergency rooms to new patients
642	00:41:14.720	00:41:17.680	or we find ourselves at times having to discharge patients
643	00:41:17.690	00:41:19.840	somewhat earlier than we'd like to send them home just
644	00:41:19.850	00:41:22.010	because there aren't enough beds, not enough rooms in the
645	00:41:22.020	00:41:25.550	inn. And the same thing applies to our intensive care
646	00:41:25.560	00:41:27.970	units and coronary care unit beds in the community, where
647	00:41:27.980	00:41:31.200	we sometimes are shuffling patients around. While he praises the
648	00:41:31.210	00:41:35.240	community rating system for increasing access to healthcare, Schaffer is
649	00:41:35.250	00:41:39.250	critical of an approach he feels penalizes doctors. You cannot
650	00:41:39.260	00:41:41.790	place too much emphasis on the fact that the Rochester
651	00:41:41.800	00:41:45.420	system works because of the fact the physicians have accepted
652	00:41:45.430	00:41:48.950	a much lower reimbursement system here than elsewhere. Doctors are
653	00:41:48.960	00:41:52.590	also subjected to oversight from the insurance company. They must
654	00:41:52.600	00:41:56.890	often clear or justify medical or surgical decisions. Everyone else
655	00:41:56.900	00:42:00.440	in that system is concerned, primary concern is cost. The
656	00:42:00.450	00:42:03.890	physicians' primary concern is quality of care. The physicians find
657	00:42:03.900	00:42:08.460	themselves often placing themselves between the patients and the healthcare
658	00:42:08.470	00:42:11.860	system in order to protect the patients from the system.
659	00:42:11.870	00:42:14.900	However, patients of the Rochester healthcare system don't seem to
660	00:42:14.910	00:42:18.650	share that concern. A recent poll showed the vast majority
661	00:42:18.660	00:42:22.630	are satisfied. Dr. Robert Blendon of Harvard School of Public
662	00:42:22.640	00:42:26.430	Health who conducted the survey says overall, Rochester has a
663	00:42:26.440	00:42:29.940	balanced approach. I just don't see any evidence that Rochester
664	00:42:29.950	00:42:34.260	is a model of a declining culture of medical practice.
665	00:42:34.270	00:42:37.940	I think physicians who are paid less are angry, and
666	00:42:37.950	00:42:40.390	I can understand their frustration, but that's one of the
667	00:42:40.400	00:42:43.230	reasons why the average person in Rochester can afford their
668	00:42:43.240	00:42:46.860	health insurance. So if we have to trade off somewhat
669	00:42:46.870	00:42:50.560	less well paid physicians for people who can afford healthcare,
670	00:42:50.570	00:42:54.020	I always come down for healthcare. Along with doctors, Blendon
671	00:42:54.030	00:42:56.630	says patients will have to come to terms with limits
672	00:42:56.640	00:42:59.770	to their autonomy. It's a dilemma the Bowmans faced when
673	00:42:59.780	00:43:02.970	they attempted to move Jason to a rehabilitation facility in
674	00:43:02.980	00:43:07.200	Denver. The local hospital refused to make the referral needed
675	00:43:07.210	00:43:10.220	under their managed care policy. That was a plain old
676	00:43:10.230	00:43:14.440	statement that "this was as good as any other spinal
677	00:43:14.450	00:43:18.170	rehab facility in the world." And that's a quote. It's
678	00:43:18.180	00:43:21.460	not as good as any other. After producing research showing
679	00:43:21.470	00:43:25.670	Rochester lacked the specialized facility her son needed, Barbara Bowman
680	00:43:25.680	00:43:30.150	says the insurer relented. We can do that. Other people
681	00:43:30.160	00:43:34.370	that were maybe not quite as knowledgeable or a little
682	00:43:34.380	00:43:36.980	bit more meek than we were may have not been
683	00:43:36.990	00:43:39.440	effective in doing that. I don't know. Well, we're going
684	00:43:39.450	00:43:43.430	to face a choice. If you want an insurance plan
685	00:43:43.440	00:43:47.570	that allows you to go, for example, to every cancer
686	00:43:47.580	00:43:50.490	center in America that you choose, that plan will be
687	00:43:50.500	00:43:55.140	more expensive than one that says we've negotiated a special
688	00:43:55.150	00:43:58.510	rate at a center in our community. And I think
689	00:43:58.520	00:44:00.210	we're going to have to decide as a country if
690	00:44:00.220	00:44:03.920	we want to allow people to make those choices. The
691	00:44:03.930	00:44:06.970	Rochester plan was closely studied by members of the Clinton
692	00:44:06.980	00:44:09.520	task force, and parts of it will be reflected in
693	00:44:09.530	00:44:21.030	the plan Mr. Clinton presents to the Congress later tonight.
694	00:44:21.040	00:44:25.420	Finally tonight, one of our weekly Charlayne Hunter-Gault conversations. As
695	00:44:25.430	00:44:28.920	events unfolded in Moscow yesterday and today, the world was
696	00:44:28.930	00:44:32.850	scrambling to react to the situation. The breathtaking pace of
697	00:44:32.860	00:44:36.480	current events and how they frequently catch us unaware is
698	00:44:36.490	00:44:38.700	the theme of a new book The Roar of the
699	00:44:38.710	00:44:43.170	Crowd, How Television and People Power are Changing the World.
700	00:44:43.180	00:44:46.220	It's by former New York Daily News editor Mike O'Neill,
701	00:44:46.230	00:44:49.930	who recently sat down with Charlayne. Michael O'Neill, thank you
702	00:44:49.940	00:44:53.560	for joining us. Great to be here, Charlayne. You believe
703	00:44:53.570	00:44:57.600	that we're in the midst of a revolution not only
704	00:44:57.610	00:45:01.250	in America but in the entire world. Tell me a
705	00:45:01.260	00:45:04.390	little bit about that revolution. Well, I think that in
706	00:45:04.400	00:45:06.770	order to understand a lot of the dynamics of what's
707	00:45:06.780	00:45:09.080	now going on all over the world in terms of
708	00:45:09.090	00:45:13.910	ethnic strife and turmoil here and turmoil there, we have
709	00:45:13.920	00:45:15.930	to understand I think that one of the real catalysts
710	00:45:15.940	00:45:18.900	of all this is what I would call the mass
711	00:45:18.910	00:45:26.640	communications revolution, i.e., the enormous spread of television, computers, satellites,
712	00:45:26.650	00:45:31.410	et cetera, which is drawing the entire world together, much
713	00:45:31.420	00:45:37.600	more closely together than ever before in history. And it's--
714	00:45:37.610	00:45:40.830	it's a very profound kind of a revolution, just take
715	00:45:40.840	00:45:44.530	one aspect of it all. You now have most of--
716	00:45:44.540	00:45:48.680	certainly a large majority of the people of the world
717	00:45:48.690	00:45:53.530	seeing the world, seeing the world around them through television
718	00:45:53.540	00:45:56.350	for the first time in history, peasants who have never
719	00:45:56.360	00:46:01.250	even--don't even know how to read are able to
720	00:46:01.260	00:46:06.970	tune into the world. The monopoly of literacy, which has
721	00:46:06.980	00:46:12.010	existed really since the beginning of human history, that monopoly
722	00:46:12.020	00:46:15.790	has now been broken. What does it mean? After years
723	00:46:15.800	00:46:22.360	of exclusion really, ordinary people now are able to demand
724	00:46:22.370	00:46:26.590	their place in the sun. They're able to say that
725	00:46:26.600	00:46:28.750	they want the kind of life, the good life that
726	00:46:28.760	00:46:32.030	they see on the screen. That's what you, what's you
727	00:46:32.040	00:46:37.890	call "people power?" People power right, people that, for example,
728	00:46:37.900	00:46:42.430	in remote areas of China are now aware of the
729	00:46:42.440	00:46:46.150	enormous increase in economic wellbeing and the good life, for
730	00:46:46.160	00:46:50.480	example, being led by many of their fellow Chinese say
731	00:46:50.490	00:46:56.940	in Eastern provinces, in Fujian and Guan Dong. And they
732	00:46:56.950	00:47:02.970	then register their feelings locally, and those are felt and
733	00:47:02.980	00:47:06.810	even though they are not out necessarily demonstrating today or
734	00:47:06.820	00:47:10.360	tomorrow or the next day, although there is, as we
735	00:47:10.370	00:47:12.570	see all over the world, a great deal of activism.
736	00:47:12.580	00:47:15.940	We see people migrating as a result of what they
737	00:47:15.950	00:47:21.030	see on television. We see people demonstrating. The students in
738	00:47:21.040	00:47:28.110	Tiananmen Square had seen demonstrations in South Korea that influenced
739	00:47:28.120	00:47:33.890	their desire to demonstrate in Tiananmen Square, an amazing thing.
740	00:47:33.900	00:47:35.690	One of the things you write in your book is
741	00:47:35.700	00:47:40.000	that society shaped by the mass media are coming to
742	00:47:40.010	00:47:45.770	dominate the world. Tell me a little about that. Well,
743	00:47:45.780	00:47:48.850	let's take, for example, this fad that we now have
744	00:47:48.860	00:47:50.760	going around the world. We have the idea in the
745	00:47:50.770	00:47:54.630	United States that somehow or other democracy has triumphed as
746	00:47:54.640	00:47:59.770	a result of the collapse of Communism. And it's true
747	00:47:59.780	00:48:04.090	that Communism has collapsed, but we don't--I don't think
748	00:48:04.100	00:48:08.070	we know whether democracy is going to triumph. One of
749	00:48:08.080	00:48:12.370	the aspects of, and one of the most popular aspects
750	00:48:12.380	00:48:19.510	of the so-called western, liberal western approach to government, et
751	00:48:19.520	00:48:30.210	cetera, is a, a consumerism, i.e., a mass marketing of
752	00:48:30.220	00:48:34.510	goods, a mass marketing of services, et cetera, and that
753	00:48:34.520	00:48:38.920	is now being spread around the world as part of
754	00:48:38.930	00:48:43.660	the democratic "western model" of the way a global, an
755	00:48:43.670	00:48:47.830	interdependent global economy is now going to operate. What does
756	00:48:47.840	00:48:52.740	that do? In China now, you have TV commercials which
757	00:48:52.750	00:48:57.160	people are being urged to buy this, that or other
758	00:48:57.170	00:49:03.400	individual item, consumer goods, toothpaste, what have you. Well, that
759	00:49:03.410	00:49:09.840	is the phenomenal--that's a real phenomenon because it is
760	00:49:09.850	00:49:18.040	a direct approach to an individual consumer in China and
761	00:49:18.050	00:49:20.860	asking that consumer to make a decision on the basis
762	00:49:20.870	00:49:26.010	of what he or she saw on television, that is
763	00:49:26.020	00:49:31.800	pushing the idea of individualism that is quite antithetical to
764	00:49:31.810	00:49:40.350	the kind of family-oriented, ancestor, ancestor-oriented, or group-oriented kind of
765	00:49:40.360	00:49:43.690	society that has existed for centuries in China. Now nothing's
766	00:49:43.700	00:49:51.090	going to happen today or tomorrow, but what this whole
767	00:49:51.100	00:49:55.740	force is doing, all this mass communication of the mass
768	00:49:55.750	00:50:01.410	marketing idea, is doing, it's breaking down these kinds of
769	00:50:01.420	00:50:08.960	social patterns, and at the same time it's, it's--it
770	00:50:08.970	00:50:15.080	tends to promote individualism versus collectivism, which is the hallmark
771	00:50:15.090	00:50:21.500	of the totalitarian systems. And it promotes pluralism as against
772	00:50:21.510	00:50:26.330	mass, the kind of mass governance that we saw in
773	00:50:26.340	00:50:31.610	the case of Nazism. But you also say that while
774	00:50:31.620	00:50:36.910	people power is becoming nearly universal, it is, because of
775	00:50:36.920	00:50:41.820	the nature of the medium, the potential for having power
776	00:50:41.830	00:50:48.150	without knowledge is great. Right. Now explain that. Well, I
777	00:50:48.160	00:50:50.550	guess what I'm talking about there is the fact that
778	00:50:50.560	00:50:55.470	if you have a governing, a system of government in
779	00:50:55.480	00:51:00.850	which the decisions are being driven by instant emotional reactions
780	00:51:00.860	00:51:04.130	to an event, for example, why did the United States
781	00:51:04.140	00:51:07.000	become involved in Somalia? It became involved because of the
782	00:51:07.010	00:51:12.290	emotional reaction of the American people. Why did President Mitterrand
783	00:51:12.300	00:51:15.840	fly to Sarajevo? Because he was under pressure to do
784	00:51:15.850	00:51:19.830	something. Of course, he ultimately never, never, ultimately didn't do
785	00:51:19.840	00:51:24.000	very much. But that's a good thing, isn't it? Yeah.
786	00:51:24.010	00:51:25.850	The part of it that's good, of course, is that
787	00:51:25.860	00:51:31.030	it does force the governing, ruling elite, if you will,
788	00:51:31.040	00:51:34.700	to be conscious of and to respond and be sensitive
789	00:51:34.710	00:51:38.350	to public opinion. On the other hand, if that public
790	00:51:38.360	00:51:45.160	opinion demands immediate action in any given instance, it eliminates
791	00:51:45.170	00:51:51.020	the kind of deliberative process, the period of time when
792	00:51:51.030	00:51:55.050	you would take normally to study a problem and deliberate
793	00:51:55.060	00:51:58.550	the pros and cons, consider all the options, and ultimately
794	00:51:58.560	00:52:04.210	make a decision based on a very reasoned kind of
795	00:52:04.220	00:52:10.170	discourse, and deliberative process. That's quite different from immediately reacting
796	00:52:10.180	00:52:14.170	to some emotional explosion. The other part of all this
797	00:52:14.180	00:52:20.550	is it tends to, to focus the leadership of the
798	00:52:20.560	00:52:25.840	government, say the White House, on a daily rush of
799	00:52:25.850	00:52:31.760	crises--the floods out in the Middle West one day,
800	00:52:31.770	00:52:36.990	the riots in South Central Los Angeles another day. And
801	00:52:37.000	00:52:43.050	longer range and deeper problems that have no telegenicity, that
802	00:52:43.060	00:52:47.670	have no--cannot be easily translated into images--those tend
803	00:52:47.680	00:52:51.070	to fall into the back burner, don't get any attention
804	00:52:51.080	00:52:53.240	at all. And yet, in the long run, they may
805	00:52:53.250	00:52:57.190	be much more, much more important to deal with. You
806	00:52:57.200	00:53:01.980	also believe that journalists are complicit in this, right? Well,
807	00:53:01.990	00:53:08.510	yeah, right. You mean, me? Co-conspirators, present company excepted of
808	00:53:08.520	00:53:11.020	course. Of course. One of the things you say is
809	00:53:11.030	00:53:14.920	that journalists arrive late at the front lines of history.
810	00:53:14.930	00:53:18.770	Right, right. What's the answer to this? I mean, because
811	00:53:18.780	00:53:23.300	you write about a society dominated by mass media that
812	00:53:23.310	00:53:30.080	is a--appealing to the lowest common denominator of culture.
813	00:53:30.090	00:53:33.350	You talked about the consumerism now, the lowest common denominator
814	00:53:33.360	00:53:39.190	of politics. What's the answer? Well--Is the genie out
815	00:53:39.200	00:53:43.110	of the bottle? I think it is. I think technology
816	00:53:43.120	00:53:48.570	is really driving society. It is actually driving change, and
817	00:53:48.580	00:53:54.090	the velocity, and the volume of change are simply enormous,
818	00:53:54.100	00:53:59.800	and it's driving change faster than institutions, including journalism, are
819	00:53:59.810	00:54:06.890	able to, to adapt to that change. And I--the
820	00:54:06.900	00:54:09.780	great fear I have, instead of all this euphoria about
821	00:54:09.790	00:54:12.550	the collapse of Communism and the heyday of a new
822	00:54:12.560	00:54:20.080	world order, as George Bush put it, is that, that
823	00:54:20.090	00:54:24.790	we may have the--we may--the stresses of social
824	00:54:24.800	00:54:29.820	and political stresses may be building up so rapidly, so
825	00:54:29.830	00:54:34.390	much faster than the institutions are adapting to, to cope
826	00:54:34.400	00:54:37.980	with 'em, you can have the same kind of social
827	00:54:37.990	00:54:40.540	breakdown that you had after World War I, which would
828	00:54:40.550	00:54:43.910	be an absolute catastrophe. Do I have the solution to
829	00:54:43.920	00:54:46.300	this? If there is any kind of solution at all,
830	00:54:46.310	00:54:48.820	I think we have to put an emphasis on prevention
831	00:54:48.830	00:54:52.350	instead of reaction. Journalism now is designed to react. It's
832	00:54:52.360	00:54:56.760	designed to report what has already happened. But it's always
833	00:54:56.770	00:54:59.540	been the case. Yes, exactly. So what's different, and what's
834	00:54:59.550	00:55:03.470	new? And why would someone watching this not say, well,
835	00:55:03.480	00:55:06.470	these are the musings of a print man who's probably
836	00:55:06.480	00:55:12.800	always had an electronic media bias? Right. Exactly. Well, No.
837	00:55:12.810	00:55:14.720	1, I think that the print media have the same
838	00:55:14.730	00:55:17.430	responsibility to try to move ahead of the curb, to
839	00:55:17.440	00:55:19.910	get ahead of the curb, rather than falling in behind
840	00:55:19.920	00:55:23.270	the curb. Now, as I say in the book, I
841	00:55:23.280	00:55:25.820	don't know whether this could be achieved or not. I'm
842	00:55:25.830	00:55:30.080	just saying that an ideal world would be one in
843	00:55:30.090	00:55:35.210	which journalism, politics, and diplomacy would try to catch social
844	00:55:35.220	00:55:38.000	change at a much earlier stage. If we don't do
845	00:55:38.010	00:55:45.780	that, all sorts of tremendous problems are coming down, coming
846	00:55:45.790	00:55:50.690	down the pike at us, and the psychology that is
847	00:55:50.700	00:55:55.940	integral to what, the kind of mass consumerism that we're
848	00:55:55.950	00:56:00.590	talking about, the so-called mass market economy that we're pushing
849	00:56:00.600	00:56:05.150	around the world, that psychology is to think about today
850	00:56:05.160	00:56:09.200	and not tomorrow. And I worry. That's a very serious
851	00:56:09.210	00:56:12.460	concern of mine. Well, Michael O'Neill, I hate to end
852	00:56:12.470	00:56:15.660	on that note, but we will. Thank you for joining
853	00:56:15.670	00:56:28.550	us. Thank you. Again, the main stories of this Wednesday,
854	00:56:28.560	00:56:31.490	at least 40 people were killed when an Amtrak passenger
855	00:56:31.500	00:56:35.510	train derailed and plunged into a bayou near Mobile, Alabama.
856	00:56:35.520	00:56:39.430	Officials said 13 people are still missing. Boris Yeltsin appeared
857	00:56:39.440	00:56:41.660	to gain the upper hand in this political battle with
858	00:56:41.670	00:56:45.380	hardliners for control of Russia, and President Clinton prepared to
859	00:56:45.390	00:56:48.680	unveil details of his long-awaited healthcare reform plan in his
860	00:56:48.690	00:56:52.320	speech to the Congress. Good night, Margaret. Good night, Roger.
861	00:56:52.330	00:56:54.900	That's the NewsHour for tonight. We will have full coverage
862	00:56:54.910	00:56:57.880	of the President's healthcare speech to Congress later tonight on
863	00:56:57.890	00:57:01.600	most of these PBS stations, and we'll be back tomorrow
864	00:57:01.610	00:57:04.620	with an in-depth look at the Clinton plan. I'm Margaret
865	00:57:04.630	01:03:12.177	Warner. Thank you, and good night.
