index	starts	ends	content
898	00:56:19.320	00:56:23.530	great literature, you probably will let 'em spend, spend as
899	00:56:23.540	00:56:26.130	much time as they want. And so we'll have to
900	00:56:26.140	00:56:29.620	have a tool where a parent without being invasive can
901	00:56:29.630	00:56:32.120	get a sense of how is the kid using the
902	00:56:32.130	00:56:36.570	computer and even set a time budget for certain kinds
903	00:56:36.580	00:56:40.600	of activities and, therefore, shape what the kid does. My
904	00:56:40.610	00:56:45.330	parents prevented my sister and I from watching TV when
905	00:56:45.340	00:56:48.040	we were growing up, and I frankly, I'm glad they
906	00:56:48.050	00:56:52.710	did. We ended up reading quite a bit and I
907	00:56:52.720	00:56:56.380	don't think we missed all, all that much. So parental
908	00:56:56.390	00:56:59.540	control over how kids spend their time, I think it's
909	00:56:59.550	00:57:12.930	a worthy trade-off. Thank you. Again, the major stories of
910	00:57:12.940	00:57:16.940	this Thursday, Senate Republicans reluctantly began to support sending U.S.
911	00:57:16.950	00:57:20.420	troops to Bosnia. The Secretaries of State and Defense testified
912	00:57:20.430	00:57:24.500	about the President's Bosnia strategy on Capitol Hill, and deadlocked
913	00:57:24.510	00:57:28.020	budget negotiators cancelled their talks until Monday. We'll see you
914	00:57:28.030	00:57:31.490	tomorrow night with our weekly political analysis, among other things.
915	00:57:31.500	00:58:41.306	I'm Jim Lehrer. Thank you and good night.
