index	starts	ends	content
301	00:20:50.860	00:20:53.800	McCain and Bush are moving away from. What they talk
302	00:20:53.810	00:20:56.630	about is limited but energetic government. They talk about using
303	00:20:56.640	00:20:59.210	government in an affirmative way and a conservative way. They
304	00:20:59.220	00:21:02.400	talk about restoring faith in public service. What they're doing
305	00:21:02.410	00:21:05.550	is they're going back to a Teddy Roosevelt, Abraham Lincoln
306	00:21:05.560	00:21:09.030	style of Republicanism. Teddy Roosevelt said I'm the hero of
307	00:21:09.040	00:21:11.410	San Juan Hill; only you can trust me to reform
308	00:21:11.420	00:21:14.030	government, to take on those special interests. Well, who's saying
309	00:21:14.040	00:21:17.600	that today? That's John McCain. So-just if I could finish,
310	00:21:17.610	00:21:20.330	Steve Forbes came to the debate yesterday armed to the
311	00:21:20.340	00:21:22.170	teeth to take this on. He was going to call
312	00:21:22.180	00:21:25.880	it tax-and-spend conservatism. But because Bush wasn't there and because
313	00:21:25.890	00:21:27.650	the way the questions were asked, he didn't get a
314	00:21:27.660	00:21:30.060	chance to launch that argument but it's an argument the
315	00:21:30.070	00:21:34.360	Republican Party has to have. Indeed before the debate, the
316	00:21:34.370	00:21:37.340	many people who are well paid by the Forbes campaign
317	00:21:37.350	00:21:43.150	were circulating these rather large tomes documenting sins of spending
318	00:21:43.160	00:21:49.380	and taxation by Governor Bush...In Texas? Yes, as governor.
319	00:21:49.390	00:21:54.260	And then just not delivered. Whereas McCain came to that
320	00:21:54.270	00:21:58.880	debate armed with stuff he was going to put out,
321	00:21:58.890	00:22:01.800	which he then did. And I was struck, not just
322	00:22:01.810	00:22:04.140	by him, but by some of the others about how
323	00:22:04.150	00:22:09.390	thoroughly put together their campaigns are intellectually at this point.
324	00:22:09.400	00:22:11.680	And that is a distinction with Governor Bush, I would
325	00:22:11.690	00:22:14.840	argue at this point. What do you mean, Tom? Well,
326	00:22:14.850	00:22:17.670	McCain on taxes I think would be a good example
327	00:22:17.680	00:22:20.930	last night. He's saying, look, that thing that passed Congress
328	00:22:20.940	00:22:24.770	and Clinton vetoed a month or two ago, half of
329	00:22:24.780	00:22:29.990	it was just special interest garbage that weighed it down.
330	00:22:30.000	00:22:33.200	If you have real reform, you won't have those special
331	00:22:33.210	00:22:37.010	interest goodies in a tax cut bill; you'll have rate
332	00:22:37.020	00:22:40.310	cuts for people. That was his message. Reform can work
333	00:22:40.320	00:22:44.030	for conservatives. Governor Bush is still a ways away from
334	00:22:44.040	00:22:46.470	even having a position on taxes. I'm not sure I
335	00:22:46.480	00:22:48.330	agree with that. I think he has given speeches which
336	00:22:48.340	00:22:51.890	were tremendously effective and intellectually coherent, Governor Bush. What he
337	00:22:51.900	00:22:55.220	said he-I stand for governing conservatism--not the opposition
338	00:22:55.230	00:22:57.980	conservatism of Newt Gingrich and Dick Armey, not the no,
339	00:22:57.990	00:23:01.900	no, no. He said I stand for using government. He
340	00:23:01.910	00:23:03.550	and McCain both say that, but they say it in
341	00:23:03.560	00:23:08.000	different spheres. Bush is more comfortable talking about education, charity,
342	00:23:08.010	00:23:11.930	poverty programs, using government very specifically in those areas. McCain
343	00:23:11.940	00:23:14.550	is less comfortable talking about that; he's more comfortable talking
344	00:23:14.560	00:23:18.370	about national reform, international activism. What about the fight that's
345	00:23:18.380	00:23:21.500	going on to the right of those two men, essentially
346	00:23:21.510	00:23:24.890	between Forbes and Bauer at this point? How did that
347	00:23:24.900	00:23:28.220	appearance last night affect that, do you think? Well, the
348	00:23:28.230	00:23:30.600	amazing thing, the first...let's talk about the context. This
349	00:23:30.610	00:23:32.550	was a party run by the conservative movement, by the
350	00:23:32.560	00:23:36.070	Goldwaterites three years ago. The two major candidates, the two
351	00:23:36.080	00:23:38.710	top contenders are not in that tradition-McCain and Bush
352	00:23:38.720	00:23:42.090	are not in that Goldwater tradition. Bauer and Forbes are
353	00:23:42.100	00:23:43.890	fighting for that tradition. And I would say on the
354	00:23:43.900	00:23:47.660	conservative buzz over the past year, over the past few
355	00:23:47.670	00:23:50.480	weeks, has been the fall of Steve Forbes. He's been
356	00:23:50.490	00:23:53.500	running for office for five years. He spent $60 million.
357	00:23:53.510	00:23:56.310	He's at 4 percent nationally, he's almost nowhere in New
358	00:23:56.320	00:24:00.410	Hampshire. He's slightly above Bauer and Keyes and Hatch, and
359	00:24:00.420	00:24:02.390	so they're fighting over what is turning out to be
360	00:24:02.400	00:24:04.720	a small rump. And I think Bauer is doing quite
361	00:24:04.730	00:24:07.970	a good job in part because Forbes is bleeding--just
362	00:24:07.980	00:24:10.480	interest among his true believers is bleeding. There is a
363	00:24:10.490	00:24:14.680	substantive element, I think, to it as well. Bauer's economic
364	00:24:14.690	00:24:18.650	version of flat tax is a little bit more populist,
365	00:24:18.660	00:24:21.870	a little bit more aimed downscale. You could almost sense
366	00:24:21.880	00:24:25.850	last night him aiming for what's left of the Pat
367	00:24:25.860	00:24:30.260	Buchanan vote in 1996. Listen to what he said on
368	00:24:30.270	00:24:34.750	education...immigration rather-That is a Pat Buchanan issue. Indeed,
369	00:24:34.760	00:24:38.980	very much so. But it's at the margins and you
370	00:24:38.990	00:24:43.260	can feel it there. There is this incredible prosperity in
371	00:24:43.270	00:24:46.270	New Hampshire. This is not an angry state the way
372	00:24:46.280	00:24:48.840	it was eight years ago. And I think the politics
373	00:24:48.850	00:24:52.170	on the Republican side reflects that. Speaking in pure political
374	00:24:52.180	00:24:54.880	terms now, what does the fact that George W. Bush
375	00:24:54.890	00:24:57.170	was not there last night, what does that mean and
376	00:24:57.180	00:24:58.880	how does that hurt Bush, if at all? Well, this
377	00:24:58.890	00:25:01.450	is the third or fourth element running in a story
378	00:25:01.460	00:25:04.880	running for four weeks now. You don't come here enough.
379	00:25:04.890	00:25:06.740	They say that in Iowa too; when you come, you
380	00:25:06.750	00:25:11.100	don't say much. Your positions aren't that fleshed out in
381	00:25:11.110	00:25:14.690	the sense that they make sense to an individual voter.
382	00:25:14.700	00:25:18.560	And you got to start working for it. Now he
383	00:25:18.570	00:25:21.510	can change all that in a New York minute. But
384	00:25:21.520	00:25:24.580	there has been...A New Hampshire minute. New Hampshire minute,
385	00:25:24.590	00:25:28.170	it takes longer. That's about 95 seconds, I think, the
386	00:25:28.180	00:25:32.360	last I heard. So he can change it. But the
387	00:25:32.370	00:25:35.750	dynamic for the last month has been one thing after
388	00:25:35.760	00:25:38.350	another and really for the last week all he communicated
389	00:25:38.360	00:25:40.610	in New Hampshire was why he wasn't coming. Does he
390	00:25:40.620	00:25:43.110	hurt himself? Yes. I think he has. First, it's a
391	00:25:43.120	00:25:44.960	sign is he too smug? And in New Hampshire, they're
392	00:25:44.970	00:25:46.630	only allowed to be smug. No one else is allowed
393	00:25:46.640	00:25:49.410	to be smug in New Hampshire. But, secondly because he
394	00:25:49.420	00:25:52.070	needs practice. The guy has not been out debating. There
395	00:25:52.080	00:25:55.180	were some weird questions last night about marijuana, industrial hemp
396	00:25:55.190	00:25:58.830	or whatever. And more are coming. NASA--you need practice.
397	00:25:58.840	00:26:02.120	So, he needs some help on that. Finally, he is
398	00:26:02.130	00:26:04.060	going to show up and debate finally, and when that
399	00:26:04.070	00:26:06.250	comes, us media types are going to be there in
400	00:26:06.260	00:26:08.910	force. And if he had shown up at all, no
401	00:26:08.920	00:26:11.250	individual debate would be so important. But if he only
402	00:26:11.260	00:26:13.750	shows up at a few, each one is mammoth. And
403	00:26:13.760	00:26:17.400	a mistake there becomes catastrophic. The Democrats--your analysis of
404	00:26:17.410	00:26:19.450	how Gore did the other night, David. I'm a little
405	00:26:19.460	00:26:22.020	outside what I see the polls are today. I thought
406	00:26:22.030	00:26:25.380	Bradley wiped the floor with him. I thought Bradley said-
407	00:26:25.390	00:26:27.400	came out and said, I'm a grown-up guy. I'm sitting
408	00:26:27.410	00:26:30.450	here telling you what I believe. Al Gore struck me,
409	00:26:30.460	00:26:33.320	he took the focus group Viagra...and he just came
410	00:26:33.330	00:26:35.810	out and said-What? You said focus group Viagra? Yes.
411	00:26:35.820	00:26:38.350	Somebody compared him to an animal that had been caged
412	00:26:38.360	00:26:40.390	up, and they let him loose, and he was oozing
413	00:26:40.400	00:26:43.810	empathy and doing these cheap tricks. I thought the trick
414	00:26:43.820	00:26:46.560	of staying later after the cameras and going on for
415	00:26:46.570	00:26:48.950	another 90 minutes, somebody said it looked like a kid
416	00:26:48.960	00:26:51.330	who volunteers for more homework. I though it just looks
417	00:26:51.340	00:26:53.740	artificial. And that plays into the line the Bradley people
418	00:26:53.750	00:26:56.880	have been pitching, which is that he's the authentic candidate
419	00:26:56.890	00:27:01.530	and Gore is the synthetic candidate. Bradley is dull but
420	00:27:01.540	00:27:05.300	dignified, Gore is Cheese Whiz. And I think that debate
421	00:27:05.310	00:27:08.350	to me, that underlined that Bradley line. Tom. That's a
422	00:27:08.360	00:27:14.790	lot of certainty which I can't match. Try. A little
423	00:27:14.800	00:27:18.230	bit more agnostic, perhaps. Maybe as a little clue to
424	00:27:18.240	00:27:20.720	what I thought was happening. You know, everybody gets asked
425	00:27:20.730	00:27:23.740	who's your favorite President. That's a standard one. I don't
426	00:27:23.750	00:27:25.640	know if Bush is ready for it, but these guys
427	00:27:25.650	00:27:31.790	get it all the time. He better say...Exactly. That's
428	00:27:31.800	00:27:36.270	easy. But Senator Bradley has always for some obscure reason
429	00:27:36.280	00:27:40.620	included James K. Polk in his pantheon of heroes. And
430	00:27:40.630	00:27:44.840	on Wednesday night James K. Polk was missing. And I'm
431	00:27:44.850	00:27:50.170	thinking why is that? I think he is beginning to
432	00:27:50.180	00:27:53.540	realize that he is the favorite in New Hampshire and
433	00:27:53.550	00:27:57.430	perhaps in the Northeast, and he's adjusting to it a
434	00:27:57.440	00:28:01.140	little bit awkwardly. And I think his own people had
435	00:28:01.150	00:28:03.970	a little problem with his performance Wednesday night because they
436	00:28:03.980	00:28:05.500	thought he might have been a little stiff and a
437	00:28:05.510	00:28:09.570	little bit standoffish. But is that the natural Bill Bradley?
438	00:28:09.580	00:28:14.410	Mostly. I didn't think he was as engaged in the
439	00:28:14.420	00:28:17.240	audience as he is in his meetings when you almost
440	00:28:17.250	00:28:20.030	feel like you're having a conversation with him. It's that
441	00:28:20.040	00:28:25.260	intimate and successful...a little less so Wednesday night. Gore,
442	00:28:25.270	00:28:27.520	people could see what's going on for the last six
443	00:28:27.530	00:28:31.310	weeks. It appears to have stabilized the situation in New
444	00:28:31.320	00:28:34.610	Hampshire. One reason I shrink from David's certainty here....I
445	00:28:34.620	00:28:40.220	said I was outside the mainstream. You know-I hear
446	00:28:40.230	00:28:42.420	what you're saying and I think it's entirely valid. What
447	00:28:42.430	00:28:46.330	holds me back is that I have experienced some of
448	00:28:46.340	00:28:48.970	this Gore-these Gore meetings. They can go on for
449	00:28:48.980	00:28:51.240	two or three hours. I mean, he stays until the
450	00:28:51.250	00:28:54.520	last question is asked. It could be UFO's, it could
451	00:28:54.530	00:28:58.350	be paving roads in northern New Hampshire. He'll just stay.
452	00:28:58.360	00:29:01.090	And some people in the national press had an opportunity
453	00:29:01.100	00:29:03.920	Wednesday night to actually see what this is like. You
454	00:29:03.930	00:29:06.200	walked into that room afterwards. He sat there for two
455	00:29:06.210	00:29:08.910	hours on the stage with his stage dangling over--with
456	00:29:08.920	00:29:13.180	his wife, just having a conversation. And it works. There
457	00:29:13.190	00:29:16.160	is a personal connection that goes on. And it is
458	00:29:16.170	00:29:19.700	a different kind of relationship between Gore and voters than
459	00:29:19.710	00:29:24.410	there was, say in September. What's different is that this
460	00:29:24.420	00:29:29.300	is a close race. It feels like Ford-Reagan in 1976.
461	00:29:29.310	00:29:31.390	And that's what holds me back from saying one of
462	00:29:31.400	00:29:33.320	them is pulling way out in front. But are the
463	00:29:33.330	00:29:35.680	two of you are talking from two different perspectives? You're
464	00:29:35.690	00:29:38.950	talking about the way they project on television. You're talking
465	00:29:38.960	00:29:43.330	about the way they project closeup--in other words, retail-wholesale.
466	00:29:43.340	00:29:46.200	Well, yes, except the coverage of Gore in New Hampshire
467	00:29:46.210	00:29:49.070	and Iowa is more intimate, also and I think that
468	00:29:49.080	00:29:52.880	accounts for some of the stabilizing that's gone on. Do
469	00:29:52.890	00:29:55.200	you agree, David, with what Tom said, that the race
470	00:29:55.210	00:29:58.490	feels close? Oh, absolutely. I mean the polls are now
471	00:29:58.500	00:30:00.410	within four or five points. And you can sense it
472	00:30:00.420	00:30:03.530	in the way Gore is attacking. His people clearly think
473	00:30:03.540	00:30:05.820	he's best on the attack. To me, again it's a
474	00:30:05.830	00:30:07.580	little weird. It's like watching an eagle scout trying to
475	00:30:07.590	00:30:11.440	mug somebody. I don't find him persuasive. But I think
476	00:30:11.450	00:30:15.500	the thing they know is that he can't be defensive.
477	00:30:15.510	00:30:17.730	And there's also the question of how much Bradley wants
478	00:30:17.740	00:30:20.940	this. If the race gets nasty, Bradley's always been this
479	00:30:20.950	00:30:24.400	aloof guy. Is he really going to fight back? Example.
480	00:30:24.410	00:30:38.730	Save for another time. Thank you both, gentlemen. Still to
481	00:30:38.740	00:30:42.580	come on the NewsHour tonight, the morning news wars and
482	00:30:42.590	00:30:46.550	the president of Nigeria. Media Correspondent Terence Smith has the
483	00:30:46.560	00:30:54.670	morning news story. For the past five months, CBS News
484	00:30:54.680	00:30:58.080	has been getting ready to do battle. Its weapon...a
485	00:30:58.090	00:31:01.840	30 million dollar state of the art street level studio
486	00:31:01.850	00:31:04.390	in the heart of New York City. Next week, the
487	00:31:04.400	00:31:07.920	network will launch a fresh assault in the high-stakes morning
488	00:31:07.930	00:31:13.210	news television wars. This week veteran anchor Bryant Gumbel and
489	00:31:13.220	00:31:16.580	newcomer Jane Clayson led a parade of press around their
490	00:31:16.590	00:31:19.260	new set. A lot of work remained to be done
491	00:31:19.270	00:31:22.430	to get it ready by 7 AM Monday, when they
492	00:31:22.440	00:31:25.590	plan to broadcast live from this pricey piece of real
493	00:31:25.600	00:31:30.480	estate on Fifth Avenue. A few blocks away, other familiar
494	00:31:30.490	00:31:34.740	faces are already dueling in the Disneyesque precincts of Times
495	00:31:34.750	00:31:36.780	Square. I just want you to know, I'm not running
496	00:31:36.790	00:31:42.010	for anything. Charlie Gibson and Diane Sawyer of ABC getting
497	00:31:42.020	00:31:45.680	up close and personal with their indoor audience at Good
498	00:31:45.690	00:31:50.880	Morning America's new glass-walled, street-level venue...I'm Matt Lauer along
499	00:31:50.890	00:31:53.020	with Katie Couric and we've come down to check these
500	00:31:53.030	00:31:57.060	people out. And NBC's Today Show hosts sharing face time
501	00:31:57.070	00:32:01.280	with folks gathered outside their famous sidewalk studio in Rockefeller
502	00:32:01.290	00:32:04.710	Center. It's going to be a full-fledged, three-way war. Three-way
503	00:32:04.720	00:32:06.650	wars are a lot more fun than two-way wars, I
504	00:32:06.660	00:32:11.670	think. Executive producer Steve Friedman spent 10 years at the
505	00:32:11.680	00:32:14.310	Today Show, helping raise it to the top of the
506	00:32:14.320	00:32:18.830	morning news heap, where it remains today. Now CBS News
507	00:32:18.840	00:32:23.040	is counting on him to lift its perennial also-ran morning
508	00:32:23.050	00:32:29.460	show into the thick of the competition. Katie Couric and
509	00:32:29.470	00:32:33.240	Matt Lauer, the hosts of the Today Show, responded to
510	00:32:33.250	00:32:38.770	Friedman's battle cry. It's television, I hardly would describe it
511	00:32:38.780	00:32:42.340	as war. If it's war, I'm not a soldier in
512	00:32:42.350	00:32:45.290	it. It is war, I guess in a financial sense.
513	00:32:45.300	00:32:47.570	I mean there's a lot at stake. The morning's are
514	00:32:47.580	00:32:50.120	hot. The way the marketplace is right now on morning
515	00:32:50.130	00:32:52.860	television, it's the only time in network television where the
516	00:32:52.870	00:32:58.840	total audience is growing. Morning television is the new frontier,
517	00:32:58.850	00:33:01.110	the new war, the new way networks can make their
518	00:33:01.120	00:33:06.820	move on news. Indeed they can. In the last five
519	00:33:06.830	00:33:09.900	years the number of American homes with television sets in
520	00:33:09.910	00:33:13.600	use from 7 AM to 9 AM has grown 11
521	00:33:13.610	00:33:18.630	percent. The Today Show alone has 34 percent more viewers
522	00:33:18.640	00:33:21.620	than it had five years ago. You have people who
523	00:33:21.630	00:33:23.980	get up at the same time or even earlier now
524	00:33:23.990	00:33:26.960	because they have longer commutes, there is more traffic. They
525	00:33:26.970	00:33:30.410	have less time to scrub their face and change the
526	00:33:30.420	00:33:33.780	dog dish. And they want their news, they want their
527	00:33:33.790	00:33:36.250	information before they leave the house, so when they go
528	00:33:36.260	00:33:39.100	to the office and stand around the water cooler, they're
529	00:33:39.110	00:33:44.980	informed. Author Richard Hack, a former columnist for TV Guide,
530	00:33:44.990	00:33:48.680	has written "Madness in the Morning," an account of the
531	00:33:48.690	00:33:53.430	45-year competition among the morning news broadcasts. He notes that
532	00:33:53.440	00:33:56.760	while the morning news audience is growing, the evening audience
533	00:33:56.770	00:34:02.940	is shrinking...substantially. That audience has decreased. And it has
534	00:34:02.950	00:34:06.240	decreased not only because people have these longer commutes; sometimes
535	00:34:06.250	00:34:09.000	they don't make it back home in time for the
536	00:34:09.010	00:34:12.090	evening news, but because when they do get home, they
537	00:34:12.100	00:34:14.670	have more time to look at cable, to look at
538	00:34:14.680	00:34:20.460	the Internet; to have any number of distractions that previously
539	00:34:20.470	00:34:24.830	weren't even in existence. And there is network gold to
540	00:34:24.840	00:34:28.170	be mined in the morning. The economic stakes for Good
541	00:34:28.180	00:34:30.760	Morning America and the other network news shows in the
542	00:34:30.770	00:34:35.050	morning are huge, they share a gross revenue pool of
543	00:34:35.060	00:34:38.580	about 600 million dollars worth of advertising; if one of
544	00:34:38.590	00:34:42.670	these can increase it's ratings by one point it brings
545	00:34:42.680	00:34:48.330	in an extra $70 million in revenue. Steve Friedman says
546	00:34:48.340	00:34:51.770	that CBS realizes in order to be competitive as a
547	00:34:51.780	00:34:55.500	network overall they must be a player in the morning.
548	00:34:55.510	00:34:59.500	The fact is, financially, the difference between being first and
549	00:34:59.510	00:35:02.220	third in the evening might be 15 to 18 million
550	00:35:02.230	00:35:05.860	dollars. Financially, the difference between being first and third in
551	00:35:05.870	00:35:10.490	the morning is $150 million. That's why Diane Sawyer's there.
552	00:35:10.500	00:35:13.960	That's why Bryant Gumbel came back. That's why NBC pays
553	00:35:13.970	00:35:17.330	Katie Couric 6 or 7 million dollars. That's why people
554	00:35:17.340	00:35:20.210	at CBS would invest tens of millions of dollars in
555	00:35:20.220	00:35:22.030	a street level studio, just to get us on the
556	00:35:22.040	00:35:25.630	playing field. If CBS does even modestly well in the
557	00:35:25.640	00:35:28.840	morning, it will quickly make back the tens of millions
558	00:35:28.850	00:35:33.300	it spent building this new studio and begin to amortize
559	00:35:33.310	00:35:39.750	Bryant Gumbel's five-million-dollar a year salary. Gumbel, who recently anchored
560	00:35:39.760	00:35:45.270	the failed prime time CBS newsmagazine Public Eye, concedes that
561	00:35:45.280	00:35:51.220	the stakes are high. Look, I'm aware that CBS has
562	00:35:51.230	00:35:54.260	a considerable investment in this. I'm aware that there are
563	00:35:54.270	00:35:56.800	people who are going to be anxious to, to see
564	00:35:56.810	00:36:00.570	how the Bryant Gumbel on CBS compares with the Bryant
565	00:36:00.580	00:36:05.460	Gumbel of, of NBC years. Gumbel has always been a
566	00:36:05.470	00:36:08.410	lightening rod in the morning. His fans see him as
567	00:36:08.420	00:36:12.740	a probing interviewer, his critics as arrogant. Steve Friedman is
568	00:36:12.750	00:36:16.710	familiar with both reactions. Bryant Gumbel is a different kind
569	00:36:16.720	00:36:20.190	of television performer. Most people on television, no matter who
570	00:36:20.200	00:36:22.820	they are, do say to the audience, "I want you
571	00:36:22.830	00:36:27.250	to like me." Bryant does not. Bryant says to the
572	00:36:27.260	00:36:30.390	audience, "I want you to respect me." He never asks
573	00:36:30.400	00:36:33.070	the audience to like him. He'll never have a Sally
574	00:36:33.080	00:36:41.670	Field moment. Over the last four decades, morning news has
575	00:36:41.680	00:36:47.290	changed--but not a lot. The Today Show debuted in
576	00:36:47.300	00:36:51.790	1952 with the garrulous Dave Garroway, paired at one point
577	00:36:51.800	00:36:56.210	with J. Fred Muggs, the chimp. CBS soon followed with
578	00:36:56.220	00:37:00.430	newsman Walter Cronkite, aided and abetted by a puppet Lion,
579	00:37:00.440	00:37:03.740	Charlemagne...the morning shows have always been a mix of
580	00:37:03.750	00:37:15.200	news, features and low-rent entertainment. The Today Show pioneered the
581	00:37:15.210	00:37:19.960	latest "New Big Thing"--the Streetside Studio--40 years ago.
582	00:37:19.970	00:37:23.670	All these people out here are all going to work,
583	00:37:23.680	00:37:28.570	I think. They may be late too as a matter
584	00:37:28.580	00:37:31.170	of fact, but they're on 49th Street right outside our
585	00:37:31.180	00:37:35.260	communications center here. Reinventing itself, the Today Show brought the
586	00:37:35.270	00:37:39.770	street level view back in 1994. The broadcast quickly pulled
587	00:37:39.780	00:37:45.090	into first place and has remained there for 200-plus weeks.
588	00:37:45.100	00:37:48.420	Good Morning America felt it needed a face-lift too. This
589	00:37:48.430	00:37:50.800	fall it rolled out its own state of the art
590	00:37:50.810	00:37:57.910	studio. Anchor Diane Sawyer likes the interaction with the audience.
591	00:37:57.920	00:38:02.630	It's automatic energy. It's orange juice. It's a B-12 shot,
592	00:38:02.640	00:38:05.720	to have people wandering in off the street, and they
593	00:38:05.730	00:38:08.240	look up, and there you are, and maybe Garth Brooks
594	00:38:08.250	00:38:13.330	is singing or a camel is--had too much fiber.
595	00:38:13.340	00:38:15.880	Anything can be happening in the morning when they're going
596	00:38:15.890	00:38:19.510	by. Charles Gibson says that Good Morning America has evolved
597	00:38:19.520	00:38:22.710	into something very different from what he first started doing
598	00:38:22.720	00:38:26.730	nearly 13 years ago. It is a much more spontaneous
599	00:38:26.740	00:38:31.960	broadcast. It is off script. It's basically what's going through
600	00:38:31.970	00:38:34.980	your head at the moment, and it's also pushing toward
601	00:38:34.990	00:38:37.170	a little bit more high energy, and that's the reason
602	00:38:37.180	00:38:40.990	for these changes in sets. Sawyer seems to revel in
