index	starts	ends	content
294	00:20:31.370	00:20:36.330	said, 20,000 in Bosnia, itself, another 5,000 in Croatia, and
295	00:20:36.340	00:20:40.460	7,000 in neighboring countries. The cost, Perry said, would be
296	00:20:40.470	00:20:47.900	about $2 billion. They start going in about mid-December, assuming
297	00:20:47.910	00:20:50.830	that the peace agreement is signed on the 14th of
298	00:20:50.840	00:20:53.630	December, which is the present plan. They will be going
299	00:20:53.640	00:20:59.330	in a day or so after that. General Shalikashvili can
300	00:20:59.340	00:21:02.430	describe to you in more detail the deployment plan. I
301	00:21:02.440	00:21:06.600	will simply say it will be a rapid deployment. Perry
302	00:21:06.610	00:21:09.770	insisted that all steps were being taken to minimize the
303	00:21:09.780	00:21:12.670	risk to the U.S. forces and to limit the scope
304	00:21:12.680	00:21:17.160	of their mission. We will not repeat the mistakes of
305	00:21:17.170	00:21:21.020	the UN force which is in Bosnia, which allowed itself
306	00:21:21.030	00:21:23.810	to get pushed around, which allowed itself to have its
307	00:21:23.820	00:21:30.230	freedom of movement curtailed. Our troops will be sufficient size,
308	00:21:30.240	00:21:35.570	sufficiently well armed, and sufficiently well trained and with sufficiently
309	00:21:35.580	00:21:38.510	strong rules of engagement that they will be able to
310	00:21:38.520	00:21:43.950	carry out this mission. Still, committee Republicans were skeptical. Gentlemen,
311	00:21:43.960	00:21:49.000	I have here about 140 letters that have come in
312	00:21:49.010	00:21:53.260	since the President's speech opposing the use of ground forces
313	00:21:53.270	00:21:57.960	by my constituents. I have two letters from my constituents
314	00:21:57.970	00:22:02.340	supporting it. What do I tell them when they say
315	00:22:02.350	00:22:04.750	we can't control the peace on our streets in Los
316	00:22:04.760	00:22:10.260	Angeles, New York, Chicago, across this country, with the murders
317	00:22:10.270	00:22:12.670	and killings going on, yet we can go to the
318	00:22:12.680	00:22:15.270	foreign soil and put our young men in harm's way
319	00:22:15.280	00:22:19.210	in a no-win situation? The President has said that we,
320	00:22:19.220	00:22:22.470	unfortunately, can expect casualties. From the studies you do in
321	00:22:22.480	00:22:26.070	the Pentagon on the different scenarios, could you give us
322	00:22:26.080	00:22:29.660	some idea of what kind of casualties we can expect,
323	00:22:29.670	00:22:31.870	because that's the greatest concern we have on this committee
324	00:22:31.880	00:22:35.380	and in the Congress. There are no models for casualty
325	00:22:35.390	00:22:38.050	in this kind of an operation. And anybody that represents
326	00:22:38.060	00:22:41.520	to you that the casualties will be such and such
327	00:22:41.530	00:22:47.230	is misrepresenting, I think, is extending his information farther than
328	00:22:47.240	00:22:49.750	the data will support. I want to ask you very
329	00:22:49.760	00:22:53.650	seriously, Mr. Secretary, because many of us were around at
330	00:22:53.660	00:22:57.600	the time of Vietnam, do you really, really, really, deep
331	00:22:57.610	00:23:00.610	down in your heart, feel this is doable? I don't
332	00:23:00.620	00:23:03.870	want to go through the McNamara experience again, where a
333	00:23:03.880	00:23:06.830	Secretary of Defense comes and says, I knew at the
334	00:23:06.840	00:23:10.830	very beginning it wasn't doable. It's an easy answer, because
335	00:23:10.840	00:23:13.080	it's the same as my official position. Yes, I believe
336	00:23:13.090	00:23:16.280	it's doable. If I did not believe it were doable,
337	00:23:16.290	00:23:18.230	I would not be representing that to you. I would
338	00:23:18.240	00:23:20.370	leave my job before I would come over and tell
339	00:23:20.380	00:23:23.200	the Congress something I didn't believe on an issue this
340	00:23:23.210	00:23:27.400	important. This afternoon, the three Clinton officials went before the
341	00:23:27.410	00:23:31.820	House National Security Committee, the committee with direct oversight over
342	00:23:31.830	00:23:35.670	the military. If the going got tough, committee Republicans wanted
343	00:23:35.680	00:23:39.470	to know, would the President maintain his resolve? And I
344	00:23:39.480	00:23:43.880	haven't seen in this administration the political backbone, if you
345	00:23:43.890	00:23:47.570	will, the moral authority, if you really believe that this
346	00:23:47.580	00:23:52.410	is a mission that has to be accomplished to stand
347	00:23:52.420	00:23:59.270	and continue to, to maintain a force in the face
348	00:23:59.280	00:24:03.370	of overwhelming negative public opinion. One thing I would say
349	00:24:03.380	00:24:05.890	is that this has to be a demonstration that the
350	00:24:05.900	00:24:10.060	President is not unduly motivated by polls, because, if he
351	00:24:10.070	00:24:16.100	were, he would not be recommending the deployment of American
352	00:24:16.110	00:24:20.760	forces. By, by all accounts, this action is, is not
353	00:24:20.770	00:24:24.380	popular, and yet, he's doing it because he believes it's
354	00:24:24.390	00:24:27.900	right. The administration's trio will be back on the Hill
355	00:24:27.910	00:24:32.260	tomorrow before the Senate Foreign Relations Committee. Still to come
356	00:24:32.270	00:24:35.330	on the NewsHour tonight: Why is the United States the
357	00:24:35.340	00:24:51.120	peacemaker, a breast cancer development, and Gergen talks to Gates.
358	00:24:51.130	00:24:54.280	Now to a central point underlying the U.S. mission to
359	00:24:54.290	00:24:57.030	Bosnia; that there can be no peace agreements like the
360	00:24:57.040	00:25:00.190	one in Bosnia and no peace on the ground without
361	00:25:00.200	00:25:03.630	the direct involvement of the United States of America. We
362	00:25:03.640	00:25:07.120	explore that premise with three men who have written extensively
363	00:25:07.130	00:25:10.310	about the modern, as well as the ancient world: Ronald
364	00:25:10.320	00:25:13.330	Steel, a professor of international relations at the University of
365	00:25:13.340	00:25:17.850	Southern California, author of the Temptations of a Superpower; Donald
366	00:25:17.860	00:25:21.310	Kagan, professor of history at Yale University whose latest book
367	00:25:21.320	00:25:24.710	is on the origins of war; and John Lukacs, author
368	00:25:24.720	00:25:27.970	of many histories of modern Europe, a professor at Chestnut
369	00:25:27.980	00:25:33.050	Hill College in Philadelphia. Ronald Steel, how important a development
370	00:25:33.060	00:25:35.900	is this that only the United States can make and
371	00:25:35.910	00:25:40.560	keep peace in Bosnia? I think it's probably more accurate
372	00:25:40.570	00:25:43.530	to say that only the United States will intervene to
373	00:25:43.540	00:25:45.520	keep peace in Bosnia. If it's just a question of
374	00:25:45.530	00:25:48.740	20,000 men, clearly the Europeans have the capacity to do
375	00:25:48.750	00:25:51.460	that. But they don't have the will to do that.
376	00:25:51.470	00:25:54.840	And I think this is the crucial element that's missing.
377	00:25:54.850	00:25:58.560	They've tried to keep out of direct involvement in civil
378	00:25:58.570	00:26:01.680	war. They've wanted to help the refugees, help civilians, but
379	00:26:01.690	00:26:07.190	to stand aside while the combatants were fighting. They--they
380	00:26:07.200	00:26:08.930	were able to achieve this for a time, but the
381	00:26:08.940	00:26:10.770	war has continued. There's been a lot of pressure in
382	00:26:10.780	00:26:13.520	this country to do something about it to end it,
383	00:26:13.530	00:26:16.060	and now the, I think, the pressure for the United
384	00:26:16.070	00:26:19.640	States to intervene has been building for some time, and
385	00:26:19.650	00:26:24.670	the leadership, if you will, of the United States was,
386	00:26:24.680	00:26:27.380	I think, the crucial factor. The Europeans didn't want to
387	00:26:27.390	00:26:29.320	get locked out of this. They didn't want this to
388	00:26:29.330	00:26:32.170	be an American operation. The Americans did not want--the
389	00:26:32.180	00:26:33.780	American government did not want this to be simply a
390	00:26:33.790	00:26:37.270	European operation. So I see there's--there's two elements there,
391	00:26:37.280	00:26:39.700	I think. There's one that the United States wanted to
392	00:26:39.710	00:26:41.980	end this war, the government wanted to end this war.
393	00:26:41.990	00:26:46.160	I think for humanitarian reasons it's also voiced a security
394	00:26:46.170	00:26:48.340	argument, which I don't think is very compelling. I think
395	00:26:48.350	00:26:51.370	that's very confusing. I think it's muddying the waters here.
396	00:26:51.380	00:26:54.080	It's essentially a humanitarian argument there. And the second one
397	00:26:54.090	00:26:56.300	is that the United States wants to continue to play
398	00:26:56.310	00:27:02.840	a major role in NATO, and the--to make clear
399	00:27:02.850	00:27:04.920	to the Europeans that the United States is going to
400	00:27:04.930	00:27:09.460	remain a European power. Prof. Lukacs, how do you see
401	00:27:09.470	00:27:12.490	this? The question--the word "historic" is one that's thrown
402	00:27:12.500	00:27:15.090	around a lot. Is this a turning point of some
403	00:27:15.100	00:27:18.020	kind that the United States is now in this role
404	00:27:18.030	00:27:21.250	of the maker and the keeper of the peace? It’s
405	00:27:21.260	00:27:25.400	a small turning point. I thought for a long time
406	00:27:25.410	00:27:28.770	that it was a mistake for the United States to
407	00:27:28.780	00:27:32.890	get involved as much in what was the former Yugoslavia,
408	00:27:32.900	00:27:35.770	that the Europeans should have done it. But the Europeans
409	00:27:35.780	00:27:41.510	didn't do that. And now that this agreement or armistice
410	00:27:41.520	00:27:47.950	is cobbled together in Dayton, it's sort of extraordinary and
411	00:27:47.960	00:27:52.920	because of this, I think that given this armistice agreement,
412	00:27:52.930	00:27:56.140	the United States must sustain it. If the United States
413	00:27:56.150	00:28:00.200	now refuses to go along and implement it, it will
414	00:28:00.210	00:28:06.770	be a tremendous loss for American prestige with rather incalculable
415	00:28:06.780	00:28:11.100	consequences. In this respect, I'm very impressed--what I saw
416	00:28:11.110	00:28:14.660	Senator McCain say. I mean, he was very statesmanlike about
417	00:28:14.670	00:28:19.630	this. On the other hand, what is slightly historic about
418	00:28:19.640	00:28:23.400	this, that by and large, the prestige of this country
419	00:28:23.410	00:28:26.790	has been declining for the past few years. The very
420	00:28:26.800	00:28:30.860	fact that the United States now filled a vacuum means,
421	00:28:30.870	00:28:34.080	I hope, more than a temporary rise of the prestige
422	00:28:34.090	00:28:37.750	of this country. Professor Kagan, how do you read this,
423	00:28:37.760	00:28:40.200	this development? Well, I think one thing we need to
424	00:28:40.210	00:28:43.200	understand is what the real character of NATO is and
425	00:28:43.210	00:28:47.110	has been from the beginning. It's--I would describe it
426	00:28:47.120	00:28:49.530	in the way that we ancient historians use to describe
427	00:28:49.540	00:28:53.940	some ancient alliances. An alliance with a hegemon, that is
428	00:28:53.950	00:28:57.590	to say even though everybody is a voluntary member of
429	00:28:57.600	00:29:01.220	this organization, even though there are no formal distinctions among
430	00:29:01.230	00:29:03.830	them, from the first, it was understood that the
431	00:29:03.840	00:29:08.930	United States was the leader of this organization. So the
432	00:29:08.940	00:29:12.510	allies have always looked to the United States for leadership.
433	00:29:12.520	00:29:16.410	There's just no tradition, no history of the rest of
434	00:29:16.420	00:29:20.110	NATO acting independently. I think we have to accept the
435	00:29:20.120	00:29:22.990	fact that that's the kind of alliance that it is.
436	00:29:23.000	00:29:26.390	We shouldn't be surprised that Europeans were unwilling to act
437	00:29:26.400	00:29:30.480	independently but looked to us for leadership. And we need
438	00:29:30.490	00:29:33.640	to fill our part there, not merely because of the
439	00:29:33.650	00:29:37.000	humanitarian issues, which are of course very important, but it's
440	00:29:37.010	00:29:40.530	deeply in our interest to see that NATO continues to
441	00:29:40.540	00:29:44.700	function as a force for preserving peace. But beyond NATO,
442	00:29:44.710	00:29:50.490	Professor Kagan, before NATO--I mean, before Bosnia came Haiti,
443	00:29:50.500	00:29:53.540	came Somalia. All of those were also driven by the
444	00:29:53.550	00:29:58.310	United States. Is this the new world, wherever it is?
445	00:29:58.320	00:30:01.320	Well, I think the great question of where it's necessary
446	00:30:01.330	00:30:03.930	to intervene is always a difficult one, and will never
447	00:30:03.940	00:30:07.130	be able to be determined in advance. That's what we
448	00:30:07.140	00:30:10.610	need statesmen for, to make good judgments about particularities. But
449	00:30:10.620	00:30:13.950	on the larger question, my own opinion is that the
450	00:30:13.960	00:30:16.980	world was presented at the time of the collapse of
451	00:30:16.990	00:30:19.360	the Soviet Union, the end of the Cold War, with
452	00:30:19.370	00:30:22.990	a very rare opportunity for establishing a system that would
453	00:30:23.000	00:30:26.600	preserve peace over a period of time. We find that
454	00:30:26.610	00:30:30.980	there's only one great military superpower in the world, and
455	00:30:30.990	00:30:33.900	it turns out that that power is widely and rightly
456	00:30:33.910	00:30:37.580	understood not to have aggressive designs and not to be
457	00:30:37.590	00:30:41.190	interested in changing things in its own favor but really
458	00:30:41.200	00:30:45.000	having an interest in preserving the situation that exists. In
459	00:30:45.010	00:30:48.140	those circumstances, if that nation is willing to accept its
460	00:30:48.150	00:30:52.300	responsibilities, it can and, along with the people who feel
461	00:30:52.310	00:30:56.180	the same way, of which fortunately there are many, that
462	00:30:56.190	00:31:00.610	violence as a solution of international problems is not legitimate.
463	00:31:00.620	00:31:04.250	And I think Bosnia is about in a deeper way
464	00:31:04.260	00:31:07.450	precisely that point. Do you agree? No, I don't. I
465	00:31:07.460	00:31:11.300	think that first of all NATO is a historic fact,
466	00:31:11.310	00:31:14.350	it's an alliance that was designed to protect Europe from
467	00:31:14.360	00:31:19.390	Russian power during the Cold War. It was an alliance that
468	00:31:19.400	00:31:22.270	is today without an enemy, and what we're living in,
469	00:31:22.280	00:31:24.610	I think, is the kind of after-shadow of NATO, if
470	00:31:24.620	00:31:29.000	you will. We're living with the heritage of European pacivity
471	00:31:29.010	00:31:32.280	and dependency upon the United States, the fact that the
472	00:31:32.290	00:31:35.630	Europeans have not constituted themselves as an independent power in
473	00:31:35.640	00:31:38.790	any way and, therefore, are unable to take a lead
474	00:31:38.800	00:31:40.790	in an issue like this; however, I don't--I think
475	00:31:40.800	00:31:45.650	it's critical for us not to lose the distinction between
476	00:31:45.660	00:31:49.410	tranquility and security. The President has talked about our security
477	00:31:49.420	00:31:51.780	is deeply involved in Europe. Of course, it's involved in
478	00:31:51.790	00:31:56.600	Europe. It's historically been involved in not allowing Europe to
479	00:31:56.610	00:32:00.090	be dominated by a single power which will then be
480	00:32:00.100	00:32:01.990	able to do us great harm. That was why we
481	00:32:02.000	00:32:03.300	were in World War I. That was why we were
482	00:32:03.310	00:32:08.750	in World War II. But it's not about ensuring domestic
483	00:32:08.760	00:32:12.380	tranquility within every European border. This is--So what is
484	00:32:12.390	00:32:14.680	it about this? About NATO, what is NATO? No, no,
485	00:32:14.690	00:32:17.790	no. What is the--what does Bosnia say that the
486	00:32:17.800	00:32:21.000	United States is about? Forget the NATO part, just the
487	00:32:21.010	00:32:23.600	United States. What is it about now? I think the
488	00:32:23.610	00:32:26.860	United States has inherited a role as a leader of
489	00:32:26.870	00:32:32.300	a great alliance and it has become the only powerful
490	00:32:32.310	00:32:35.360	really super powerful country of the world, therefore, there are
491	00:32:35.370	00:32:39.130	tremendous demands made upon the United States by the participants
492	00:32:39.140	00:32:41.690	in this war to do something, by the Europeans to
493	00:32:41.700	00:32:44.460	do something. There's an expectancy to do something. There's also
494	00:32:44.470	00:32:48.250	this feeling among Americans that if we have the power
495	00:32:48.260	00:32:50.480	to do something, we should do something. What we're not
496	00:32:50.490	00:32:53.790	doing in this country is having any kind of debate
497	00:32:53.800	00:32:56.900	about what we ought to be doing, the distinction between
498	00:32:56.910	00:32:59.100	what we can do and what we should do. And
499	00:32:59.110	00:33:02.000	that's why I think that this is a historic moment.
500	00:33:02.010	00:33:04.330	I think that this is the first time that we've
501	00:33:04.340	00:33:06.940	engaged in what is quite likely to be a military
502	00:33:06.950	00:33:11.780	action which is quite divorced from military security. From our
503	00:33:11.790	00:33:14.160	own security? From our own security. Previously we said even
504	00:33:14.170	00:33:18.360	in places like Vietnam, Korea, that these were important for
505	00:33:18.370	00:33:22.050	global balance, Communists would benefit from it if we didn't
506	00:33:22.060	00:33:24.990	help these countries, and that, therefore, our own security was
507	00:33:25.000	00:33:26.850	directly involved because we are in this competition with the
508	00:33:26.860	00:33:31.910	Russians anymore or anybody else anymore. What is the meaning
509	00:33:31.920	00:33:35.980	of alliances? Why should the United States become, in effect,
510	00:33:35.990	00:33:38.340	the global peacekeeper? Now that is the role we can
511	00:33:38.350	00:33:40.550	play, but I think it's one we ought to debate.
512	00:33:40.560	00:33:44.150	Yeah. And that debate--has that debate begun, Professor Lukacs?
513	00:33:44.160	00:33:46.010	Is that what this is really going to lead to?
514	00:33:46.020	00:33:47.430	I mean, is that where we're in the middle of,
515	00:33:47.440	00:33:51.180	actually right now? I don't think so. I think that
516	00:33:51.190	00:33:54.500	the present debate within the country is a very short
517	00:33:54.510	00:33:58.140	range one. I think in the short run this is,
518	00:33:58.150	00:34:01.740	if I may say so, an interesting experiment. It sort
519	00:34:01.750	00:34:04.060	of reverses what's been going on in the past few
520	00:34:04.070	00:34:08.930	years. I hope it works. But allow me to attempt
521	00:34:08.940	00:34:12.270	a--Excuse me, if I can make sure I understand
522	00:34:12.280	00:34:15.820	what you mean, you hope the Bosnia experiment works, is
523	00:34:15.830	00:34:17.870	that what you mean? Yes. If it doesn't work, then
524	00:34:17.880	00:34:20.560	what happens to the long-- the long range is over?
525	00:34:20.570	00:34:23.160	Well, that I don't know, because I'm a historian, not
526	00:34:23.170	00:34:26.620	a prophet. Okay. But--Sorry about that. But I want
527	00:34:26.630	00:34:29.560	to say something to attempt at the risk of being
528	00:34:29.570	00:34:34.310	presumptuous of the longer view, this goes against what is
529	00:34:34.320	00:34:37.570	the long range development. The long range development that these
530	00:34:37.580	00:34:43.140	three big institutions--NATO, the United Nations, and the European
531	00:34:43.150	00:34:47.200	Community--are now 50 years old. They were the result
532	00:34:47.210	00:34:50.590	of the world situation after the Second World War. They
533	00:34:50.600	00:34:54.960	fulfilled a purpose, but they are all to some extent
534	00:34:54.970	00:34:59.480	antiquated, as you know, even NATO, NATO is the North
535	00:34:59.490	00:35:04.410	Atlantic Treaty Organization. What does the North Atlantic have to
536	00:35:04.420	00:35:07.110	do with Bosnia? I mean, of course, this goes back
537	00:35:07.120	00:35:11.440	to 1951, when Mr. Atchison included Greece and Turkey into
538	00:35:11.450	00:35:15.870	NATO, which I think was probably a geographical misnomer. The
539	00:35:15.880	00:35:20.390	United Nations is certainly not united. It's certainly not an
540	00:35:20.400	00:35:26.370	assembly of nations but simply a compendium of governments. The
541	00:35:26.380	00:35:32.030	European Community is not a community. It's an economic organization
542	00:35:32.040	00:35:36.930	with a very, very vague and unknown political future. We
543	00:35:36.940	00:35:40.380	have to think about that. You see, the United States
544	00:35:40.390	00:35:43.850	in a way is now, is an exception, the Bosnian
545	00:35:43.860	00:35:48.000	thing, withdrawing from Europe. We have fewer European bases; we
546	00:35:48.010	00:35:50.380	have fewer troops in Europe than we had five or
547	00:35:50.390	00:35:54.650	ten years ago. The entire movement of the United States,
548	00:35:54.660	00:35:59.360	the composition of the American population is moving westward, away
549	00:35:59.370	00:36:03.070	from Europe. It is a new age that's beginning. That
550	00:36:03.080	00:36:07.380	is the long range development. To some extent, this short
551	00:36:07.390	00:36:11.270	range development of Bosnia goes in the opposite direction. I
552	00:36:11.280	00:36:14.550	welcome it. I hope it works. What's going to happen
553	00:36:14.560	00:36:17.710	in the long run I do not know. Professor Kagan,
554	00:36:17.720	00:36:20.790	what do you see in terms of the United States
555	00:36:20.800	00:36:24.800	long range as a result of what this Bosnia--call
556	00:36:24.810	00:36:28.260	it an experiment--call it whatever you would like? Well,
557	00:36:28.270	00:36:31.120	it depends how it plays out. I see the--It
558	00:36:31.130	00:36:35.210	has to be successful or it will mean--The results
559	00:36:35.220	00:36:37.320	will be very bad news in a long range way,
560	00:36:37.330	00:36:39.280	if it's not successful. I think we have to make
561	00:36:39.290	00:36:43.700	up our minds that this is going to be successful.
562	00:36:43.710	00:36:46.300	The definition of success is going to be argued about,
563	00:36:46.310	00:36:49.480	of course. In my eyes, the critical element is that
564	00:36:49.490	00:36:52.920	we have to show that we are committed not to
565	00:36:52.930	00:36:56.630	allow war to be the way to settle these questions
566	00:36:56.640	00:36:59.850	and that we are prepared to use force to avoid
567	00:36:59.860	00:37:02.640	that in the--in the extreme situation, if we have
568	00:37:02.650	00:37:06.980	to. But I think Mr. Lukacs's observations are interesting and
569	00:37:06.990	00:37:10.110	valuable, and I would just make some distinctions about these
570	00:37:10.120	00:37:14.400	different organizations. The one that seems to me to have
571	00:37:14.410	00:37:18.820	hope and usefulness for the future if it is used
572	00:37:18.830	00:37:24.460	in that way, is NATO. It's perfectly correct and fine
573	00:37:24.470	00:37:26.560	to point out what its origins were and what its
574	00:37:26.570	00:37:31.200	technical orientation is and so on, but it needn't be
575	00:37:31.210	00:37:32.880	only what it was in the past. Of course, it
576	00:37:32.890	00:37:35.460	can't be, since it was chiefly aimed at the Soviet
577	00:37:35.470	00:37:39.200	Union, which doesn't exist. But it's clear that the participants
578	00:37:39.210	00:37:42.590	in NATO are reluctant to just let it fade away.
579	00:37:42.600	00:37:45.490	And they're right to be reluctant. What it presents is
580	00:37:45.500	00:37:49.200	a tool, if properly used, that could be a new
581	00:37:49.210	00:37:52.150	element in international relations, something we haven't seen in the
582	00:37:52.160	00:37:55.480	past that could be used to the general good, and
583	00:37:55.490	00:37:58.310	I think we need to try to make it that.
584	00:37:58.320	00:38:01.890	But, Ronald Steel, whether it's NATO, whether it's UN, any
585	00:38:01.900	00:38:04.970	of these organizations, are they all dependent on the will
586	00:38:04.980	00:38:08.180	of the United States for them to actually perform these
587	00:38:08.190	00:38:10.600	missions? Well, I think NATO and the way that it's
588	00:38:10.610	00:38:13.650	been constructed, it's clearly an alliance that all during the
589	00:38:13.660	00:38:16.070	Cold War has been dominated by the United States. We
590	00:38:16.080	00:38:18.820	were the leader of it, of course, and, therefore, if
591	00:38:18.830	00:38:21.960	NATO is to continue in anything like it's old form,
592	00:38:21.970	00:38:24.880	if the Europeans are continuing to remain rather passive and
593	00:38:24.890	00:38:28.600	concern themselves mostly with enrichment and the United States continues
594	00:38:28.610	00:38:31.340	to want to play this role of global leader, then
595	00:38:31.350	00:38:34.520	I suppose NATO is useful. Certainly one of the, I
