index	starts	ends	content
1	00:01:53.210	00:01:55.870	Good evening. I'm Roger Mudd in New York. And I'm
2	00:01:55.880	00:01:59.380	Margaret Warner in Washington. After the News Summary, we update
3	00:01:59.390	00:02:03.130	the political turmoil in Moscow, preview President Clinton's health care
4	00:02:03.140	00:02:07.190	speech, look at one city's remedy, and have a Charlayne
5	00:02:07.200	00:02:49.050	Hunter-Gault conversation with journalist Michael O'Neill. At least 40 people
6	00:02:49.060	00:02:51.960	were killed this morning when an Amtrak passenger train, the
7	00:02:51.970	00:02:55.610	Sunset Limited, derailed on a bridge at Saraland, Alabama, just
8	00:02:55.620	00:02:58.750	north of Mobile. All three engines and four of the
9	00:02:58.760	00:03:01.670	eight cars left the rail just after 3 AM local
10	00:03:01.680	00:03:05.220	time. Two of the passenger cars plunged into the bayou,
11	00:03:05.230	00:03:08.730	and one of them was totally submerged. Rescue efforts were
12	00:03:08.740	00:03:13.380	hampered by darkness, fall, murky water, and some said alligators.
13	00:03:13.390	00:03:16.210	Officials said the Sunset Limited traveling from Los Angeles to
14	00:03:16.220	00:03:20.970	Miami carried 189 passengers and 17 crew members. Coast Guard
15	00:03:20.980	00:03:25.150	officials say 13 people are still unaccounted for. In Washington
16	00:03:25.160	00:03:29.060	this afternoon, an Amtrak spokesman held a news conference. There
17	00:03:29.070	00:03:33.330	really couldn't have been a worse combination of events. We
18	00:03:33.340	00:03:39.070	have a derailment, an emersion in water, fire. This is,
19	00:03:39.080	00:03:45.620	without doubt, the worst tragedy to -- that Amtrak has suffered
20	00:03:45.630	00:03:52.910	in its 23-year history. It is conceivable that today's catastrophic
21	00:03:52.920	00:04:01.160	accident could equal or eclipse the entire fatality rate for our
22	00:04:01.170	00:04:05.040	entire 23-year history. The cause of the accident is not
23	00:04:05.050	00:04:08.290	known. A freight train, reportedly, had earlier crossed the bridge
24	00:04:08.300	00:04:12.720	without incident. Officials from CSX Transportation, which owns the track,
25	00:04:12.730	00:04:17.170	and the National Transportation Safety Board will investigate. Margaret. Boris
26	00:04:17.180	00:04:19.720	Yeltsin appeared to have a clear edge today in his
27	00:04:19.730	00:04:23.890	struggle with hardline opponents. The streets of Moscow remained calm
28	00:04:23.900	00:04:27.540	as Yeltsin ventured out to greet supporters. He vowed not
29	00:04:27.550	00:04:31.230	to use force to overcome his opposition. Yeltsin dissolved the
30	00:04:31.240	00:04:35.280	conservative Russian parliament yesterday and ordered new parliamentary elections in
31	00:04:35.290	00:04:39.460	December. The parliament responded by swearing in a rival acting
32	00:04:39.470	00:04:43.720	president, Alexander Rutskoi, who addressed his supporters at the parliament
33	00:04:43.730	00:04:48.380	building today. Western leaders, meanwhile, rallied around Yeltsin, saying he
34	00:04:48.390	00:04:51.660	had no alternative but to break the deadlock between himself
35	00:04:51.670	00:04:56.990	and the Communist era parliament. President Clinton expressed his support
36	00:04:57.000	00:05:00.010	for Yeltsin again today. Mr. Clinton also said he was
37	00:05:00.020	00:05:05.030	hopeful the situation would remain calm. A second passenger jet
38	00:05:05.040	00:05:08.320	was shot down in the former Soviet republic of Georgia.
39	00:05:08.330	00:05:11.380	Up to 100 people were reportedly aboard the plane, which
40	00:05:11.390	00:05:14.440	was hit after landing at Sukhumi, the capital of a
41	00:05:14.450	00:05:18.030	breakaway region in Georgia. It was not clear how many
42	00:05:18.040	00:05:21.790	may have survived the attack. Twenty-eight people were killed yesterday
43	00:05:21.800	00:05:24.480	when another passenger jet was shot down into the Black
44	00:05:24.490	00:05:28.560	Sea near the same city. Georgian officials blamed both attacks
45	00:05:28.570	00:05:33.090	on rebels fighting for independence for their breakaway region. President
46	00:05:33.100	00:05:37.480	Clinton delivers his long-awaited, long-delayed healthcare reform speech tonight before
47	00:05:37.490	00:05:40.260	a joint session of the Congress. He and Vice President
48	00:05:40.270	00:05:43.320	Gore and Mrs. Clinton briefed congressional leaders from both parties
49	00:05:43.330	00:05:46.410	at the White House this morning. Reporters asked the President
50	00:05:46.420	00:05:49.020	why he thought his plan would succeed where past attempts
51	00:05:49.030	00:05:54.370	had failed. There is almost unanimous consensus that the cost
52	00:05:54.380	00:05:57.180	of continuing on the present course is greater than the
53	00:05:57.190	00:06:01.530	cost of change. With healthcare costs rising at more than
54	00:06:01.540	00:06:04.220	twice the rate of inflation and rising much faster than
55	00:06:04.230	00:06:08.950	that for small businesses, with many people--more people losing
56	00:06:08.960	00:06:11.560	their coverage every month so that we're paying more for
57	00:06:11.570	00:06:15.400	less healthcare, with the range of choices available to Americans
58	00:06:15.410	00:06:19.420	dropping dramatically and the administrative costs of the system escalating
59	00:06:19.430	00:06:23.580	at a breathtaking rate, that the cost of going on
60	00:06:23.590	00:06:25.760	is greater than the cost of change. I don't think
61	00:06:25.770	00:06:29.850	that there's ever been that much consensus before. Republican leaders
62	00:06:29.860	00:06:33.800	have pledged their cooperation, but after today's meeting, GOP Senators
63	00:06:33.810	00:06:38.130	and representatives spoke in differing tones about bipartisanship. I have
64	00:06:38.140	00:06:41.310	indicated to the President and Mrs. Clinton a number of
65	00:06:41.320	00:06:43.640	times we're going into this on our side, at least
66	00:06:43.650	00:06:45.510	as many people as I can convince, in a very
67	00:06:45.520	00:06:48.860	positive way. My view is that this is a good
68	00:06:48.870	00:06:51.610	beginning. It's going to be a long path before we
69	00:06:51.620	00:06:55.320	have final passage, and I really believe that in the
70	00:06:55.330	00:06:59.070	past in most healthcare areas we could have bipartisanship. The
71	00:06:59.080	00:07:02.700	President said in his inaugural address that the best way
72	00:07:02.710	00:07:05.860	to fix what's wrong with America is to use what's
73	00:07:05.870	00:07:09.690	right with America. He's applied just the opposite of that
74	00:07:09.700	00:07:16.260	principle in his response to healthcare. Any American citizen thinks
75	00:07:16.270	00:07:18.510	that they will be made better off in their healthcare
76	00:07:18.520	00:07:23.440	security by a government-mismanaged program of this magnitude I think
77	00:07:23.450	00:07:26.490	is going to be badly misguided. Again, I could not
78	00:07:26.500	00:07:29.860	be more disappointed. The President speaks to the Congress at
79	00:07:29.870	00:07:32.770	9 PM Eastern Time, and we'll have more on healthcare
80	00:07:32.780	00:07:35.850	later in the program. Also today, Mr. Clinton said the
81	00:07:35.860	00:07:38.520	federal government would pay for 90 percent of the cost
82	00:07:38.530	00:07:41.920	of the summer's Midwest floods, instead of the usual 75
83	00:07:41.930	00:07:47.290	percent. Flood damage in the nine states totaled $7.6 billion.
84	00:07:47.300	00:07:49.290	In a written statement, the President said the floods had
85	00:07:49.300	00:07:53.610	shown that natural disasters can affect the entire nation's economy.
86	00:07:53.620	00:07:57.590	Gen. John Shalikashvili, President Clinton's nominee to the Chairman of
87	00:07:57.600	00:08:00.820	the Joint Chiefs of Staff, told the Senate Armed Services
88	00:08:00.830	00:08:03.710	Committee today that he didn't learn of his father's World
89	00:08:03.720	00:08:08.250	War II Nazi affiliation until last month. After Mr. Clinton
90	00:08:08.260	00:08:10.920	named him to the post, reports surfaced that his father
91	00:08:10.930	00:08:15.170	had served in Nazi Germany's Vofen SS. It is most
92	00:08:15.180	00:08:20.170	troublesome to me that according to his own writings apparently
93	00:08:20.180	00:08:23.330	in the last months of the war, my father was
94	00:08:23.340	00:08:27.470	associated with some Georgian unit that was under the control
95	00:08:27.480	00:08:32.380	of the Vofen SS. I am deeply saddened that my
96	00:08:32.390	00:08:37.470	father had this tragic association. To me--and I believe
97	00:08:37.480	00:08:40.890	to all those who knew him--that is so absolutely
98	00:08:40.900	00:08:45.720	out of character. To me, he was a kind and
99	00:08:45.730	00:08:50.010	gentle man, and I loved him very much. He was
100	00:08:50.020	00:08:54.430	a man who perhaps loved his native Georgia too much,
101	00:08:54.440	00:08:57.000	certainly a man caught up in the awful tragedy of
102	00:08:57.010	00:09:01.730	World War II. Senators said the general's family wouldn't derail
103	00:09:01.740	00:09:07.000	his nomination. Meanwhile, Actress Jane Alexander began her confirmation hearings
104	00:09:07.010	00:09:09.440	today to be chairwoman of the National Endowment for the
105	00:09:09.450	00:09:13.680	Arts. Alexander told the committee she would follow the statutory
106	00:09:13.690	00:09:16.660	guidelines to ensure that grants are given to the highest
107	00:09:16.670	00:09:20.200	degree of artistic merit and excellence, but she said she
108	00:09:20.210	00:09:22.790	could not promise that the NEA would be free from
109	00:09:22.800	00:09:27.480	controversy. Jon Demjanjuk, the man cleared by Israel of being
110	00:09:27.490	00:09:30.910	Nazi Death Camp Guard "Ivan the Terrible," returned to Ohio
111	00:09:30.920	00:09:34.810	today and went into seclusion. The 73-year-old former auto worker
112	00:09:34.820	00:09:37.220	stopped in New York early this morning, where he was transferred
113	00:09:37.230	00:09:40.190	from an Israeli airliner to a plane chartered by his
114	00:09:40.200	00:09:43.800	family. Demjanjuk spent more than seven years in an Israeli
115	00:09:43.810	00:09:46.790	jail. The country's Supreme Court threw out his conviction in
116	00:09:46.800	00:09:49.440	July and then rejected requests for a new trial this
117	00:09:49.450	00:09:52.660	week. U.S. Attorney General Janet Reno has said she will
118	00:09:52.670	00:09:56.990	move to deport him. The shuttle Discovery landed safely today
119	00:09:57.000	00:10:00.650	in the pre-dawn darkness at Florida's Kennedy Space Center. It
120	00:10:00.660	00:10:04.350	was the first ever nighttime landing at a space facility.
121	00:10:04.360	00:10:08.350	NASA officials said the 10-day mission was nearly flawless. The
122	00:10:08.360	00:10:11.800	five astronauts tested tools and techniques that a second crew
123	00:10:11.810	00:10:14.560	will use to try to fix the Hubble Space Telescope
124	00:10:14.570	00:10:18.770	in December. That ends our News Summary. Ahead on the
125	00:10:18.780	00:10:23.750	NewsHour, the standoff in Moscow, the Clinton healthcare speech, one
126	00:10:23.760	00:10:37.070	city's healthcare solution, and a Charlayne Hunter-Gault conversation. We go
127	00:10:37.080	00:10:39.710	first tonight to an update on the political crisis and
128	00:10:39.720	00:10:43.160	standoff in Russia. Russia now has two men claiming to
129	00:10:43.170	00:10:46.360	be president, and depending on which president you ask, has
130	00:10:46.370	00:10:49.690	either one parliament or no parliament at all. But Boris
131	00:10:49.700	00:10:52.140	Yeltsin seems to have held onto some key levers of
132	00:10:52.150	00:10:56.170	support. Our update comes from Correspondent Ian Williams of Independent
133	00:10:56.180	00:11:01.560	Television News. They surrounded the White House today, hardline demonstrators
134	00:11:01.570	00:11:06.100	behind their hastily erected barricades voicing their anger at President
135	00:11:06.110	00:11:10.160	Yeltsin and their support for the deputies inside. But this
136	00:11:10.170	00:11:13.250	was not the mass expression of popular outrage the Russian
137	00:11:13.260	00:11:16.240	parliament had called for. No more than a few hundred
138	00:11:16.250	00:11:20.340	turned up, greeting with cheers parliament's new threats against Yeltsin
139	00:11:20.350	00:11:25.550	and his government. The police kept their distance, the building
140	00:11:25.560	00:11:28.450	guarded by a group of men in plain clothes. They
141	00:11:28.460	00:11:32.950	were uneasy and suspicious, frog marching a Russian cameraman away
142	00:11:32.960	00:11:37.380	after he appeared not to cooperate with them. Inside, more
143	00:11:37.390	00:11:42.360	of these irregular guards, Kalashnikov rifles slung over their shoulders,
144	00:11:42.370	00:11:45.870	clearly not convinced by Yeltsin's assurance today that he will
145	00:11:45.880	00:11:50.900	not use force to solve the crisis. Three floors above,
146	00:11:50.910	00:11:54.350	the two men seeking to rest power away from Yeltsin.
147	00:11:54.360	00:11:58.840	Parliamentary Speaker Ruslan Khasbulatov and the man appointed by parliament
148	00:11:58.850	00:12:04.160	as acting president, Alexander Rutskoi. We asked Mr. Khasbulatov what
149	00:12:04.170	00:12:12.300	he thought of the president's latest actions. The president, you
150	00:12:12.310	00:12:15.510	mean Rutskoi, well, I'm sure this president will do everything
151	00:12:15.520	00:12:21.680	in his power to normalize the situation. And how confident
152	00:12:21.690	00:12:26.540	was he that his president would win the power struggle?
153	00:12:26.550	00:12:29.570	The Russian people are already supporting us. This disgrace can't
154	00:12:29.580	00:12:31.960	possibly go on for a long time. There has to
155	00:12:31.970	00:12:34.420	be an end to it one way or another. And
156	00:12:34.430	00:12:38.540	Afghan war veteran, Mr. Rutskoi, likened the struggle for power
157	00:12:38.550	00:12:45.480	not to a battle but to a chess match. I'm
158	00:12:45.490	00:12:49.650	a pragmatic person. I'm always calculating. And if were to
159	00:12:49.660	00:12:51.860	call this a chess match and look two or three
160	00:12:51.870	00:12:54.910	steps ahead, we'd see that Yeltsin is in danger of
161	00:12:54.920	00:13:00.940	a checkmate, one or two moves and checkmate. One move
162	00:13:00.950	00:13:05.840	today for control of the media. Parliament, its long-distance telephones
163	00:13:05.850	00:13:09.940	cut by the president, demanded Rutskoi sack the pro-Yeltsin head
164	00:13:09.950	00:13:15.190	of state-controlled television and appoint his own man. News bulletins
165	00:13:15.200	00:13:18.610	have carried heavy coverage of the president's decree. They have
166	00:13:18.620	00:13:22.400	certainly been sympathetic to him though have also carried statements
167	00:13:22.410	00:13:26.730	from his opponents. The main television station is under heavy
168	00:13:26.740	00:13:35.560	police protection and remains in Yeltsin's hands. The media is
169	00:13:35.570	00:13:37.990	in the hands of the President's clique, if I may
170	00:13:38.000	00:13:40.650	call it such. The armed forces have been used to
171	00:13:40.660	00:13:43.650	put radio and TV under heavy guard. So what sort
172	00:13:43.660	00:13:49.320	of democracy is this? Most Russian newspapers, which now represent
173	00:13:49.330	00:13:52.470	a diverse range of opinions, have yet to comment in
174	00:13:52.480	00:13:56.640	detail on Yeltsin's decree, as last night's broadcasts came too
175	00:13:56.650	00:14:00.490	late for them. Another target of both sides, the defense
176	00:14:00.500	00:14:04.690	ministry. Last night, Rutskoi appointed his own defense and interior
177	00:14:04.700	00:14:07.750	ministers, but they have yet to get near their respective
178	00:14:07.760	00:14:13.110	ministries. Today, Yeltsin's defense minister, Havel Grachov, was meeting his
179	00:14:13.120	00:14:17.060	generals, a routine affair, he said. He also says the
180	00:14:17.070	00:14:21.070	armed forces would not become involved in any political actions,
181	00:14:21.080	00:14:24.990	though they fully support Boris Yeltsin, a statement of loyalty
182	00:14:25.000	00:14:30.050	echoed by Russia's interior minister. There was extra security around
183	00:14:30.060	00:14:35.010	public buildings today, but no sign of any troop deployment.
184	00:14:35.020	00:14:38.340	Parliament also ordered the country's central bank to stop funding
185	00:14:38.350	00:14:42.760	the presidential apparatus. Its leadership is conservative, but there is
186	00:14:42.770	00:14:47.230	no sign of them complying. And throughout Russian industry, where
187	00:14:47.240	00:14:51.490	discontent about reforms has been growing, workers were reluctant to
188	00:14:51.500	00:14:57.180	heed Khasbulatov's call to strike against Yeltsin. This afternoon, the
189	00:14:57.190	00:14:59.770	president appeared in public for the first time since his
190	00:14:59.780	00:15:03.310	announcement on a walkabout in Pushkin Square in the heart
191	00:15:03.320	00:15:07.800	of Moscow. He was, as always, brimming with confidence. "There
192	00:15:07.810	00:15:12.200	will be no negotiations with parliament because parliament doesn't exist
193	00:15:12.210	00:15:15.830	anymore," he declared. Buoyed by the news that so far
194	00:15:15.840	00:15:18.710	at least the armed forces have pledged their allegiance to
195	00:15:18.720	00:15:21.600	him, he told the people around him, "There will be
196	00:15:21.610	00:15:26.200	no blood on the streets," while Russia's other president appeared
197	00:15:26.210	00:15:28.830	on the balcony of the White House this evening to
198	00:15:28.840	00:15:32.100	address a gathering of his supporters, which by now have
199	00:15:32.110	00:15:40.150	swollen to several thousand. Here at the White House tonight
200	00:15:40.160	00:15:43.780	and among Yeltsin's supporters, there is a growing realization that
201	00:15:43.790	00:15:46.720	the outcome of this bitter struggle may not lie here
202	00:15:46.730	00:15:50.310	in Moscow but in the regions. Both sides have been
203	00:15:50.320	00:15:55.190	courting local leaders, and both are fearful that independence-minded republics
204	00:15:55.200	00:15:58.930	and regions may not take sides at all. Instead, they
205	00:15:58.940	00:16:12.270	may ignore central authority completely. Next tonight, the Clinton healthcare
206	00:16:12.280	00:16:15.760	plan. Later this evening, the President will formally present his
207	00:16:15.770	00:16:19.050	national healthcare plan to a joint session of Congress. The
208	00:16:19.060	00:16:21.950	long-heralded plan is at the heart of the President's domestic
209	00:16:21.960	00:16:25.950	policy. At stake is the reorganization of a $1 trillion
210	00:16:25.960	00:16:29.970	industry that accounts for one-seventh of the national economy. We
211	00:16:29.980	00:16:34.470	begin now with a Kwame Holman backgrounder. If any doubted
212	00:16:34.480	00:16:37.030	that health care would be a hot political issue in
213	00:16:37.040	00:16:41.070	the '90s, Harris Wofford probably made believers out of them.
214	00:16:41.080	00:16:47.310	Wofford! Wofford! During his 1991 campaign for a Pennsylvania Senate
215	00:16:47.320	00:16:50.990	seat, Wofford hammered away at the issue. He said people
216	00:16:51.000	00:16:54.180	who lose their jobs shouldn't lose their medical coverage as
217	00:16:54.190	00:16:58.670	well. Apparently, the voters agreed and swept Wofford to an
218	00:16:58.680	00:17:03.130	upset victory over Attorney General and former Pennsylvania Governor Richard
219	00:17:03.140	00:17:07.520	Thornburgh. We want national health insurance, and we want it
220	00:17:07.530	00:17:13.230	now! It was Wofford's political strategist, James Carville, who recognized
221	00:17:13.240	00:17:16.900	the importance of healthcare to the campaign, and when Carville
222	00:17:16.910	00:17:20.480	moved on to Bill Clinton's presidential campaign, so did the
223	00:17:20.490	00:17:24.790	healthcare issue. A healthcare program that will provide affordable healthcare
224	00:17:24.800	00:17:27.670	to all Americans but not by beginning with a huge
225	00:17:27.680	00:17:30.750	tax increase. By asking the wealthy to pay their fair
226	00:17:30.760	00:17:34.780	share, and controlling healthcare costs where the waste is most
227	00:17:34.790	00:17:38.820	flagrant among insurance companies and drug companies and bureaucracies. We
228	00:17:38.830	00:17:41.140	can keep what is best about our system, the right
229	00:17:41.150	00:17:44.050	to choose your doctor, your hospital, your provider. We can
230	00:17:44.060	00:17:47.520	keep the whole thing private, including insurance. And we must
231	00:17:47.530	00:17:50.780	require people not to be denied access to health coverage
232	00:17:50.790	00:17:55.610	because of preexisting conditions. Candidate Clinton vowed to make healthcare
233	00:17:55.620	00:17:59.890	reform the No. 1 priority of his administration. And shortly
234	00:17:59.900	00:18:03.290	after he was sworn in to office, President Clinton underscored
235	00:18:03.300	00:18:06.890	his campaign pledge by appointing First Lady Hillary to head
236	00:18:06.900	00:18:10.890	the White House task force on healthcare reform. I think
237	00:18:10.900	00:18:13.760	that in the coming months the American people will learn,
238	00:18:13.770	00:18:16.440	as the people of our state did, that we have
239	00:18:16.450	00:18:19.310	a First Lady of many talents but who, most of
240	00:18:19.320	00:18:24.000	all, can bring people together around complex and difficult issues
241	00:18:24.010	00:18:27.890	to hammer out consensus and get things done. In the
242	00:18:27.900	00:18:31.130	weeks and months that followed, Hillary Rodham Clinton held a
243	00:18:31.140	00:18:35.560	number of high-profile town meetings and healthcare forums. She invited
244	00:18:35.570	00:18:39.440	healthcare professionals, as well as everyday Americans, to give their
245	00:18:39.450	00:18:42.860	opinions and advice on what needed to be contained in
246	00:18:42.870	00:18:47.250	any healthcare reform package. Many of the problems that were
247	00:18:47.260	00:18:49.530	pointed out that we could all agree on, that we
248	00:18:49.540	00:18:53.570	don't have enough primary care practitioners to do the kind
249	00:18:53.580	00:18:55.310	of work that we heard about from the doctor in
250	00:18:55.320	00:18:57.690	the audience and the doctor in the panel. Well, how
251	00:18:57.700	00:19:01.030	do we get quickly to reverse the ratio of 70
252	00:19:01.040	00:19:04.880	percent specialists to 30 percent generalists? I don't know that
253	00:19:04.890	00:19:08.070	it is possible to satisfy every need that was heard
254	00:19:08.080	00:19:11.210	today. I think the best we can do is to
255	00:19:11.220	00:19:13.970	be honest about facing the problems that every one of
256	00:19:13.980	00:19:16.070	us in this room have had a hand in helping
257	00:19:16.080	00:19:21.290	to create. Mr. Speaker, the President of the United States.
258	00:19:21.300	00:19:24.530	Tonight, will be President Clinton's second address to a joint
259	00:19:24.540	00:19:27.800	session of Congress. He's expected to lay out the principles
260	00:19:27.810	00:19:32.340	of healthcare reform he wants met, including health security for
261	00:19:32.350	00:19:37.910	all, simplifying the healthcare system, making sure everybody pays a
262	00:19:37.920	00:19:43.500	fair share, and achieving savings through cost containment, while maintaining
263	00:19:43.510	00:19:47.660	choice and the quality of care. And what the President
264	00:19:47.670	00:19:50.580	does not want is the kind of partisan battle that
265	00:19:50.590	00:19:55.460	ensued after his first speech to Congress on the budget.
266	00:19:55.470	00:19:58.390	Mrs. Clinton has kept closely in touch with members of
267	00:19:58.400	00:20:02.290	Congress from both parties, and it appears a bipartisan spirit
268	00:20:02.300	00:20:06.720	is there. I really feel that on this issue, one
269	00:20:06.730	00:20:10.100	that has all kinds of interest among the American people
270	00:20:10.110	00:20:13.750	out there, that we can definitely work together, and there
271	00:20:13.760	00:20:16.770	are a number of options for us to consider. One
272	00:20:16.780	00:20:20.040	of those options was offered by Senate Minority Leader Bob
273	00:20:20.050	00:20:23.640	Dole. Fundamentally, we believe that if you give business men
274	00:20:23.650	00:20:26.760	and women and individuals the tools they need to gain
275	00:20:26.770	00:20:30.790	access to reasonably priced healthcare coverage, they will take that
276	00:20:30.800	00:20:35.870	opportunity, absent massive government intervention or mandates. As the President
277	00:20:35.880	00:20:39.080	prepared this afternoon to deliver tonight's address, it was with
278	00:20:39.090	00:20:42.170	the knowledge that no matter what specifics he presents, the
279	00:20:42.180	00:20:46.430	details of healthcare reform will be worked out by Congress.
280	00:20:46.440	00:20:49.400	Now, two officials who've dealt with health issues in previous
281	00:20:49.410	00:20:53.600	administrations. Dr. Bernadine Healy was director of the National Institutes
282	00:20:53.610	00:20:57.300	of Health under President Bush. She's currently seeking the Republican
283	00:20:57.310	00:21:01.430	nomination for the U.S. Senate for Ohio. Joseph Califano was
284	00:21:01.440	00:21:05.110	Secretary of Health, Education, & Welfare under President Carter. He
285	00:21:05.120	00:21:09.450	also served as chief domestic adviser to President Johnson. Welcome
286	00:21:09.460	00:21:11.480	to both of you. Let me start with you, Mr.
287	00:21:11.490	00:21:14.440	Califano. What does the President have to do tonight? What's
