index	starts	ends	content
596	00:38:34.530	00:38:38.860	think, reasons why the administration has been drawn into involvement
597	00:38:38.870	00:38:41.390	in the Bosnian war after being so reluctant for such
598	00:38:41.400	00:38:44.950	a long time is a concern about making NATO relevant,
599	00:38:44.960	00:38:47.690	of--You don't think it's a concern over making the
600	00:38:47.700	00:38:50.530	United States relevant? Well, but I think they're connected in
601	00:38:50.540	00:38:53.890	the sense that there's the belief that we don't want
602	00:38:53.900	00:38:56.540	the Europeans just left to their own devices; we want
603	00:38:56.550	00:38:58.640	to play a role in Europe, and, therefore, we want
604	00:38:58.650	00:39:00.840	to do something for the Europeans that they're not doing
605	00:39:00.850	00:39:03.130	for themselves. We protected them from the Russians all those
606	00:39:03.140	00:39:06.530	years, which they felt they couldn't do for themselves. When
607	00:39:06.540	00:39:09.240	they worked out a settlement in Bosnia among the contending
608	00:39:09.250	00:39:13.100	forces in 1992, we refused to back it, saying that
609	00:39:13.110	00:39:15.710	it wasn't good enough. People forget that, that there was
610	00:39:15.720	00:39:19.230	a peace agreement similar to the one that was negotiated--
611	00:39:19.240	00:39:21.120	Sure.--in Dayton by the Europeans. But we said, no,
612	00:39:21.130	00:39:24.070	that's ethnic cleansing; we don't like that, we're not going
613	00:39:24.080	00:39:26.850	to--we're not going to support it, but as a
614	00:39:26.860	00:39:29.940	result, the various factions said that they didn't think it
615	00:39:29.950	00:39:31.790	was going to last, and so they continued fighting all
616	00:39:31.800	00:39:35.360	these years. But I do think it's--it's critical for
617	00:39:35.370	00:39:39.760	us not to argue over constitutionality and what should be
618	00:39:39.770	00:39:41.780	the prerogative of the President, all the kinds of things
619	00:39:41.790	00:39:44.340	the Congress is concerned with these days in the name
620	00:39:44.350	00:39:47.750	of credibility. I think there's something very important at stake
621	00:39:47.760	00:39:50.270	here. And this is: Does the United States continue to
622	00:39:50.280	00:39:53.900	define its place in the world the way it did
623	00:39:53.910	00:39:57.160	during the Cold War? I think Professor Kagan states it
624	00:39:57.170	00:39:59.810	very well. I don't agree with him, but should the
625	00:39:59.820	00:40:03.020	United States be, in effect, the international peacekeeper? I'd like
626	00:40:03.030	00:40:05.940	to live in a world where grievances aren't settled by
627	00:40:05.950	00:40:09.020	war anymore either. I don't think we're anywhere near that
628	00:40:09.030	00:40:11.470	kind of world, and I don't think that the United
629	00:40:11.480	00:40:14.260	States has the power to bring about that kind of
630	00:40:14.270	00:40:16.250	world. I think it would bankrupt the United States. I
631	00:40:16.260	00:40:18.930	think it would divide the American people terribly, and it
632	00:40:18.940	00:40:21.610	would bring us all to grief; therefore, we have to
633	00:40:21.620	00:40:25.300	choose our involvements very carefully, and we have to say,
634	00:40:25.310	00:40:28.740	how is this related to the interests and the concerns
635	00:40:28.750	00:40:30.530	of the American people? Now, I think you can make
636	00:40:30.540	00:40:32.780	an argument for intervention in Bosnia, but I think it
637	00:40:32.790	00:40:35.980	has to be essentially on humanitarian grounds. It's not about
638	00:40:35.990	00:40:38.890	stability because Europe has been stable. All right. Could I
639	00:40:38.900	00:40:40.940	say a word about that? One quick word. Yes, sir.
640	00:40:40.950	00:40:46.340	I simply want to say that we mustn't imagine that
641	00:40:46.350	00:40:49.450	if we just back off from Europe and back off
642	00:40:49.460	00:40:51.440	from the rest of the world, everything is going to
643	00:40:51.450	00:40:54.370	be nifty. The assumption is you've got dangers and troubles
644	00:40:54.380	00:40:56.820	if you act, but none if you don't act. We
645	00:40:56.830	00:40:58.750	have made the point that there must be a debate,
646	00:40:58.760	00:41:00.500	and we started it tonight, and it will go on
647	00:41:00.510	00:41:11.330	and on and on. Thank you all three very much.
648	00:41:11.340	00:41:15.650	Now, a breast cancer update. Charlayne Hunter-Gault has that story.
649	00:41:15.660	00:41:20.610	A 1985 study first showed that limited surgery combined with
650	00:41:20.620	00:41:25.220	radiation therapy works just as well as extensive surgery as
651	00:41:25.230	00:41:29.570	a treatment for small breast tumors. The smaller operation is
652	00:41:29.580	00:41:33.360	known as a lumpectomy. Removal of the entire breast is
653	00:41:33.370	00:41:38.090	known as mastectomy. But last year, fraud charges against one
654	00:41:38.100	00:41:42.450	of the researchers raised doubts about the study. Today, the
655	00:41:42.460	00:41:46.220	"New England Journal of Medicine" has published the latest findings,
656	00:41:46.230	00:41:49.340	upholding the study. Here to tell us what it all
657	00:41:49.350	00:41:53.100	means is Dr. Christine Berg, the director of the Breast
658	00:41:53.110	00:41:58.340	Radiation Oncology Section at Georgetown University Medical Center. And Dr.
659	00:41:58.350	00:42:01.630	Berg, tell us about first the original study and its
660	00:42:01.640	00:42:04.980	conclusions and then what led to the controversy. I'd be
661	00:42:04.990	00:42:10.350	very happy to, Charlayne. The study was conceived quite a
662	00:42:10.360	00:42:13.740	number of years ago to look at the best treatment
663	00:42:13.750	00:42:18.580	for the breast for women with early-stage breast cancer. And
664	00:42:18.590	00:42:22.470	the goal was to find out which types of treatments
665	00:42:22.480	00:42:26.100	would be most appropriate. There were three groups of women,
666	00:42:26.110	00:42:29.200	one group treated with mastectomy, the removal of the whole
667	00:42:29.210	00:42:33.810	breast, another treated with lumpectomy alone, and then a third
668	00:42:33.820	00:42:39.230	group treated with lumpectomy with radiation. The study was first
669	00:42:39.240	00:42:45.480	published in 1985, and then updated in 1989, and then
670	00:42:45.490	00:42:50.190	the results at that time indicated that the treatment arms
671	00:42:50.200	00:42:55.990	were identical in terms of long-term survival. All three of
672	00:42:56.000	00:42:59.650	them. All three of them. As, as you mentioned--So
673	00:42:59.660	00:43:03.420	that, in other words, a woman didn't have to go
674	00:43:03.430	00:43:06.650	to the radical step of having her whole breast removed,
675	00:43:06.660	00:43:10.280	but could have the lumpectomy or just, or the lumpectomy
676	00:43:10.290	00:43:15.080	with radiation, the lesser? A woman could opt to have
677	00:43:15.090	00:43:20.780	both lumpectomy with the radiation, or the mastectomy. The lumpectomy
678	00:43:20.790	00:43:25.200	alone arm is showing a higher in-breast recurrence rate, and
679	00:43:25.210	00:43:30.880	so we're advocating treatment either with the lumpectomy with radiation
680	00:43:30.890	00:43:34.720	or the mastectomy. But then a controversy arose because there
681	00:43:34.730	00:43:39.200	were suggestions that the study was tainted, right? Yes. The
682	00:43:39.210	00:43:43.490	controversy arose because the group that did the study, the
683	00:43:43.500	00:43:50.080	National Surgical Adjuvant Breast Project, NSABP, noticed that some of
684	00:43:50.090	00:43:56.600	the data from one investigator in Montreal was tainted, and
685	00:43:56.610	00:43:59.330	they found that out of the over three hundred patients
686	00:43:59.340	00:44:03.640	that he had enrolled six of those patients had data
687	00:44:03.650	00:44:07.380	that was not accurate. How bad was it? I mean,
688	00:44:07.390	00:44:11.160	how tainted was it? Well, it--what he had done
689	00:44:11.170	00:44:13.720	was, you know, for like a date of surgery, he
690	00:44:13.730	00:44:16.220	had--in order to ensure that the woman met the
691	00:44:16.230	00:44:19.920	entry criteria, he might have modified the date by a
692	00:44:19.930	00:44:24.490	few days. And so it--you know--it didn't all--
693	00:44:24.500	00:44:27.690	and he knew that he was modifying the date. Modifying
694	00:44:27.700	00:44:30.800	what date? The date that the woman would have originally
695	00:44:30.810	00:44:33.680	had the surgery. Oh, I see. You have to start
696	00:44:33.690	00:44:36.250	the treatment, you know, the radiation with a certain number
697	00:44:36.260	00:44:39.990	of days, you know, to meet the study entry criteria.
698	00:44:40.000	00:44:42.090	And in order to ensure that a woman might be
699	00:44:42.100	00:44:45.080	still eligible, he would push the date of the surgery
700	00:44:45.090	00:44:48.570	up a little bit--And that--Well--And that could
701	00:44:48.580	00:44:54.430	affect the outcome? Well, one would then wonder about is
702	00:44:54.440	00:44:58.630	he accurately reporting all of the information about the women
703	00:44:58.640	00:45:01.370	in terms of their results. Okay. So what does today's
704	00:45:01.380	00:45:07.680	audit show? Today's audit went back and investigated all of
705	00:45:07.690	00:45:12.210	the charts from the major institutions that participated in the
706	00:45:12.220	00:45:15.740	trial. The National Cancer Institute sent out a team of
707	00:45:15.750	00:45:22.200	76 investigators to pull these records, look over all the
708	00:45:22.210	00:45:26.860	important details regarding the dates of treatment, the results of
709	00:45:26.870	00:45:31.160	treatment, to confirm the validity of the information; they went
710	00:45:31.170	00:45:33.890	to the charts individually and pulled those and looked at
711	00:45:33.900	00:45:38.890	them. And they verified that the data that had been
712	00:45:38.900	00:45:43.200	entered into the analysis was accurate. And so now the
713	00:45:43.210	00:45:47.610	conclusion takes us back to the original study. The conclusion--
714	00:45:47.620	00:45:51.360	in parallel with the audit, the "New England Journal of
715	00:45:51.370	00:45:56.530	Medicine" published a--the update, the 12-year update of the
716	00:45:56.540	00:46:04.540	NSABP results, confirming that lumpectomy and radiation when compared directly
717	00:46:04.550	00:46:11.510	to mastectomy is identical in terms of long-term disease-free survival
718	00:46:11.520	00:46:13.860	for women. So in terms of the women out there,
719	00:46:13.870	00:46:16.710	I think the incidence now is about 180,000, is that
720	00:46:16.720	00:46:20.010	right? That's correct, in 1995. What should they be thinking
721	00:46:20.020	00:46:22.540	now, and what would you be telling them? Yes. I
722	00:46:22.550	00:46:25.070	deal with this every day. I mean, I see a
723	00:46:25.080	00:46:27.920	lot of women with breast cancer. I think the most
724	00:46:27.930	00:46:31.740	important thing for them to do is to gather information
725	00:46:31.750	00:46:37.100	about the particulars of their situation, discuss with their physician,
726	00:46:37.110	00:46:40.580	or even better, a group of physicians to find out
727	00:46:40.590	00:46:43.080	what's best for them. All right. Well, Dr. Berg, thank
728	00:46:43.090	00:46:54.830	you for joining us. Thank you very much. Finally tonight,
729	00:46:54.840	00:46:58.540	a Gergen dialogue. David Gergen, editor-at-large of "U.S. News &
730	00:46:58.550	00:47:03.060	World Report," engages Microsoft chairman Bill Gates. Gates has written
731	00:47:03.070	00:47:05.130	The Road Ahead, a book about the future of the
732	00:47:05.140	00:47:10.170	information highway. Mr. Gates, the message of your book is,
733	00:47:10.180	00:47:12.840	or seems to me, is that the next 20 years
734	00:47:12.850	00:47:16.460	will bring more revolutionary changes in the information age than
735	00:47:16.470	00:47:19.570	all of the changes we've seen heretofore. Can you explain
736	00:47:19.580	00:47:23.470	that? The key idea is that the personal computer so
737	00:47:23.480	00:47:27.600	far has just changed the way we create documents. But
738	00:47:27.610	00:47:31.400	as we connect them together, it becomes a revolution in
739	00:47:31.410	00:47:35.880	communications, an ability to find people with common interests, to
740	00:47:35.890	00:47:39.440	explore any subject, to know what's going on. It becomes
741	00:47:39.450	00:47:43.950	an electronic marketplace, where anybody who has consulting services they
742	00:47:43.960	00:47:46.350	want to offer can declare that, and it's easy to
743	00:47:46.360	00:47:50.160	find them and hook up and even do video conferencing
744	00:47:50.170	00:47:52.540	so the work can be delivered that way. So it's
745	00:47:52.550	00:47:56.030	a big step forward in making the world a smaller
746	00:47:56.040	00:48:00.040	place and allowing us to exercise curiosity that we never
747	00:48:00.050	00:48:02.540	could before. Most of the people that talk to you
748	00:48:02.550	00:48:05.740	about your book discuss technological aspects. I'd like to talk
749	00:48:05.750	00:48:07.260	about the other part of it, and that is the
750	00:48:07.270	00:48:12.670	social implications of these changes. You've just recently gotten married,
751	00:48:12.680	00:48:14.310	and I'm really curious, as you think about the possibility
752	00:48:14.320	00:48:17.620	of having kids, do you think we ought to embrace
753	00:48:17.630	00:48:21.260	as a nation the goal that every American child should
754	00:48:21.270	00:48:25.220	be computer literate before graduating from school? I think we
755	00:48:25.230	00:48:27.780	are going to have to make that a clear goal
756	00:48:27.790	00:48:31.940	because people who agree that this is a great tool
757	00:48:31.950	00:48:36.760	should want everyone to have the opportunity that it represents.
758	00:48:36.770	00:48:39.450	Kids start out with a lot of curiosity. They want
759	00:48:39.460	00:48:43.170	to explore subjects, and the classroom environment makes it tough
760	00:48:43.180	00:48:45.920	for things to be individually tailored. If you're a little
761	00:48:45.930	00:48:48.030	bit slower, a little bit faster, you want to learn
762	00:48:48.040	00:48:52.140	it in a different way, the computer can provide that.
763	00:48:52.150	00:48:55.190	The explosion of publishing up on the Internet is a
764	00:48:55.200	00:49:00.510	wonderful thing, and now teachers are taking their multimedia lessons
765	00:49:00.520	00:49:05.180	and contributing them for free to a repository that other
766	00:49:05.190	00:49:08.220	teachers can go in to and get. And students can
767	00:49:08.230	00:49:11.510	go all over the world and find other kids learning
768	00:49:11.520	00:49:15.820	the same thing. So I think it really should be
769	00:49:15.830	00:49:19.080	something that is available in the same way that books
770	00:49:19.090	00:49:24.060	are available to everyone today. The question then becomes, and
771	00:49:24.070	00:49:25.680	you raise this in your book but you don't quite
772	00:49:25.690	00:49:28.300	answer it--I'm curious what you think--how do we
773	00:49:28.310	00:49:30.980	begin closing some of these gaps? I was quite struck,
774	00:49:30.990	00:49:34.700	for example, there was a survey in "USA Today" recently
775	00:49:34.710	00:49:39.100	about computers in homes by racial or ethnic group. Now,
776	00:49:39.110	00:49:42.010	listen to these numbers. In Asian homes, 40 percent of
777	00:49:42.020	00:49:46.650	Asian homes now have computers, 29 percent of white homes,
778	00:49:46.660	00:49:49.270	only 13 percent of Hispanic and 11 percent of black
779	00:49:49.280	00:49:52.190	homes. How do we--how should we go about it?
780	00:49:52.200	00:49:54.490	If every child should be computer literate, how do we
781	00:49:54.500	00:49:58.230	go about closing that kind of gap? Well, I think
782	00:49:58.240	00:50:01.250	there is a big correlation where you have a strong
783	00:50:01.260	00:50:04.600	family structure that puts a high value on education, the
784	00:50:04.610	00:50:10.700	PC tends to move up in their priorities. And those
785	00:50:10.710	00:50:14.020	figures are rather stunning. I think even if you took
786	00:50:14.030	00:50:18.570	out the income effect, you'd still see a potentially growing
787	00:50:18.580	00:50:24.490	problem of, of the opportunity that kids might have there.
788	00:50:24.500	00:50:27.410	Now, there will always be families that can't afford it,
789	00:50:27.420	00:50:30.780	to have it at home, even if they want to,
790	00:50:30.790	00:50:33.690	and so the school and the library are going to
791	00:50:33.700	00:50:37.920	have to be two places where access is available. The
792	00:50:37.930	00:50:41.640	PC is improving quite a bit and it's over the
793	00:50:41.650	00:50:44.960	next five years where I think that the content will
794	00:50:44.970	00:50:47.710	be so much better, the communications networks will be so
795	00:50:47.720	00:50:50.030	much better. The PC will be so much better. That's
796	00:50:50.040	00:50:52.730	the timeframe where we ought to solve this problem of
797	00:50:52.740	00:50:55.610	making it available to everyone. If you go out far
798	00:50:55.620	00:50:58.180	enough, maybe the PC will be cheap enough for most
799	00:50:58.190	00:51:01.340	homes, but I don't think we can wait that long
800	00:51:01.350	00:51:05.710	before we, we provide access. You've, interestingly enough, you're taking
801	00:51:05.720	00:51:08.090	the proceeds from your book and donating them to schools,
802	00:51:08.100	00:51:10.980	to teachers who introduce computers. But you note in your
803	00:51:10.990	00:51:14.840	book that schools have been far slower to introduce computers,
804	00:51:14.850	00:51:18.230	personal computers, than have businesses. In fact, there was a--
805	00:51:18.240	00:51:19.970	there was a piece in the "Wall Street Journal," they
806	00:51:19.980	00:51:22.720	had a big technology section about a week ago which
807	00:51:22.730	00:51:26.100	pointed out that some 60 percent of teachers now have
808	00:51:26.110	00:51:28.030	access to computers but only about 40 percent of them
809	00:51:28.040	00:51:30.690	are incorporating their curriculums. A lot of the teachers don't
810	00:51:30.700	00:51:32.440	seem to know how to use them. They haven't been
811	00:51:32.450	00:51:34.280	trained to know how to use computers, so even though
812	00:51:34.290	00:51:36.020	a city like Detroit can go out and buy a
813	00:51:36.030	00:51:40.190	lot of computers, the teachers, themselves, are not prepared to
814	00:51:40.200	00:51:41.890	teach them in the classrooms. How do we deal with
815	00:51:41.900	00:51:45.290	that? Well, there's a lot to be done. The people
816	00:51:45.300	00:51:48.780	who write textbooks are having to revise those to bring
817	00:51:48.790	00:51:51.830	interactive in to it, and so as the school boards
818	00:51:51.840	00:51:56.170	qualify the next round of textbooks, they'll have to make
819	00:51:56.180	00:51:59.570	that requirement. Training teachers is a big, big deal here.
820	00:51:59.580	00:52:04.000	If your teacher isn't enthusiastic about, embracing it, then there's
821	00:52:04.010	00:52:06.120	no way it's going to get the right use in
822	00:52:06.130	00:52:08.220	the classroom, and then you've got to have not only
823	00:52:08.230	00:52:12.210	the equipment but also the communications connections. And if we're
824	00:52:12.220	00:52:14.840	in balance to providing a few of those and not
825	00:52:14.850	00:52:17.810	the other elements, then it's a waste. One of the
826	00:52:17.820	00:52:20.950	other things that's been true for a while is that
827	00:52:20.960	00:52:24.920	computer usage seems to be more male-oriented than female-oriented. How
828	00:52:24.930	00:52:28.030	do we overcome that gender difference? It's been kind of
829	00:52:28.040	00:52:34.300	a game-oriented motivation which has really pushed towards the boys
830	00:52:34.310	00:52:37.350	who are out there to explore wild things. You just
831	00:52:37.360	00:52:39.820	need to invent more software for girls then, right? Well,
832	00:52:39.830	00:52:42.000	that's going on. A lot of the new software is
833	00:52:42.010	00:52:46.240	very creative, not so much violent games but rather exploration
834	00:52:46.250	00:52:49.680	and things where kids go together and do things. Once
835	00:52:49.690	00:52:52.960	somebody's a user, and they have the confidence that they
836	00:52:52.970	00:52:55.660	can do one thing with a computer, then they branch
837	00:52:55.670	00:52:59.970	out. They find other areas, and it's, it's stunning how
838	00:52:59.980	00:53:03.310	far they go. I've seen this with senior citizens that
839	00:53:03.320	00:53:06.100	start out maybe just with electronic mail or doing their
840	00:53:06.110	00:53:10.500	taxes or playing a game. Then they'll--they'll have the
841	00:53:10.510	00:53:17.180	impetus to go on and be big-time Web surfers. But
842	00:53:17.190	00:53:23.340	that, that first set of learning, people are afraid to
843	00:53:23.350	00:53:26.150	look dumb. They think maybe I'm the person who can't
844	00:53:26.160	00:53:27.730	do it. And so you either have to have a
845	00:53:27.740	00:53:30.660	friend who steps you through it, or you've got to
846	00:53:30.670	00:53:34.040	have an environment where it's other people you can relate
847	00:53:34.050	00:53:37.340	to, or you're all equally nervous about it, and there
848	00:53:37.350	00:53:39.920	is a little bit of learning to go on. There’s
849	00:53:39.930	00:53:44.070	been a debate and literature about whether, you know, getting
850	00:53:44.080	00:53:47.380	too into computers is socially isolating or not. You write
851	00:53:47.390	00:53:50.010	more optimistically that it helps to create social circles and
852	00:53:50.020	00:53:52.470	reach out for more friends. I'm really interested in a
853	00:53:52.480	00:53:57.610	different issue, and that is whether--we found is that
854	00:53:57.620	00:54:00.640	people as they move from city to suburb became less
855	00:54:00.650	00:54:04.560	engaged in civic activities, they became less involved in community-related
856	00:54:04.570	00:54:08.740	activities. How do we overcome the possibility that as people
857	00:54:08.750	00:54:10.960	get hooked into their computers, just as they got hooked
858	00:54:10.970	00:54:14.130	into television, the electronic world becomes so much more important
859	00:54:14.140	00:54:16.240	to them that they'll care much less about what's happening
860	00:54:16.250	00:54:20.960	outside their door? Well, I hope that the computer is
861	00:54:20.970	00:54:24.360	a tool to help you get more involved with what's
862	00:54:24.370	00:54:27.490	going on in your community. I mean, part of the
863	00:54:27.500	00:54:30.360	hallmark of the United States versus other countries is the
864	00:54:30.370	00:54:35.760	civic involvement, the willingness to get involved in charitable activities.
865	00:54:35.770	00:54:40.810	When you're reading about, oh, politics, today those short little
866	00:54:40.820	00:54:44.320	articles that just have the latest scrap, it makes it
867	00:54:44.330	00:54:48.380	very tough to say understand a budget trade-off, you know,
868	00:54:48.390	00:54:50.880	what the vote for or against is, or what is
869	00:54:50.890	00:54:53.600	my representative saying, you know, are they still trying to
870	00:54:53.610	00:54:55.210	make up their mind, are they interested in what I
871	00:54:55.220	00:54:57.650	have to say, what is their voting record on this
872	00:54:57.660	00:55:00.170	issue, and so I think if you have the latest
873	00:55:00.180	00:55:03.190	article there, you can just click to see how the
874	00:55:03.200	00:55:06.810	money is spent, what are those programs. You can then
875	00:55:06.820	00:55:09.460	join a bulletin board group where you get notified on
876	00:55:09.470	00:55:12.460	new things or decide to have a meeting. I think
877	00:55:12.470	00:55:15.510	it makes it much easier to get involved. Government is
878	00:55:15.520	00:55:19.280	so complex, so large that it's pretty daunting to try
879	00:55:19.290	00:55:23.090	and say, I've got the expertise to say some new
880	00:55:23.100	00:55:28.430	law about transportation is a mistake. And I hope that
881	00:55:28.440	00:55:32.580	by politicians putting up their speeches and the bills being
882	00:55:32.590	00:55:36.580	there and different points of view, that people will choose
883	00:55:36.590	00:55:39.660	to get reengaged and find that these are issues that,
884	00:55:39.670	00:55:44.250	that they can understand and make a contribution to. Now,
885	00:55:44.260	00:55:46.190	some people go as far as to say that, you
886	00:55:46.200	00:55:50.810	know, we'll try out direct democracy using electronic devices. If
887	00:55:50.820	00:55:52.700	that would get people more involved, maybe it would be
888	00:55:52.710	00:55:56.690	a good thing. One final question. You may be having
889	00:55:56.700	00:55:58.870	kids in the future. How do you plan to raise
890	00:55:58.880	00:56:00.830	your children--have you thought about it--with regard to
891	00:56:00.840	00:56:02.770	a computer? A lot of time on the computers, would
892	00:56:02.780	00:56:04.470	you limit the amount of time they might spend on
893	00:56:04.480	00:56:05.900	computers as they grow up so that they have some
894	00:56:05.910	00:56:10.890	other outside activities? Using a computer is something we're going
895	00:56:10.900	00:56:14.650	to have to break down into different kinds of activities.
896	00:56:14.660	00:56:16.470	I mean, take reading; you don't want your kids to
897	00:56:16.480	00:56:19.310	read comic books all the time, but if they're reading
