index	starts	ends	content
288	00:21:14.450	00:21:17.080	the most important case he has to make? Well, I
289	00:21:17.090	00:21:19.340	think the case is made for healthcare reform. What he's
290	00:21:19.350	00:21:22.730	got to do is really give a speech that keeps
291	00:21:22.740	00:21:25.170	this subject on the front burner. I think the President's
292	00:21:25.180	00:21:28.590	role is to arouse the people to a call to
293	00:21:28.600	00:21:31.300	arms. The bill is going to be written in Congress.
294	00:21:31.310	00:21:34.050	The details of this bill will be written in Congress.
295	00:21:34.060	00:21:37.080	And I think he's done it brilliantly so far. And
296	00:21:37.090	00:21:42.290	I think he's played on the greatest concern of the
297	00:21:42.300	00:21:45.990	American people. Most American people have healthcare, but they're all
298	00:21:46.000	00:21:48.590	worried about losing it when they lose their jobs. With
299	00:21:48.600	00:21:51.030	thousands of layoffs in the past couple of years, with
300	00:21:51.040	00:21:54.970	business, big business angry that other big business isn't covering
301	00:21:54.980	00:21:58.330	their employees, he's played on all of that very well.
302	00:21:58.340	00:22:01.280	And I think the people are ready for reform. Do
303	00:22:01.290	00:22:03.430	you agree, Dr. Healy? I think the most important thing
304	00:22:03.440	00:22:06.680	he should do tonight is to make sense and not
305	00:22:06.690	00:22:09.370	to incite fear. I think fear has been a driving
306	00:22:09.380	00:22:10.910	force in this debate, and I don't think it's a
307	00:22:10.920	00:22:14.070	healthy one. I think facts, not fear, should dominate, and
308	00:22:14.080	00:22:20.100	facts have to be surrounded--surrounding the issues, affordability, coverage
309	00:22:20.110	00:22:23.800	of those 37 million who are not covered, and some
310	00:22:23.810	00:22:26.620	recognition of the fact that over 200 million Americans are
311	00:22:26.630	00:22:29.110	getting good care and don't necessarily have to have their
312	00:22:29.120	00:22:33.140	whole care disassembled in order to help the 37 million
313	00:22:33.150	00:22:36.170	who do need coverage. Well, Mr. Califano, where do you
314	00:22:36.180	00:22:39.990	think the President starts at with the public? That is,
315	00:22:40.000	00:22:43.400	the polls seem quite contradictory. 90 percent of the people
316	00:22:43.410	00:22:45.680	say they like their own healthcare, but 90 percent of
317	00:22:45.690	00:22:47.600	the people tell the New York Times they want the
318	00:22:47.610	00:22:50.680	system drastically overhauled. Well, I think most of the people
319	00:22:50.690	00:22:53.420	love healthcare, and they love not paying for it. And
320	00:22:53.430	00:22:56.070	they feel like they're not paying for it. I think,
321	00:22:56.080	00:22:59.980	where does he start? He starts where Richard Nixon arrived,
322	00:22:59.990	00:23:02.120	where Jimmy Carter and I arrived. When I started looking
323	00:23:02.130	00:23:04.780	at healthcare on a search of HEW, I was all--
324	00:23:04.790	00:23:06.880	I started with the viewpoint of a national plan, with
325	00:23:06.890	00:23:09.270	the federal government running it. But the reality is that
326	00:23:09.280	00:23:12.890	every nation in the world that covers all their people,
327	00:23:12.900	00:23:16.240	we're the only industrialized nation besides South Africa that doesn't,
328	00:23:16.250	00:23:19.080	every nation did it out of their existing healthcare system.
329	00:23:19.090	00:23:21.680	So he starts with the employer mandate. Like it or
330	00:23:21.690	00:23:24.280	not, the reality is that most Americans get their healthcare
331	00:23:24.290	00:23:27.790	from their employment relationship. And there, I think, we ought
332	00:23:27.800	00:23:31.440	to treat it like the minimum wage. Minimum healthcare benefits
333	00:23:31.450	00:23:35.800	like a minimum wage, like disability insurance, like unemployment insurance.
334	00:23:35.810	00:23:37.620	These are things that employers have paid for in this
335	00:23:37.630	00:23:40.020	country, and the arguments you hear about not having a
336	00:23:40.030	00:23:43.910	mandate really resonate with the arguments that people made in
337	00:23:43.920	00:23:47.300	the 1930s against the 25 cent minimum wage when that
338	00:23:47.310	00:23:50.040	was proposed. And I think that'll happen. It will be
339	00:23:50.050	00:23:52.440	phased in over several years, but I think that piece
340	00:23:52.450	00:23:55.190	will be done. Dr. Healy, do you agree that the
341	00:23:55.200	00:23:58.040	employer mandate--by that we mean most coverage will come
342	00:23:58.050	00:24:01.660	through the employers--was politically in any event the only
343	00:24:01.670	00:24:03.550	way he could go? No, I don't think so. I
344	00:24:03.560	00:24:05.400	think that what you really have to do is look
345	00:24:05.410	00:24:07.550	at the people who are uninsured, tease them out, and
346	00:24:07.560	00:24:11.090	find out how we can design tailored programs for people.
347	00:24:11.100	00:24:14.420	60 percent of them are young people who simply don't
348	00:24:14.430	00:24:16.860	want to be burdened with a price tag of two
349	00:24:16.870	00:24:19.590	thousand, four thousand dollars, when they're never going to consume
350	00:24:19.600	00:24:21.950	that much cost in a year. So I think there
351	00:24:21.960	00:24:24.940	are ways that we could have individual mandates that give
352	00:24:24.950	00:24:28.430	the individual patient more responsibility and more control over a
353	00:24:28.440	00:24:30.170	large amount of money that's going to be spent per
354	00:24:30.180	00:24:34.770	capita. There's a very deep feeling of paternalism among this
355	00:24:34.780	00:24:37.940	plan that says people can't handle their healthcare for themselves,
356	00:24:37.950	00:24:40.370	we're going to seize and control it, tell them what
357	00:24:40.380	00:24:42.360	they can do, what they can't do. It's a "one
358	00:24:42.370	00:24:45.740	size fits all" approach. And I think Joe knows that
359	00:24:45.750	00:24:48.390	back 20 years ago we were all toying with national
360	00:24:48.400	00:24:51.250	health insurance, but a lot of social experimentation has gone
361	00:24:51.260	00:24:53.420	on around the world which has shown that national health
362	00:24:53.430	00:24:56.600	insurance leads to long waiting lines. It does not lead
363	00:24:56.610	00:25:01.020	to efficiencies, and worst of all, it is a failure,
364	00:25:01.030	00:25:02.900	judged by the fact that most of those countries are
365	00:25:02.910	00:25:05.290	starting to privatize. Let me go back just though to
366	00:25:05.300	00:25:07.860	the politics of the situation right now. What kind of
367	00:25:07.870	00:25:09.860	a job do you think President and Mrs. Clinton have
368	00:25:09.870	00:25:13.480	done so far in trying to get different constituency groups
369	00:25:13.490	00:25:16.390	behind this? To date, I think they've done a remarkable
370	00:25:16.400	00:25:18.410	job. I will tell you, and I have said it
371	00:25:18.420	00:25:21.190	publicly, six months ago, I thought there was no prayer
372	00:25:21.200	00:25:24.650	of having a major reform by the end of 1994.
373	00:25:24.660	00:25:27.330	I think now the chances are better than 50/50. I'd
374	00:25:27.340	00:25:30.470	make one point, the emphasis on the employment relationship is
375	00:25:30.480	00:25:33.170	important because of when you look at those thirty-seven to
376	00:25:33.180	00:25:36.230	forty million people, two-thirds of them work, or are dependents
377	00:25:36.240	00:25:39.590	of workers. And if you're Chrysler, or you're in the
378	00:25:39.600	00:25:42.960	steel industry, or you're IBM, or you're Kodak, your blood
379	00:25:42.970	00:25:45.170	is boiling if you're running those companies when you look
380	00:25:45.180	00:25:51.070	at retailers and fast food companies and hotel chains, big
381	00:25:51.080	00:25:55.190	multimillion dollar corporations that don't cover their employees. So that
382	00:25:55.200	00:25:57.680	piece, the quickest way to knock off a big piece
383	00:25:57.690	00:26:00.660	of that is to mandate. But I think in the
384	00:26:00.670	00:26:03.350	basic question, they've done it very well, gone around the
385	00:26:03.360	00:26:09.860	country. They have cobbled together a remarkable array of ideas.
386	00:26:09.870	00:26:12.500	And I think when you look at the 229-page plan,
387	00:26:12.510	00:26:16.320	it's really more of a big barrel of ideas than
388	00:26:16.330	00:26:19.520	it is a plan that dots every "i" and crosses
389	00:26:19.530	00:26:21.660	every "t." And there, I mean, I give them A+
390	00:26:21.670	00:26:23.640	for this, I mean, much better than I ever thought
391	00:26:23.650	00:26:26.860	they could do. And I think Mrs. Clinton has been
392	00:26:26.870	00:26:30.980	remarkable because she's learned so much. I met with her,
393	00:26:30.990	00:26:34.560	for example, on, on covering substance abuse and the importance
394	00:26:34.570	00:26:37.740	of covering substance abuse, which Dr. Healy, I think, shares.
395	00:26:37.750	00:26:39.110	In one way or another we've got to deal with
396	00:26:39.120	00:26:43.050	that problem. She was remarkable. She asked all the tough
397	00:26:43.060	00:26:45.600	questions. She asked us to put together the best people
398	00:26:45.610	00:26:48.850	in the country to put treatment programs together. We did.
399	00:26:48.860	00:26:51.120	We gave them a package. I don't think they've adopted
400	00:26:51.130	00:26:53.500	every bit of it, but they've taken, they've recognized you've
401	00:26:53.510	00:26:56.080	got to cut, you can't have healthcare reform in this
402	00:26:56.090	00:26:58.980	country without doing something about substance abuse. I think they've
403	00:26:58.990	00:27:02.110	done a good job so far. Dr. Healy, do you
404	00:27:02.120	00:27:05.560	think that she has brought the Republicans along? Where--how
405	00:27:05.570	00:27:07.060	do you think the Republicans on the Hill are going
406	00:27:07.070	00:27:09.330	to play this? First, I think that there is no
407	00:27:09.340	00:27:12.470	question that both of the Clintons have done a magnificent
408	00:27:12.480	00:27:15.460	job in making healthcare finally a front burner issue. I
409	00:27:15.470	00:27:18.530	think every American has focused on this issue, and I
410	00:27:18.540	00:27:21.660	do believe it has to be a nonpartisan issue. But
411	00:27:21.670	00:27:24.990	that does not mean that there isn't a very strong
412	00:27:25.000	00:27:29.170	threat of political philosophy that is inherent in the approach
413	00:27:29.180	00:27:32.190	to healthcare solutions. And I think that the Democrats traditionally
414	00:27:32.200	00:27:34.600	think the solution is bigger and bigger government and more
415	00:27:34.610	00:27:37.930	and more taxes, and I think the Republican political philosophy
416	00:27:37.940	00:27:41.700	is smaller government and more empowerment of individual people. Let
417	00:27:41.710	00:27:44.420	taxpayers manage their own money. But, I mean, as a
418	00:27:44.430	00:27:46.980	practical matter, how do you think Republicans are going to
419	00:27:46.990	00:27:49.020	play it here? They don't have the votes to pass
420	00:27:49.030	00:27:51.170	their own plan. What do you think is going to
421	00:27:51.180	00:27:54.940	be important to them, to Republicans, in making changes to
422	00:27:54.950	00:27:58.000	the plan, which Mrs. Clinton has indicated an openness to
423	00:27:58.010	00:28:00.170	do? Well, I think the most important thing is to
424	00:28:00.180	00:28:03.610	work in a constructive way focusing on the people who
425	00:28:03.620	00:28:07.980	are uninsured and not trying a massive social experiment with
426	00:28:07.990	00:28:11.930	over 250 million Americans, 80 percent of whom are adequately
427	00:28:11.940	00:28:15.010	covered. I think that the strategy of the Republicans is
428	00:28:15.020	00:28:18.140	going to have to be to focus on the job
429	00:28:18.150	00:28:20.610	that needs to be done and not to buy into
430	00:28:20.620	00:28:23.920	a massive restructuring of the entire healthcare system in this
431	00:28:23.930	00:28:28.760	country which has economic consequences, as well as human consequences.
432	00:28:28.770	00:28:31.210	Please. Can I just--the issue I don't think is
433	00:28:31.220	00:28:34.570	a Democratic/Republican issue. I think Republicans and Democrats will split
434	00:28:34.580	00:28:37.110	all over the lot. I think the politics of this
435	00:28:37.120	00:28:41.360	issue is one trillion dollars, and it's on the side
436	00:28:41.370	00:28:44.030	of the people that are paying. The federal government's paying.
437	00:28:44.040	00:28:46.610	The states are paying. The cities are paying. Business is
438	00:28:46.620	00:28:49.890	paying, and individuals are paying. They're going to fight over
439	00:28:49.900	00:28:53.080	not paying any more or paying less. On the side
440	00:28:53.090	00:28:55.530	of the people that are getting the trillion dollars, the
441	00:28:55.540	00:29:00.490	health insurance companies, the HMOs, the doctors, the hospitals, the
442	00:29:00.500	00:29:05.450	medical equipment manufacturers, the pharmaceutical companies, the hospital unions, the
443	00:29:05.460	00:29:08.030	nurses, they're going to fight over hanging on to their
444	00:29:08.040	00:29:10.300	piece of the pie. And I don't think this problem
445	00:29:10.310	00:29:13.890	will break in Congress between Republicans and Democrats. I think
446	00:29:13.900	00:29:16.820	it's going to break among those interest groups. And I've
447	00:29:16.830	00:29:20.130	often said I wish the President had been able to
448	00:29:20.140	00:29:24.120	get campaign finance reform through before the healthcare bill went
449	00:29:24.130	00:29:27.320	up because the buckets of money that will pour in
450	00:29:27.330	00:29:29.730	and already are pouring into Capitol Hill, this is the
451	00:29:29.740	00:29:33.470	way this issue will break politically. I think there still
452	00:29:33.480	00:29:36.860	is a core issue that's very polar, and that is,
453	00:29:36.870	00:29:39.500	is the solution going to be government telling you what
454	00:29:39.510	00:29:41.140	to do about your healthcare, or is it going to
455	00:29:41.150	00:29:45.390	be the individual making choices? And, remember, remember, it was
456	00:29:45.400	00:29:47.730	the President and the Vice President who were all over
457	00:29:47.740	00:29:50.000	this country just a few weeks ago telling us that
458	00:29:50.010	00:29:53.260	the government needed to be reinvented. There's a mammoth intellectual
459	00:29:53.270	00:29:57.680	inconsistency in seeing that government inefficiencies with $50 to fill
460	00:29:57.690	00:30:00.290	out one form, which is why government needs to be
461	00:30:00.300	00:30:04.090	reinvented, that same bureaucracy is going to seize 15 percent
462	00:30:04.100	00:30:07.080	of our economy and take over the healthcare of 250
463	00:30:07.090	00:30:10.970	million Americans. That's the core issue. I would urge everybody
464	00:30:10.980	00:30:13.410	to go back and read Richard Nixon's message to Congress
465	00:30:13.420	00:30:17.060	in 1971 and his message to Congress in 1972. What
466	00:30:17.070	00:30:20.550	did he say? He said we need an employer mandate,
467	00:30:20.560	00:30:22.690	and he said, we need more HMOs so we get
468	00:30:22.700	00:30:26.410	people into more efficient healthcare systems. But that's the core
469	00:30:26.420	00:30:29.400	of what Bill Clinton is saying. That's exactly what Jimmy
470	00:30:29.410	00:30:32.060	Carter said. After we looked for about two and a
471	00:30:32.070	00:30:34.590	half years at every alternative, we ended up in the
472	00:30:34.600	00:30:37.400	same place. Okay. That raises a question. All these other
473	00:30:37.410	00:30:42.960	countries, all these industrialized countries have healthcare. Explain why, one,
474	00:30:42.970	00:30:45.590	we don't have any national healthcare, but two, why it's
475	00:30:45.600	00:30:47.780	going to be so much more difficult here than it
476	00:30:47.790	00:30:49.840	was in Europe to get this? We don't have it
477	00:30:49.850	00:30:52.410	I think in part because of something Dr. Healy said,
478	00:30:52.420	00:30:56.210	which is most Americans have healthcare, and there is, there
479	00:30:56.220	00:30:59.430	is a safety net out there. We forget, people that
480	00:30:59.440	00:31:02.170	really get sick or really get hurt get healthcare, they
481	00:31:02.180	00:31:05.000	get it in the most inefficient way, in emergency rooms
482	00:31:05.010	00:31:08.900	of Cleveland Clinic, and elsewhere, and what have you, so
483	00:31:08.910	00:31:12.460	it's there. And the second thing is, in this country
484	00:31:12.470	00:31:17.300	now, I mean, healthcare is almost America's biggest business. It
485	00:31:17.310	00:31:20.410	is the only industry in the country where hundreds of
486	00:31:20.420	00:31:25.050	thousands of jobs were created during the 1990/91 recession, and
487	00:31:25.060	00:31:30.000	there this is as high stakes as political poker gets
488	00:31:30.010	00:31:32.480	in the Congress of the United States. Whereas, of course,
489	00:31:32.490	00:31:35.540	when it was instituted in European Countries, healthcare might be
490	00:31:35.550	00:31:37.400	2 or 3 percent of the GDP. It wasn't a
491	00:31:37.410	00:31:41.490	huge--just take Britain, for example. First of all, it's
492	00:31:41.500	00:31:43.790	a very small percentage but also all they did, people
493	00:31:43.800	00:31:47.480	say, oh, it's socialism. But Britons aren't socialists. What happened
494	00:31:47.490	00:31:50.680	was the voluntary hospital system in Great Britain had broken
495	00:31:50.690	00:31:52.820	down during World War II, and the government was running
496	00:31:52.830	00:31:55.600	every hospital. Every doctor and nurse was in the military,
497	00:31:55.610	00:31:59.010	on the government payroll. They just legislated the existing situation
498	00:31:59.020	00:32:02.780	in 1945. That's what they have done. Incidentally, I will
499	00:32:02.790	00:32:06.730	share one thing. I think Bernadine makes one important point.
500	00:32:06.740	00:32:10.100	The cost part of this equation, the rising healthcare part
501	00:32:10.110	00:32:15.140	of this equation exists in every country in the world.
502	00:32:15.150	00:32:18.220	It's different here because doctors are paid more here, but
503	00:32:18.230	00:32:19.900	we also have a lot of problems. When you look
504	00:32:19.910	00:32:25.650	at Canada, we have AIDS in a way and substance
505	00:32:25.660	00:32:27.700	abuse and violence in a way that other countries don't
506	00:32:27.710	00:32:30.130	have it. Sadly, we're almost out of time for such
507	00:32:30.140	00:32:32.030	a complicated issue. Let me end with one question. And
508	00:32:32.040	00:32:35.260	I'll start with you. Right now, we spend 14 percent
509	00:32:35.270	00:32:38.010	of our GDP on healthcare. The Clintons hope to hold
510	00:32:38.020	00:32:40.720	to 17 percent by the year 2000. Can a modern
511	00:32:40.730	00:32:44.890	society be economically healthy spending just that much on healthcare
512	00:32:44.900	00:32:48.930	for its citizens? Does it make sense? Well, I think
513	00:32:48.940	00:32:52.230	it is expensive, it's good value, but it cannot continue
514	00:32:52.240	00:32:54.640	to rise at the rate it's been rising. Everyone agrees.
515	00:32:54.650	00:32:56.860	That's where I think there is consensus across the board,
516	00:32:56.870	00:32:58.820	and I think some of the positive aspects of the
517	00:32:58.830	00:33:01.810	Hilton--of the Clinton health plan is that it does
518	00:33:01.820	00:33:05.310	talk about administrative inefficiencies, it talks about a universal health
519	00:33:05.320	00:33:07.990	insurance form, which will be a blessing for everyone, would
520	00:33:08.000	00:33:11.820	probably save billions of dollars. It talks about tort reform.
521	00:33:11.830	00:33:16.650	It also talks about tax deductibility for premiums of people
522	00:33:16.660	00:33:18.890	who are self-insured. So there are a lot of elements
523	00:33:18.900	00:33:20.700	in there that will help to drive down the cost
524	00:33:20.710	00:33:22.750	of care, but we have to be careful that when
525	00:33:22.760	00:33:27.220	we speak about making healthcare cost efficient that we take
526	00:33:27.230	00:33:29.540	out the fat and don't cut into the bones and
527	00:33:29.550	00:33:33.610	the muscles because America is not ready to say no
528	00:33:33.620	00:33:36.870	to transplantation, to kidney dialysis, as many countries around the
529	00:33:36.880	00:33:39.540	world do. America's not ready to say, we're not going
530	00:33:39.550	00:33:42.290	to save that baby who's only a thousand grams. Other
531	00:33:42.300	00:33:46.640	countries do. Mr. Califano. I think--I mean, I think
532	00:33:46.650	00:33:50.050	we can hold the rate, the proportion of GNP, but
533	00:33:50.060	00:33:52.710	let's not be unrealistic. Healthcare costs are going to rise.
534	00:33:52.720	00:33:54.410	What we're talking about is the rate of increase. You're
535	00:33:54.420	00:33:56.890	not going to bring 40 million people--you know, it's
536	00:33:56.900	00:33:58.800	not going to be good for my father, my mother,
537	00:33:58.810	00:34:01.150	my wife, or my child--into this system and keep
538	00:34:01.160	00:34:04.470	the cost the same. And I think we have recognize
539	00:34:04.480	00:34:06.510	and be realistic about that. I think we can hold
540	00:34:06.520	00:34:09.970	them. I think that in terms of, of the big
541	00:34:09.980	00:34:13.980	ticket items, cultural changes, like the way people think about
542	00:34:13.990	00:34:15.760	dying, whether they want to be tied up to tubes
543	00:34:15.770	00:34:17.660	or be at home, will have a greater impact than
544	00:34:17.670	00:34:20.530	any of the law or regulation those people are writing.
545	00:34:20.540	00:34:23.010	Well, thank you both very much. And we'll welcome you
546	00:34:23.020	00:34:26.310	back to watch the speech together. Thanks, Roger. Over to
547	00:34:26.320	00:34:38.000	you, Roger. Next, we look at one health reform model
548	00:34:38.010	00:34:41.000	that is already up and running. The city of Rochester,
549	00:34:41.010	00:34:43.770	New York, has a unique healthcare system that President Clinton
550	00:34:43.780	00:34:47.520	has praised as worth learning from. Medical Correspondent Fred De
551	00:34:47.530	00:34:51.180	Sam Lazaro has this report on the Rochester system. It
552	00:34:51.190	00:34:55.630	first aired on the NewsHour in February. For 21-year-old Jason
553	00:34:55.640	00:34:58.420	Bowman, it's been an arduous journey back to a normal
554	00:34:58.430	00:35:02.270	routine two years after it was interrupted by a severe
555	00:35:02.280	00:35:10.870	car accident. And I fractured my C-6/C-7 vertebrae, which left
556	00:35:10.880	00:35:13.310	me paralyzed. And that was the only thing that happened
557	00:35:13.320	00:35:18.460	actually was a broken neck, and I didn't suffer any
558	00:35:18.470	00:35:22.510	broken bones or legs. It was a whiplash kind of
559	00:35:22.520	00:35:26.260	an injury? Yes. Hearing the word "quadriplegic," when you know
560	00:35:26.270	00:35:33.410	what it means is pretty devastating, and so you know
561	00:35:33.420	00:35:36.380	that you're in for--you're going to be locked into
562	00:35:36.390	00:35:39.380	the healthcare system for quite a while. Given that grim
563	00:35:39.390	00:35:42.500	diagnosis, Jim and Barbara Bowman say their son has made
564	00:35:42.510	00:35:46.650	a remarkable recovery, which they attribute to a ferocious spirit
565	00:35:46.660	00:35:50.940	and superb but expensive medical care. Jason's medical bills have
566	00:35:50.950	00:35:54.010	neared a quarter of a million dollars. Almost all of
567	00:35:54.020	00:35:59.640	it was covered under his parents' insurance policy. The Bowmans
568	00:35:59.650	00:36:03.200	run a veterinary hospital with eight employees. In most of
569	00:36:03.210	00:36:06.510	the U.S. Jason's bills would have jacked up the premiums
570	00:36:06.520	00:36:09.840	on their group health insurance. That's not the case here
571	00:36:09.850	00:36:13.100	in Rochester, New York. We pay the same premiums that
572	00:36:13.110	00:36:16.440	anyone else pays. We've had rate increases, but they're across-the-board
573	00:36:16.450	00:36:21.030	and according to whatever the overall increase in healthcare is
574	00:36:21.040	00:36:23.510	for the area. He hasn't been singled out in any
575	00:36:23.520	00:36:27.940	way, as we can see, because of what he's cost
576	00:36:27.950	00:36:30.930	the system or because of his injury or because he
577	00:36:30.940	00:36:33.640	will be an ongoing burden to the system. Here in
578	00:36:33.650	00:36:36.870	Rochester those premiums are about a third less than anywhere
579	00:36:36.880	00:36:39.980	else in the U.S. As a result, only 6 percent
580	00:36:39.990	00:36:44.010	of Rochester's citizens do not carry insurance, far fewer than
581	00:36:44.020	00:36:48.740	the 14 percent on average nationally who are uninsured. Four
582	00:36:48.750	00:36:54.000	factors account for Rochester's relatively high access and affordability: One
583	00:36:54.010	00:36:57.370	insurer, Blue Cross Blue Shield, has a virtual monopoly in
584	00:36:57.380	00:37:01.030	the city; there is little overlap in the services healthcare
585	00:37:01.040	00:37:05.990	facilities provide; the insurer and healthcare providers set fees after
586	00:37:06.000	00:37:10.230	tough bargaining; and no one is denied insurance coverage, not
587	00:37:10.240	00:37:13.910	even the sick. Their insurance premiums are determined by a
588	00:37:13.920	00:37:21.320	mechanism known as community rating. In other words, the risk
