index	starts	ends	content
603	00:38:41.000	00:38:45.300	the more relaxed atmosphere of morning television. Here she watches
604	00:38:45.310	00:38:50.170	underwear model Antonio Sabato demonstrate his fitness with a two
605	00:38:50.180	00:38:54.150	finger pushup...and when the cameras stop rolling, she tries
606	00:38:54.160	00:39:03.560	it herself, in front of a live audience. But what
607	00:39:03.570	00:39:07.720	about CBS? Even with its new studio and a familiar
608	00:39:07.730	00:39:10.450	face in Bryant Gumbel and a fresh face in Jane
609	00:39:10.460	00:39:14.570	Clayson, can the network rise from its perennial third place
610	00:39:14.580	00:39:16.750	status in the morning? Who else is going to be
611	00:39:16.760	00:39:22.340	part of the cast? Bill Carroll of the Katz Television
612	00:39:22.350	00:39:26.900	Group is not so sure. He advises network-affiliated stations on
613	00:39:26.910	00:39:31.360	programming. Most CBS affiliates, he says, are making money with
614	00:39:31.370	00:39:35.730	their own local news broadcasts in the crucial seven-to-eight o'clock
615	00:39:35.740	00:39:38.010	hour. One of the big hurdles they're going to have
616	00:39:38.020	00:39:44.710	to face is in the most recent CBS morning incarnation,
617	00:39:44.720	00:39:49.220	a number of their stations established a 7:00 to 8:00
618	00:39:49.230	00:39:55.370	AM local presence, and a very successful local presence, and
619	00:39:55.380	00:39:58.650	in many of those markets, they're going to take a
620	00:39:58.660	00:40:02.550	"wait and see" attitude on the Bryant Gumbel effort. But
621	00:40:02.560	00:40:08.980	doesn't that condemn the new CBS effort to lower ratings?
622	00:40:08.990	00:40:10.590	Yeah, it's going to be a problem. What are you
623	00:40:10.600	00:40:13.860	going to recommend to your clients, the affiliates? Leave the
624	00:40:13.870	00:40:18.420	local news that's working at 7:00 o'clock, and run the
625	00:40:18.430	00:40:24.150	new Bryant Gumbel Early Show at 8:00 o'clock. CBS reported
626	00:40:24.160	00:40:27.530	this week that three-quarters of its affiliates plan to carry
627	00:40:27.540	00:40:31.230	the new broadcast in its entirety. Bryant Gumbel says the
628	00:40:31.240	00:40:35.950	key to overcoming the remaining affiliate reluctance is, well, news.
629	00:40:35.960	00:40:39.640	Our first half hour is going to be as hard
630	00:40:39.650	00:40:42.910	a news half hour as there is on television and
631	00:40:42.920	00:40:45.190	as comprehensive a, a news half hour as there is
632	00:40:45.200	00:40:48.940	on television because we firmly believe, that if you don't
633	00:40:48.950	00:40:53.470	deliver the news you lose--plain and simple. Beyond news,
634	00:40:53.480	00:40:56.470	Friedman says he is prepared to cut special deals to
635	00:40:56.480	00:41:01.380	book high profile, marquee guests...deals such as promising multiple
636	00:41:01.390	00:41:05.350	appearances, a kind of journalistic horse trading that the Today
637	00:41:05.360	00:41:09.070	Show recently renounced. So, you're ready to deal? I'm ready
638	00:41:09.080	00:41:11.330	to deal. And the Today Show says they're not going
639	00:41:11.340	00:41:14.510	to deal. They won't deal unless they're forced to. Maybe
640	00:41:14.520	00:41:17.840	they will, maybe they won't. Katie Couric says they won't.
641	00:41:17.850	00:41:20.840	I think deal making is very dangerous in this business.
642	00:41:20.850	00:41:24.150	Why? Because you can be held hostage by a movie
643	00:41:24.160	00:41:28.940	company, a publicist, an actor or actress, an author who
644	00:41:28.950	00:41:32.910	obviously wants maximum air time but it gets into the
645	00:41:32.920	00:41:38.720	editorial decision-making where it's inappropriate. You know, you're doing eight
646	00:41:38.730	00:41:43.080	parts on a movie that frankly ain't very good or
647	00:41:43.090	00:41:47.920	doesn't deserve that much national airtime. The Today Show displayed
648	00:41:47.930	00:41:51.130	its draw for top talent and willingness to pounce this
649	00:41:51.140	00:41:55.610	week, when it scooped up singer Mariah Carey. CBS had
650	00:41:55.620	00:41:57.840	planned to kick off The Early Show with a Carey
651	00:41:57.850	00:42:01.810	concert outside their studio on Fifth Avenue. When they failed
652	00:42:01.820	00:42:05.420	to get permits in time for Carey's deadline, she bolted
653	00:42:05.430	00:42:07.570	to the Today Show. There are going to be some
654	00:42:07.580	00:42:12.010	ferocious, behind the scenes battles for the top names. Beyond
655	00:42:12.020	00:42:14.690	the booking wars, there is the content of the show
656	00:42:14.700	00:42:18.830	itself. Will the hard news approach work for CBS? Author
657	00:42:18.840	00:42:22.570	Richard Hack has his doubts. The idea that CBS has
658	00:42:22.580	00:42:25.660	for The Early Show is to make it more edgy,
659	00:42:25.670	00:42:28.950	hard news type of broadcast. Bryant Gumbel works very well
660	00:42:28.960	00:42:32.010	in that type of format and of course CBS has
661	00:42:32.020	00:42:35.370	a lot of history doing that kind of show. Unfortunately,
662	00:42:35.380	00:42:39.750	nobody has remembered that it doesn't work. What happens with
663	00:42:39.760	00:42:42.710	that kind of program is that you get people to
664	00:42:42.720	00:42:45.300	tune in, they expect to see the Today Show, they
665	00:42:45.310	00:42:48.550	expect to see Good Morning America, what they get is
666	00:42:48.560	00:42:55.070	CNN. If they wanted CNN, they would tune in CNN.
667	00:42:55.080	00:42:58.570	But Bryant Gumbel thinks his prospects--and those of CBS--
668	00:42:58.580	00:43:03.200	have never been brighter. I'm going into this, obviously, expecting
669	00:43:03.210	00:43:08.700	to do well, and hoping to do well, but I'm
670	00:43:08.710	00:43:11.580	not going to slit my wrists, you know? Perhaps not.
671	00:43:11.590	00:43:14.980	But executives at CBS News--and the other cash strapped
672	00:43:14.990	00:43:18.500	news divisions--recognize that the morning time slot
673	00:43:18.510	00:43:22.020	is their best opportunity to build audiences and in the
674	00:43:22.030	00:43:35.270	process, prop up the bottom line. Finally tonight, the visit
675	00:43:35.280	00:43:39.510	of Nigeria's new leader to Washington. Ray Suarez has that
676	00:43:39.520	00:43:44.260	story. Early this year, for the first time in 15
677	00:43:44.270	00:43:48.800	years, Nigerians chose their president, and nearly 30 million citizens
678	00:43:48.810	00:43:52.400	cast ballots that ended 16 years of military rule in
679	00:43:52.410	00:43:56.510	the West African nation. Nigeria, about twice the size of
680	00:43:56.520	00:43:59.530	California, was once on the road to becoming a wealthy
681	00:43:59.540	00:44:02.700	nation. It's one of the world's top oil producers. But
682	00:44:02.710	00:44:05.950	for years, corrupt governments and businesses have been accused of
683	00:44:05.960	00:44:10.060	siphoning off much of the wealth. Most of Nigeria's 110
684	00:44:10.070	00:44:16.020	million people live in poverty. During military rule, political repression
685	00:44:16.030	00:44:20.520	in Nigeria drew intense criticism. And the 1995 hanging of
686	00:44:20.530	00:44:24.520	poet and human rights crusader Ken Saro-Wiwa and several others
687	00:44:24.530	00:44:29.640	brought international pressure to penalize Nigeria. International bodies voted to
688	00:44:29.650	00:44:34.640	sanction the country, but were largely ineffective. But after the
689	00:44:34.650	00:44:38.910	death of General Sani Abacha, the country's military rulers agreed
690	00:44:38.920	00:44:42.410	to an election. The winner was a former military ruler,
691	00:44:42.420	00:44:47.830	General Olusegun Obasanjo, now in traditional garb instead of army
692	00:44:47.840	00:44:52.380	green. Obasanjo served as president in the late 70's. He
693	00:44:52.390	00:44:56.860	voluntarily relinquished power in 1979 to a civilian government that
694	00:44:56.870	00:45:01.200	was later overthrown by the military. Obasanjo spent three years
695	00:45:01.210	00:45:07.580	in prison for criticizing military rule. Despite allegations of vote
696	00:45:07.590	00:45:12.390	fraud, international monitors called the elections fair. The mood was
697	00:45:12.400	00:45:16.560	festive when Obasanjo came forward to greet the nation. The
698	00:45:16.570	00:45:24.160	people of Nigeria have made their choice. I am humbled
699	00:45:24.170	00:45:32.800	by the fact that I, Olusegun Obasanjo, am that choice.
700	00:45:32.810	00:45:36.410	During his campaign, Obasanjo promised that his government would fight
701	00:45:36.420	00:45:40.110	the corruption that made millionaires out of military cronies, and
702	00:45:40.120	00:45:44.710	makes his country frightening to investors. President Clinton after yesterday's
703	00:45:44.720	00:45:47.770	talks with the new Nigerian leader, backed up his call
704	00:45:47.780	00:45:52.480	for increased aid, and some forgiveness of Nigeria's crushing debt.
705	00:45:52.490	00:45:56.250	President Obasanjo's election in May has signaled a new day
706	00:45:56.260	00:46:00.190	for Nigeria, and a new hope for Africa. It is
707	00:46:00.200	00:46:05.940	very much in America's interests that Nigeria succeed, and therefore
708	00:46:05.950	00:46:10.580	we should assist them in their success. We intend to
709	00:46:10.590	00:46:14.200	increase our assistance to Nigeria, to expand law enforcement cooperation
710	00:46:14.210	00:46:16.840	and to work toward an agreement to stimulate trade and
711	00:46:16.850	00:46:20.080	investment between us. We intend to do what we can
712	00:46:20.090	00:46:24.870	to help Nigeria recover assets plundered by the previous regime.
713	00:46:24.880	00:46:27.190	But we must do more to realize the promise of
714	00:46:27.200	00:46:31.910	this moment for Nigeria and for Africa. President Obasanjo says,
715	00:46:31.920	00:46:34.770	if he doesn't pass power to an elected civilian after
716	00:46:34.780	00:46:37.970	his term, he will have failed. During an interview this
717	00:46:37.980	00:46:41.880	morning he stressed his country's progress and America's interests in
718	00:46:41.890	00:46:48.200	Africa's success. In recent speeches you've talked about Nigeria as
719	00:46:48.210	00:46:52.780	being a potentially great country. Certainly it's always been a
720	00:46:52.790	00:46:58.840	potentially rich country. President Clinton yesterday talked about relieving some
721	00:46:58.850	00:47:03.700	of the debt burden of heavily indebted countries. But oil
722	00:47:03.710	00:47:08.260	prices are low right now. How can you sort of
723	00:47:08.270	00:47:17.100	get the engine of the economy going? Well, President Clinton
724	00:47:17.110	00:47:28.540	got it right when he said that taking the economic
725	00:47:28.550	00:47:35.710	and social indicators as they are today, Nigeria is potentially
726	00:47:35.720	00:47:42.090	a rich country but as of today is a poor
727	00:47:42.100	00:47:50.440	country. If you like, you may even say it's not
728	00:47:50.450	00:47:55.250	that poor a country because the riches are there in
729	00:47:55.260	00:48:04.220	its human resources. And natural resources are good--but it
730	00:48:04.230	00:48:09.560	is an impoverished country. As long as Nigeria has to
731	00:48:09.570	00:48:15.440	be at the bottom of the excessive debt that hangs
732	00:48:15.450	00:48:19.560	over its head now, so long will it not be
733	00:48:19.570	00:48:25.500	able to come out or to actualize its potential. So
734	00:48:25.510	00:48:27.960	what we are saying is that for Nigeria to actualize
735	00:48:27.970	00:48:32.620	its potential it needs a lifeline, and the lifeline is
736	00:48:32.630	00:48:40.670	to help us out of its burden of debt. One
737	00:48:40.680	00:48:43.400	of the popular slogans here in Washington when you talk
738	00:48:43.410	00:48:50.850	about Africa is "trade, not aid." Doesn't Nigeria need both?
739	00:48:50.860	00:48:55.700	Fact, Africa needs both. Before you can trade, you have
740	00:48:55.710	00:49:02.510	to be in a position to prepare what you, the
741	00:49:02.520	00:49:07.750	ware that will you trade in; and to prepare the
742	00:49:07.760	00:49:11.090	ware that will you trade in, you need to be
743	00:49:11.100	00:49:17.060	helped--and that is the initial aid--to be helped
744	00:49:17.070	00:49:23.460	in a position of skill, to be helped in education,
745	00:49:23.470	00:49:30.380	to be helped even in the simple thing of how
746	00:49:30.390	00:49:34.920	do you package what you want to trade in, the
747	00:49:34.930	00:49:39.960	product, how is it packaged? Where do you look for
748	00:49:39.970	00:49:46.050	market? How do you advertise? All these will need to
749	00:49:46.060	00:49:52.340	learn and in learning those--what I call the nuts
750	00:49:52.350	00:49:58.020	and bolts--you need assistance. That's where the aid comes
751	00:49:58.030	00:50:02.910	before trade; but yes, trade not aid. But I will
752	00:50:02.920	00:50:07.640	say a little bit of aid, which will then assist--
753	00:50:07.650	00:50:12.400	a little bit of aid, which will then assist trade.
754	00:50:12.410	00:50:16.480	Nigerian troops have been in several countries in West Africa
755	00:50:16.490	00:50:24.160	in recent years; the region has had many troubles. As
756	00:50:24.170	00:50:28.570	we watch your country move into a new era trying
757	00:50:28.580	00:50:33.340	to solve some of its own problems internally, could we
758	00:50:33.350	00:50:37.740	expect that Nigeria will look inward and be less involved
759	00:50:37.750	00:50:41.430	in its region? No, we won't look inward. I believe
760	00:50:41.440	00:50:49.810	that we have a responsibility beyond our borders for peace
761	00:50:49.820	00:50:54.870	and stability in our sub-region, indeed, in our region, and
762	00:50:54.880	00:51:01.930	that's the reason why we must be strong internally--politically
763	00:51:01.940	00:51:10.140	stable--strong--and economically vibrant and buoyant. Mr. President, in
764	00:51:10.150	00:51:15.400	recent decades Americans have become quite used to bad news--
765	00:51:15.410	00:51:20.260	a steady stream of bad news from Africa. But there's
766	00:51:20.270	00:51:26.420	much bright news, too: Two big democracies, Nigeria and South
767	00:51:26.430	00:51:32.870	Africa, new on the horizon; big regional powers in their
768	00:51:32.880	00:51:36.910	parts of the continent. How does that change what happens
769	00:51:36.920	00:51:41.770	in the other countries that are neighbors of you both?
770	00:51:41.780	00:51:52.970	Well, bad news. I think I will not want America
771	00:51:52.980	00:51:57.930	to be ignored so that they expect that there can
772	00:51:57.940	00:52:01.560	be no good news from any part of the world.
773	00:52:01.570	00:52:10.980	In fact, America must make effort to ensure that good
774	00:52:10.990	00:52:14.690	news comes from all parts of the world as much
775	00:52:14.700	00:52:21.400	as possible. But having said that, the situation in South
776	00:52:21.410	00:52:30.610	Africa and Nigeria must give great hope to the two
777	00:52:30.620	00:52:38.050	countries, citizens of the two countries, and to Africans generally,
778	00:52:38.060	00:52:42.090	and to the world in particular. Now that there is
779	00:52:42.100	00:52:45.740	an elected government in your country, are you more able
780	00:52:45.750	00:52:48.900	to reach out to other parts of the continent, to
781	00:52:48.910	00:52:53.950	be welcome in other places around the world, than perhaps
782	00:52:53.960	00:52:59.120	General Abacha had been and his government? Naturally. The international
783	00:52:59.130	00:53:11.790	community stood firm and supported Nigerians through a turning to
784	00:53:11.800	00:53:17.600	fight against tyranny and of oppression of military differences with
785	00:53:17.610	00:53:30.140	Abacha. And when that struggle was successfully reached, the international
786	00:53:30.150	00:53:39.230	community became more receptive to the new dispensation and the
787	00:53:39.240	00:53:43.770	new leadership in Nigeria. And we are grateful to them
788	00:53:43.780	00:53:46.340	for that and we are grateful to God, and we
789	00:53:46.350	00:53:51.730	are grateful to our own citizens who, out of sheer
790	00:53:51.740	00:54:00.490	determination, stood firm and said, "no," and no matter what
791	00:54:00.500	00:54:05.840	it cost them. And it cost some of our compatriots
792	00:54:05.850	00:54:11.490	their lives. It cost some of us our freedom. It
793	00:54:11.500	00:54:18.330	cost some other form of deprivation. But in the end,
794	00:54:18.340	00:54:23.740	the Nigerians won. When you yourself were in jail, many
795	00:54:23.750	00:54:28.310	of your country men and women were killed, many people
796	00:54:28.320	00:54:33.690	are poor. It must be difficult to ask for patience
797	00:54:33.700	00:54:38.110	when people have done without for a long time. They
798	00:54:38.120	00:54:41.050	know that even though they have no electricity, in many
799	00:54:41.060	00:54:45.380	places, running water, that ten or twenty miles away there
800	00:54:45.390	00:54:50.240	are people with laptop computers and Mercedes Benzes. How do
801	00:54:50.250	00:54:54.290	you keep them on the road and looking forward to
802	00:54:54.300	00:54:59.860	the future? Now, there is really nothing like hope. When
803	00:54:59.870	00:55:07.140	people have hope, they have almost, they can have anything,
804	00:55:07.150	00:55:09.880	and they can wait for anything. It's when there is
805	00:55:09.890	00:55:16.620	no hope that you are frustrated out of this world.
806	00:55:16.630	00:55:20.990	What has happened in Nigeria today is that the expectations
807	00:55:21.000	00:55:25.450	are high. People who have been deprived, people who have
808	00:55:25.460	00:55:31.590	been suppressed, they now have these freedoms. They breathe new
809	00:55:31.600	00:55:37.880	fresh air and they are seeing things that are happening,
810	00:55:37.890	00:55:44.630	and they can wait. If five months ago if you
811	00:55:44.640	00:55:49.600	had to queue for twenty-four hours at the petrol station
812	00:55:49.610	00:55:54.740	to get fuel, and today we don't have to do
813	00:55:54.750	00:56:01.530	that--we can drive in and drive out--that is
814	00:56:01.540	00:56:06.500	the feeling that is pervading the air in Nigeria today,
815	00:56:06.510	00:56:17.040	the feeling of high expectation and hope that--not futile
816	00:56:17.050	00:56:26.610	expectation and hope, but expectation that can see result, and
817	00:56:26.620	00:56:35.550	therefore is fruitful expectation. Well, Mr. President, I want to
818	00:56:35.560	00:56:38.360	thank you for giving us some of your time today.
819	00:56:38.370	00:56:47.960	Thank you very much. Again, the major stories of this
820	00:56:47.970	00:56:52.490	Friday: President Clinton proposed new rules to protect patients' privacy,
821	00:56:52.500	00:56:56.470	the first federal regulations designed to keep computerized medical records
822	00:56:56.480	00:57:01.140	confidential. And Russia rejected international calls for diplomacy and launched
823	00:57:01.150	00:57:04.600	a new wave of attacks in Chechnya. We'll see you
824	00:57:04.610	00:57:08.070	online, and again here Monday evening. Have a nice weekend.
825	00:57:08.080	01:01:34.413	I'm Jim Lehrer. Thank you, and good night.
